58b36eefcd4d74221a0001fd	Breaking News: President Trump's budget outline calls for a surge in military spending and sharp cuts to nondefense agencies including the E.P.A.	2017-02-26T19:12:28-05:00		NYTimes.com	93097	\['sharp increases' 'director' 'calls' 'volley' 'management' 'sharp cuts' 'outline' 'federal agencies' 'surge' 'four' 'mick mulvaney' 'entitlement programs' 'defense department spending major cuts' 'social security' 'fiscal year' 'nondefense agencies' 'medicare' 'trump' 'instruct' 'environmental protection agency' 'e.p.a.' \trump's\ 'agencies' 'budget' 'trump’s' 'reductions' 'senior administration officials']|President Trump will instruct federal agencies on Monday to assemble a budgetfor the coming fiscal year that would include sharp increases in DefenseDepartment spending; major cuts to other agencies including the EnvironmentalProtection Agency; and no reductions to the largest entitlement programs SocialSecurity and Medicare according to four senior administrationofficials.
58b62b1bcd4d746e65000020	Breaking News: President Trump is about to address a joint session of Congress for the first time. Join us for live video and analysis.	2017-02-28T20:59:39-05:00	https://www.nytimes.com/interactive/2017/02/28/us/politics/trump-congress-address-live-video-analysis.html	NYTimes.com	93214	['address' 'initial speech' 'trump’s' 'reporters' 'joint session' 'analysis' 'editors' 'york' 'real-time analysis' 'live video' 'join' 'trump']	Join New York Times reporters and editors for real-time analysis of PresidentTrump’s initial speech to Congress.
58b64f43cd4d746e65000034	Breaking News: President Trump stuck to the script and G.O.P. orthodoxy in a speech to Congress that laid out a broad agenda but few specifics	2017-02-28T23:34:09-05:00		NYTimes.com	93218	['specifics president' 'immigrants' 'new openness' 'millions' 'overhauling health care' 'legal status' 'script' 'nation’s infrastructure' 'military' 'trump' 'tax code' 'g.o.p.' 'broad agenda' 'orthodoxy' 'specifics' 'speech' 'serious crimes']	orthodoxy in a speech to Congress that laid out a broad agenda but few specifics President Trump signaled a new openness on Tuesday to granting legal statusto millions of undocumented immigrants who have not committed serious crimesand in a speech he then called on Congress to work with him on overhaulinghealth care changing the tax code and rebuilding the nation’sinfrastructure and military.
58b77035cd4d746e6500005d	Breaking News: In their final days Obama aides spread intelligence on Trump associates and Russia across agencies as a trail for investigators	2017-03-01T20:06:50-05:00		NYTimes.com	93280	['communications' 'clear trail' 'trail' 'aims' 'meetings' 'associates' 'american allies' 'others' 'mr. trump’s' 'isn’t' 'trump' 'evidence' '—' 'agencies' 'russian' 'final days' 'investigators' 'aides' 'american intelligence agencies' 'kremlin' 'vladimir v. putin' 'president-elect' 'russia' 'contacts' 'dutch' 'american officials' 'government investigators' 'obama' 'european elections' 'european cities' 'separately' 'intelligence' 'anonymity' 'information' 'officials' 'ensure' 'russia’s' 'three' 'officials —']	In their final days Obama aides spread intelligence on Trump associates and Russia across agencies as a trail for investigators American allies including the British and the Dutch had providedinformation describing meetings in European cities between Russian officials— and others close to Russia’s president Vladimir V. Putin —and associates of President-elect Trump according to three former Americanofficials who requested anonymity in discussing classified intelligence.
58b82fa3cd4d746e6500006b	Breaking News: Two House G.O.P. leaders urged the attorney general to recuse himself from an inquiry into Russian contacts with the Trump campaign	2017-03-02T09:43:17-05:00		NYTimes.com	93328	['testimony' 'g.o.p.' 'leaders' 'house' 'russian government' 'jeff sessions' 'sessions' 'confirmation hearing' 'contradiction' 'mr' 'attorney general' 'investigation' 'russian ambassador' 'russian' 'calls' 'disclosure' 'attorney' 'contacts' 'ranks' 'recuse' 'campaign' 'trump' 'inquiry']	leaders urged the attorney general to recuse himself from an inquiry into Russian contacts with the Trump campaign Congressional Republicans began breaking ranks on Thursday to join Democratsin demanding that Attorney General Jeff Sessions recuse himself from overseeingan investigation into contacts between the Trump campaign and the Russiangovernment.
58b88e46cd4d746e6500008e	Breaking News: The attorney general recused himself from any inquiry on Trump aides' Russian ties after his talks with the ambassador were revealed	2017-03-02T16:27:17-05:00		NYTimes.com	93356	['criticism' '2016' 'trump' 'conversations' 'russian ambassador' 'inquiry' 'attorney' 'contacts' 'sergey i. kislyak' 'chorus' 'hillary clinton’s' 'attorney general' 'presidential election' 'investigation' 'ambassador' 'russian ties' 'campaign' 'aides' 'russian' 'jeff sessions']	The attorney general recused himself from any inquiry on Trump aides' Russian ties after his talks with the ambassador were revealed Attorney General Jeff Sessions facing a chorus of criticism over hiscontacts with the Russian ambassador recused himself Thursday from aninvestigation of Russian meddling in the 2016 presidential election.
58b9b206cd4d746e650000a1	Breaking News: Janet Yellen says the Fed will raise interest rates this month earlier than expected barring economic surprises	2017-03-03T13:12:05-05:00		NYTimes.com	93434	['rate increase' 'chicago' 'notice' 'benchmark interest rate' 'intensification' 'economic surprises' 'fed' 'federal reserve chairwoman' 'communication' 'unpleasant economic surprises' 'officials' 'janet yellen' 'breaking news janet yellen' 'investors' 'recent days' 'fed’s' 'janet l. yellen' 'interest rates' 'ms. yellen’s' 'declaration' 'speech']	Ms. Yellen’s declaration in a speech inChicago capped an intensification in the Fed’s communication in recentdays as officials put investors on notice that a rate increase was coming soonerthan had been widely expected.
58b9c828cd4d746e650000a4	Breaking News: Uber has for years used its app to secretly identify and sidestep law enforcement officials where it was restricted or banned	2017-03-03T14:46:36-05:00		NYTimes.com	93437	['tool' 'greyball' 'program' 'circumvent officials' 'sidestep law enforcement officials' 'involves' 'techniques' 'uber' 'uses data' 'app' 'uber’s' 'identify' 'breaking news uber']	Uber has for years used its app to secretly identify and sidestep law enforcement officials where it was restricted or banned The program which involves a tool called Greyball uses data collected fromUber’s app and other techniques to identify and circumvent officials.
58bac4d8cd4d740bd3000005	Breaking News: The U.S. has tried to sabotage North Korea's missile program with covert cyber attacks. President Trump must decide what to do next.	2017-03-04T08:44:28-05:00		NYTimes.com	93461	\['united states' 'threats' \korea's\ 'ability' 'u.s.' 'missile programs' 'korea’s' 'test launches' 'review' 'ago president' 'administrations' 'examination' 'korean' 'mr. obama' 'barack obama' 'urgent problem' 'danger' 'seconds' 'disruption effort' 'public records' 'sabotage' 'pose' 'obama' 'covert cyber attacks' 'cyber' 'pentagon officials' 'interviews' 'missile program' 'pentagon’s' 'york times’s' 'trump' 'counter' 'confront' 'officials' 'resilient' 'electronic strikes' 'obscure' 'experts thought']|Anexamination of the Pentagon’s disruption effort based on interviews withofficials of the Obama and Trump administrations as well as a review ofextensive but obscure public records found that the United States still doesnot have the ability to effectively counter the North Korean nuclear and missileprograms.
58bc8547cd4d740bd300001d	Breaking News: The F.B.I. chief asked Justice officials to reject President Trump's claim that Barack Obama tapped his phones. But the agency has not.	2017-03-05T16:38:11-05:00		NYTimes.com	93509	\['agency' 'assertion' 'young administration' 'f.b.i.' 'conspiracy' 'justice department' 'situation underscores' 'barack obama' 'high stakes' 'reject president' 'corrected' 'director' 'weekend' 'justice officials' 'phones' 'aides' 'chief' 'phones senior' 'james b. comey' 'mr. comey' 'mr. trump’s' 'trump’s' \trump's\ 'american officials']|director James B. Comey asked the Justice Department thisweekend to publicly reject President Trump’s assertion that PresidentBarack Obama ordered the tapping of his phones senior American officials saidon Sunday.
58bd7b6fcd4d740bd300002c	Breaking News: The Supreme Court has vacated an appeals court ruling in favor of a transgender boy in light of a move by the Trump administration	2017-03-06T10:08:26-05:00		NYTimes.com	93564	['trump' 'light' 'federal government’s position' 'major case' 'appeals court ruling' 'public schools' 'administration' 'bathrooms' 'gender identities' 'supreme court' 'favor' 'transgender youths' 'transgender rights' 'transgender boy' 'move']	The Supreme Court has vacated an appeals court ruling in favor of a transgender boy in light of a move by the Trump administration The Supreme Court on Monday announced that it would not hear a major case ontransgender rights after all acting after the Trump administration changed thefederal government’s position on whether public schools had to allowtransgender youths to use bathrooms that matched their gender identities.
58bd898fcd4d740bd3000032	Breaking News: The Supreme Court ruled that confidential jury deliberations must be disclosed if there's evidence of racial bias by jurors	2017-03-06T11:08:30-05:00		NYTimes.com	93567	['discrimination” justice' 'jurors' 'strides' 'racial bias' 'anthony m. kennedy' 'exception' 'supreme court' 'evidence' 'the nation' 'majority' 'ethnic bias' 'courts' 'confidential jury deliberations' 'discussions' 'usual rule' 'jury deliberations']	The Supreme Court ruled that confidential jury deliberations must be disclosed if there's evidence of racial bias by jurors The Supreme Court ruled on Monday that courts must make an exception to theusual rule that jury deliberations are secret when evidence emerges that thosediscussions were marred by racial or ethnic bias.
58bd906bcd4d740bd3000037	Breaking News: President Trump issued a more limited executive order on immigration. The changes are meant to help it withstand a court challenge.	2017-03-06T11:37:51-05:00		NYTimes.com	93568	['defense departments' 'iraqi' 'countries' 'african' 'nations' 'ban' 'residents' 'court challenge' 'trump' 'federal judges' 'version' 'citizens' 'original travel ban' 'changes' 'order' 'activities' 'muslim' 'federal agencies' 'mr. trump’s' 'white house' 'seven' 'immigration' 'migrants' 'executive order']	The order which comes about a month after federal judgesblocked Mr. Trump’s haphazardly implemented ban in January on residentsfrom seven Middle Eastern and African countries was delayed for about a week asthe White House sought to better coordinate its activities with federalagencies.
58bdf87ecd4d740bd300004a	Breaking News: The Republican replacement for Obamacare scraps mandated insurance in favor of incentives for people to buy it on the open market	2017-03-06T19:01:50-05:00	http://p.nytimes.com/email/re	NYTimes.com	93578	['replacement' 'incentives' 'obamacare' 'tax credits' 'favor' 'mandate' 'repeal' 'insurance' 'open market' 'health insurance' 'purchase health care' 'scraps' 'care act' 'system' 'open market house']	The Republican replacement for Obamacare scraps mandated insurance in favor of incentives for people to buy it on the open market House Republicans unveiled their long-awaited plan to repeal and replace theAffordable Care Act scrapping the mandate that nearly all Americans have healthinsurance and replacing it with a system of tax credits aimed at enticingAmericans to purchase health care on the open market.
58c211d4cd4d740bd3000093	Breaking News: A South Korean court has removed President Park Geun-hye from office a decision that could reshape the strategic landscape in Asia	2017-03-09T21:38:59-05:00		NYTimes.com	93749	['relationships' 'government' 'business' 'hundreds' 'strategic landscape' 'president park' 'court' 'reshape' 'asia' 'korean' 'streets week' 'tense time' 'geun-hye' 'top echelons' 'months' 'delicate balance' 'decision' 'corruption scandal' 'thousands' 'turmoil' 'nation’s history' 'removal' 'koreans' 'shook']	A South Korean court has removed President Park Geun-hye from office a decision that could reshape the strategic landscape in Asia A South Korean court ousted the president on Friday a first in thenation’s history rattling the delicate balance of relationships acrossAsia at a particularly tense time.
58c2ae0fcd4d740bd30000a6	Breaking News: The U.S. economy grew by 235000 jobs last month paving the way for the Federal Reserve to raise interest rates next week	2017-03-10T08:45:38-05:00		NYTimes.com	93800	['overlaps' 'federal reserve' 'trump’s' 'average' 'hefty gain' '4.7' '0.2' 'full month' 'path' 'employers' 'earnings' 'jobs' 'payrolls' 'government' '235000' 'u.s.' 'official jobless' 'interest rates' 'benchmark interest rate' 'workers' 'economy']	The U.S. economy grew by 235000 jobs last month paving the way for the Federal Reserve to raise interest rates next week Employers added 235000 workers to their payrolls in February the governmentreported on Friday a hefty gain that clears the path for the Federal Reserve toraise its benchmark interest rate when it meets next week.
58c44219cd4d740bd30000bb	Breaking News: U.S. Attorney Preet Bharara is refusing to resign forcing a potential showdown with President Trump and the Justice Department	2017-03-11T13:29:23-05:00		NYTimes.com	93868	['potential showdown' 'others' 'breaking news u.s.' 'trump' 'u.s.' 'resign' 'department' 'resignation' '—' 'submit' 'federal prosecutor' '45' 'preet bharara' 'manhattan' 'attorney' 'justice' 'justice department']	U.S. Attorney Preet Bharara is refusing to resign forcing a potential showdown with President Trump and the Justice Department Preet Bharara the Manhattan federal prosecutor who was told to submit hisresignation along with 45 others on Friday has no plans to do so —forcing a potential showdown with President Trump and the Department ofJustice.
58c45842cd4d740bd30000be	Breaking News: Preet Bharara the powerful U.S. attorney in Manhattan who refused to resign has been fired	2017-03-11T15:03:47-05:00		NYTimes.com	93870	['manhattan' 'mr. bharara’s' 'attorney' 'political appointee' 'barack obama' 'order' 'predecessor president' 'mr. trump’s' 'breaking news preet bharara' 'u.s.' 'resign' 'trump' 'preet bharara' 'election' 'submit' 'resignation' 'extraordinary showdown' 'federal prosecutor' 'dismissal']	Preet Bharara the powerful U.S. attorney in Manhattan who refused to resign has been fired Preet Bharara the Manhattan federal prosecutor who was asked by PresidentTrump to remain in his post shortly after the election was fired on Saturdayafter he refused an order to submit his resignation.
58c701cdcd4d740bd30000df	Breaking News: 24 million would lose insurance under the G.O.P. health bill within a decade the nonpartisan Congressional Budget Office found	2017-03-13T16:32:01-04:00		NYTimes.com	93932	['budget' 'conservatives' 'health bill' 'country’s health care system' 'providers' 'numbers' '24 million' 'legislation' 'nonpartisan' 'bill' 'g.o.p.' 'legislation’s' 'american health' 'care act' 'widespread criticism' 'effects' 'party' 'insurance' 'decade' 'health care']	The American HealthCare Act as Republicans call their bill was already facing widespreadcriticism from providers of health care some conservatives and a unitedDemocratic Party.
58c9654dcd4d740bd3000106	Breaking News: The U.S. charged 2 Russian spies and 2 others in a 2014 breach of 500 million Yahoo accounts that included the theft of personal data	2017-03-15T12:00:58-04:00		NYTimes.com	94464	['conspiracy' 'accounts' '47' 'one' 'four' 'conspiracy computer fraud' 'theft' 'roles' 'personal data' '500 million' 'men' 'yahoo' 'russian spies' 'others' 'u.s.' '2014' 'federal prosecutors' 'news release' 'trade secrets' 'economic espionage theft' 'identity theft' 'breach' 'russian intelligence agents' 'criminal charges' '2' 'data breaches' 'justice department']	The U.S. charged 2 Russian spies and 2 others in a 2014 breach of 500 million Yahoo accounts that included the theft of personal data Federal prosecutors announced charges against four men including two Russianintelligence agents on Wednesday for their roles in a conspiracy that led tothe 2014 theft of 500 million Yahoo accounts one of the largest known databreaches.
58c9864ccd4d740bd3000113	Breaking News: The Fed raised interest rates for the third time since the financial crisis. We'll be covering Janet Yellen's news conference live.	2017-03-15T14:21:49-04:00		NYTimes.com	94475	\['federal reserve' 'unemployment' \janet yellen's\ 'news conference live' 'financial crisis' 'fed' 'reflection' 'inflation' 'benchmark interest rate' '2008' 'janet yellen’s' 'increase' 'interest rates' 'rates' 'healthier level' 'we’ll']|Itwas the third time since the financial crisis of 2008 that it raised rates areflection that unemployment is now at a healthier level and inflation isstarting to increase.
58c98be9cd4d740bd3000116	Breaking News: The Republican leader of House Intelligence Committee cast doubt on President Trump's claim that he was wiretapped	2017-03-15T14:45:33-04:00		NYTimes.com	94476	\['trump’s' 'phones' 'actual tap' 'california' 'don’t' 'leader' 'we don’t' 'capitol' 'devin nunes republican' 'news conference' 'barack obama' 'trump' \trump's\ 'indication' 'house intelligence' '—' 'hill' 'time people we’ve' 'in fact' 'evidence' 'committee cast doubt' 'trump tower.”.' 'place' 'repudiation' 'mr. trump’s' 'representative' 'twitter' 'trump tower' 'presidential campaign' '2016' 'mr. nunes']|The Republican leader of House Intelligence Committee cast doubt on President Trump’s claim that he was wiretapped In a striking repudiation of President Trump Representative Devin NunesRepublican of California said he had seen no indication of Mr. Trump’sclaim on Twitter that former President Barack Obama wiretapped his phones inTrump Tower during the 2016 presidential campaign.
58c9ec28cd4d740bd300012f	Breaking News: In a test of European populism Geert Wilders's anti-Islam party gained seats but a big majority of Dutch voters rejected his views	2017-03-15T21:36:25-04:00		NYTimes.com	94497	\['anti-islam party' 'momentum' 'european populism' 'muslim' 'immigrants' 'stall' 'others' 'seats' 'early results' 'test' 'elections' 'expectations' 'foreseen' 'extreme positions' 'geert wilders' 'far-right politician' 'results hold' 'anti-muslim forces' \geert wilders's\ 'fracture' 'decisive portion' 'exit polls' 'support' 'mr. wilders' 'big majority' 'symbolize' 'voters' 'tallies' 'populist' 'union' 'europe' 'dutch']|In a test of European populism Geert Wilders's anti-Islam party gained seats but a big majority of Dutch voters rejected his views The far-right politician Geert Wilders fell short of expectations in Dutchelections on Wednesday gaining seats but failing to persuade a decisive portionof voters to back his extreme positions on barring Muslim immigrants andjettisoning the European Union according to early results and exitpolls.
58cbcf70cd4d740bd3000161	Breaking News: The U.S. secretary of state said a freeze of North Korea's nuclear program was not enough and warned of pre-emptive action	2017-03-17T07:58:32-04:00		NYTimes.com	94689	\['bargaining table' 'weapons program' 'mr. tillerson’s' 'threat' 'beijing' 'trump' 'intercontinental ballistic missile' 'program' 'year’s' 'unacceptable level' 'effort' 'country’s leader' 'missile programs' 'launch' 'secretary' 'states' 'elevate' 'travels' 'preparation' 'chinese leaders' 'pre-emptive action' 'kim jong-un' 'comments' 'administration' 'pre-emptive action secretary' 'korea’s' 'pre-emptive action “if' 'rex w. tillerson' 'nuclear program' 'korea' 'return' 'u.s.' \korea's\ 'negotiation' 'final stages' 'seoul']|Mr. Tillerson’s comments inSeoul a day before he travels to Beijing to meet Chinese leaders explicitlyrejected any return to the bargaining table in an effort to buy time by haltingNorth Korea’s accelerating testing program which the country’sleader Kim Jong-un said on New Year’s Day was in the “finalstages” of preparation for the first launch of an intercontinentalballistic missile that could reach the United States.
58cbefbccd4d740bd3000162	Breaking News: President Trump's aides tried to soothe angry leaders in Britain after suggesting their spies wiretapped Trump Tower	2017-03-17T10:16:10-04:00		NYTimes.com	94697	\['president’s' 'trump tower' 'london’s' 'apologies' 'mcmaster' 'british media' 'candidate' 'international ally' 'comment' 'trump' 'britain' 'barack obama' 'national security adviser' 'white house press secretary' 'white house' 'unusual rupture' 'british officials' 'h.r.' 'spy agency' 'spies' 'aides' 'conduct' \trump's\ 'soothe' 'lt' 'sean spicer' 'angry leaders' 'united states' 'secret surveillance']|President Trump's aides tried to soothe angry leaders in Britain after suggesting their spies wiretapped Trump Tower The White House tried to soothe an angry Britain after suggesting thatPresident Barack Obama used London’s spy agency to conduct secretsurveillance on President Trump while he was a candidate last year.
58cc0a18cd4d740bd3000164	Breaking News: The Nobel laureate Derek Walcott is dead at 87. His poetry captured the beauty of the Caribbean and the harsh legacy of colonialism.	2017-03-17T12:08:43-04:00		NYTimes.com	94701	['complexities' 'gros islet' 'nobel' 'colonialism' 'physical beauty' 'derek walcott' 'cultural worlds' 'lucia' '87' 'prize' 'laureate' 'metaphorical poetry' 'literature' 'caribbean' 'beauty' 'poetry' 'st' 'harsh legacy']	Derek Walcott whose intricately metaphorical poetry captured the physicalbeauty of the Caribbean the harsh legacy of colonialism and the complexities ofliving and writing in two cultural worlds bringing him a Nobel Prize inLiterature died early Friday morning at his home near Gros Islet in St. Lucia.
58cc383ecd4d740bd300016f	Breaking News: President Trump stood by his wiretapping claim at a news conference with Angela Merkel. Pressed on it he responded with a joke.	2017-03-17T15:25:18-04:00		NYTimes.com	94708	['chancellor' 'news conference' 'mr. obama’s' 'white house news conference' 'common perhaps.”.' 'assertion' 'mr. trump' 'turning' 'joke' 'said “at' 'ms. merkel' 'administration' 'telephone' 'germany mr. trump' 'repeat' 'barack obama' 'united states' 'angela merkel' 'trump' 'visit' 'foreign leaders' 'joint' 'pressed']	At a joint White House news conference with Chancellor Angela Merkel ofGermany Mr. Trump wryly used her visit to repeat his unsubstantiated assertionthat Barack Obama ordered his telephone tapped last year.
58cdb719cd4d740bd3000189	Breaking News: Chuck Berry whose distinctive guitar licks duckwalks and songs about girls and cars helped define rock 'n' roll has died at 90	2017-03-18T18:39:05-04:00		NYTimes.com	94747	\['medical emergency' 'st' 'charles' 'rock ’n’ roll’s potential' 'department' 'cars' 'measures' 'chuck berry' 'songs' 'unsuccessful' 'early years' 'wild dance parties' 'cars girls' 'page' 'breaking news chuck berry' 'facebook' 'distinctive guitar licks duckwalks' 'girls' 'county' 'attitude' 'death' 'memorable songs' 'missouri' 'indelible guitar licks brash self-confidence' \rock 'n' roll\ '90']|Chuck Berry whose distinctive guitar licks duckwalks and songs about girls and cars helped define rock 'n' roll has died at 90 Chuck Berry who with his indelible guitar licks brash self-confidence andmemorable songs about cars girls and wild dance parties did as much as anyoneto define rock ’n’ roll’s potential and attitude in its earlyyears died on Saturday.
58cfedb7cd4d740bd30001ae	Breaking News: The F.B.I. is investigating Russia's meddling in the U.S. election and its links with the Trump campaign the agency's director confirmed	2017-03-20T10:56:50-04:00		NYTimes.com	94793	\['trump' 'video' 'u.s.' 'updates' 'f.b.i.' 'agency’s director' '2016' \agency's director\ 'director' 'russia’s' 'election' 'existence' 'campaign' 'interference' 'investigation' 'russian' 'join' 'public hearing' 'house intelligence committee’s' 'links' 'hearing' 'james b. comey']|director James B. Comey confirmed the existence of theinvestigation at the House intelligence committee’s first public hearingon Russian interference in the 2016 election.
58d0fd1bcd4d740bd30001d6	Breaking News: The U.S. has barred devices larger than a cellphone on American-bound foreign flights from 8 majority-Muslim countries	2017-03-21T06:14:19-04:00		NYTimes.com	94825	['foreign flights' 'foreign airlines' 'administration' 'passengers' 'eight' 'electronic devices' 'devices' 'new flight restriction' 'united states' 'cellphone' 'airports' 'officials' 'majority-muslim countries' 'foreign airport security' 'credible threat' '8' 'u.s.' 'imminent attack' 'trump' 'american-bound' 'directive' '10' 'attempt' 'address gaps']	The U.S. has barred devices larger than a cellphone on American-bound foreign flights from 8 majority-Muslim countries Passengers on foreign airlines headed to the United States from 10 airportsin eight majority-Muslim countries have been barred from carrying electronicdevices larger than a cellphone under a new flight restriction enacted onTuesday by the Trump administration.
