5893e9ffcd4d7466ce00001f	Breaking News: President Trump is embracing key aspects of Barack Obama's strategy refusing to lift sanctions on Russia and imposing new ones on Iran	2017-02-02T21:24:41-05:00		NYTimes.com	91420	\['settlements' 'russia' 'ballistic missile tests' 'trump' 'key pillars' 'sanctions' 'new ones' 'strategy' \barack obama's\ 'foreign policy' 'curb construction' 'administration’s strategy' 'iran' 'warning' 'barack obama' 'crimea' 'israel' 'key aspects']|President Trump is embracing key aspects of Barack Obama's strategy refusing to lift sanctions on Russia and imposing new ones on Iran President Trump after promising a radical break with the foreign policy ofBarack Obama is embracing key pillars of the former administration’sstrategy including warning Israel to curb construction of settlementsdemanding that Russia withdraw from Crimea and threatening Iran with sanctionsfor ballistic missile tests.
5894d2c7cd4d744b50000004	Breaking News: President Trump and Republican lawmakers have begun an assault on financial regulation. Democrats called it a gift to Wall Street.	2017-02-03T13:58:13-05:00		NYTimes.com	91469	['wall street' 'gift' 'tear' 'financial regulation' 'repeat' 'steps' 'lawmakers' 'campaign' 'trump' 'advice' '2008' 'wall street titans' 'array' 'financial crisis' 'turning' 'all-out assault' 'safeguards' 'assault']	President Trump mounted an all-out assault on financial regulation on Fridayannouncing an array of steps to tear down safeguards enacted to prevent a repeatof the 2008 financial crisis and turning to the Wall Street titans he haddemonized during his campaign for advice.
5894e188cd4d744b50000008	Breaking News: President Trump's order led the U.S. to revoke most visas from 7 countries -- officially about 60000 though a lawyer said more	2017-02-03T15:00:42-05:00		NYTimes.com	91471	\['60000.”.' 'lawyer' 'virginia' 'revoke' 'travelers' 'chaos' 'united states' 'hearing however' 'part' '60000' 'seven' 'countries —' '7' 'judge' 'fewer' \trump's\ 'federal court' 'trump’s' 'figure' 'number' 'visas' 'policy' 'plaintiff said' 'government' '100000' 'order' 'move' 'court' 'state department' 'u.s.' 'muslim' 'countries']|President Trump’s order led the U.S. to revoke most visas from 7 countries — officially about 60000 though a lawyer said more A lawyer for the United States government said in federal court in Virginiaon Friday that more than 100000 visas had been revoked as part of PresidentTrump’s policy halting travelers from seven predominantly Muslimcountries a move a judge said was causing “chaos” a lawyer for theplaintiff said.
58967b2acd4d744b50000034	Breaking News: The Trump administration moved to appeal a ruling blocking its immigration order just as the nation began opening its doors again	2017-02-04T20:08:40-05:00		NYTimes.com	91538	['nation' 'justice department' 'immigration order' 'nations' 'house’s' 'government' 'administration' 'ruling' 'federal judge' 'nation’s doors' 'overturned' 'criticism' 'seven' 'travelers' 'muslim' 'fusillade' 'trump' 'court ruling' 'doors' 'refugees']	The Trump administration moved to appeal a ruling blocking its immigration order just as the nation began opening its doors again A day after a federal judge temporarily blocked the White House’simmigration order the government on Saturday began opening the nation’sdoors again to refugees and travelers from seven predominantly Muslim nationseven as President Trump unleashed a fusillade of criticism against the courtruling and the Justice Department moved to have it overturned.
5897f013cd4d744155000019	Breaking News: The New England Patriots are champs again erasing a 25-point deficit to beat Atlanta 34-28 in the first Super Bowl to go to overtime	2017-02-05T22:39:39-05:00	https://www.nytimes.com/2017/02/05/sports/super-bowl-score-patriots-falcons.html	NYTimes.com	91559	['overtime' 'tom brady' 'champs again' 'bowl history' 'england patriots' 'quarterback' 'bowl' 'titles' '25-point deficit' 'atlanta' '34-28' 'one' 'five' 'patriots' 'comebacks']	The New England Patriots are champs again erasing a 25-point deficit to beat Atlanta 34-28 in the first Super Bowl to go to overtime Tom Brady became the first quarterback to win five titles when the Patriotscompleted one of the greatest comebacks in Super Bowl history.
58990ae7cd4d74415500002c	Breaking News: The Justice Department urged an appeals court to reinstate President Trump's travel ban saying national security depends on it	2017-02-06T18:46:23-05:00		NYTimes.com	91643	\['administration’s brief' 'important judicial test yet' 'travel ban' \trump's\ 'young presidency' 'challenge' 'national security' 'reinstate president' 'disruptive initiative' 'one' 'appeals court' 'trump’s' 'appellate ruling' 'justice department' 'yield']|The Justice Department urged an appeals court to reinstate President Trump's travel ban saying national security depends on it With the filing of the administration’s brief the challenge to thetravel ban the most ambitious and disruptive initiative of PresidentTrump’s young presidency is now ready for its most important judicialtest yet one that will yield the first appellate ruling.
589a07adcd4d744155000035	Breaking News: Betsy DeVos has been confirmed as education secretary -- barely. The vice president had to break a tie a first for a cabinet pick.	2017-02-07T12:45:11-05:00		NYTimes.com	91689	['vouchers' 'charter schools' 'betsy devos' '51-to-50 vote elevates' 'vice president' 'nation’s schools' 'tie' 'public school system —' 'cabinet pick' 'nominee —' 'wealthy philanthropist' 'life' 'education secretary' 'breaking news betsy devos' 'steward' 'education secretary — barely' 'educational choice' 'barely' 'experience']	The 51-to-50 vote elevates the embattled nominee — a wealthyphilanthropist who has devoted much of her life to expanding educational choicethrough charter schools and vouchers but has limited experience with the publicschool system — to be steward of the nation’s schools.
589a5377cd4d744155000046	Live: An appeals court is about to hear arguments on President Trump's immigration ban. Get live video and analysis from Times reporters.	2017-02-07T18:08:35-05:00	https://www.nytimes.com/interactive/2017/02/07/us/ninth-circuit-oral-arguments-trump-immigration.html	NYTimes.com	91698	\['analysis' 'san francisco' 'federal judge' 'young administration' 'hears arguments' 'travel ban' 'arguments' 'immigration ban' 'seattle' \trump's\ 'appeals court' 'reporters' 'trump’s' 'four' 'appeals' 'video' 'big legal test' 'trump' 'circuit court']|President Trump gets the first big legal test of his young administration asthe Ninth Circuit Court of Appeals based in San Francisco hears arguments overhis targeted travel ban four days after a federal judge in Seattle blockedit.
589a6d05cd4d74415500004a	Breaking News: An appellate panel expressed skepticism over Justice Dept. arguments in favor of President Trump's targeted travel ban	2017-02-07T19:57:37-05:00		NYTimes.com	91700	\['warning' \trump's\ 'order' 'seven' 'broad defense' 'executive order' 'nation’s airports' 'skepticism' 'nation’s refugee program' 'protests' 'impose immigration restrictions' '27' 'travel' 'entry' 'justice' 'appellate panel' 'countries' 'dept' 'three-judge' 'favor' 'travel ban' 'mr. trump’s' 'arguments' 'national security concerns' 'president’s power' 'department’s' 'federal appeals panel' 'muslim' 'trump’s']|arguments in favor of President Trump's targeted travel ban A three-judge federal appeals panel voiced skepticism Tuesday at the JusticeDepartment’s broad defense of President Trump’s targeted travel banduring arguments over the president’s power to impose immigrationrestrictions based on national security concerns.
589bc3c4cd4d744155000073	Breaking News: Jeff Sessions has been confirmed as attorney general a day after a Senate flare-up over Elizabeth Warren's criticism of his record	2017-02-08T20:19:54-05:00		NYTimes.com	91798	\['mr. trump' 'ranks' 'nomination battle' 'support' 'procedural' 'jeff sessions republican' 'alabama' 'colleague' 'elizabeth warren’s' 'attorney general' 'sessions' 'top law enforcement' 'trump’s' \elizabeth warren's\ 'senate floor' 'strains' 'record senator' 'senate' 'near-party-line vote' 'elizabeth warren' 'jeff sessions' 'extreme partisanship' 'decades' 'senator' 'criticism' 'record' 'cabinet' 'install' 'mr' 'massachusetts' 'senate flare-up' 'nation’s' 'breaking news jeff sessions']|Jeff Sessions has been confirmed as attorney general a day after a Senate flare-up over Elizabeth Warren’s criticism of his record Senator Jeff Sessions Republican of Alabama was confirmed on Wednesday asPresident Trump’s attorney general capping a bitter and racially chargednomination battle that crested with the procedural silencing of a leadingDemocrat Senator Elizabeth Warren of Massachusetts who had criticized theAlabama senator from the Senate floor.
589cfb5dcd4d74221a000011	Breaking News: President Trump's travel ban remains blocked: An appeals court rejected a bid to reinstate it. An appeal to the Supreme Court is likely.	2017-02-09T18:29:15-05:00		NYTimes.com	91987	\['likely' 'effort' 'courts' 'court' 'decision' \trump's\ 'lawfulness' 'ruling' 'reinstate president' 'reinstate it' 'supreme court' 'blocked' 'appeals court' 'bid' 'federal appeals court' 'entry' 'trump’s' 'standards' 'campaign' 'narrow question' 'states' 'judicial rebuke' 'appeal' 'travel ban' 'united states']|A federal appeals court on Thursday refused to reinstate PresidentTrump’s targeted travel ban delivering the latest and most stingingjudicial rebuke to his effort to make good on a campaign promise and tighten thestandards for entry into the United States.
589d2391cd4d74221a000017	Breaking News: Is the president of China giving President Trump the silent treatment? Some officials think so citing Mr. Trump's early provocations.	2017-02-09T21:20:48-05:00		NYTimes.com	91990	\['administration officials' 'major reason' \mr. trump's\ 'letter' 'disclose' 'commits' 'phone' 'unorthodox telephone' 'trump' 'taiwan' 'policy' 'china' 'silent treatment' 'chinese government' 'xi jinping' 'beijing' '14' 'friendly gesture' 'mr. trump' 'mr. xi' 'early provocations' 'stung' 'mr. trump’s' 'white house' 'officials' 'subsequent assertion' 'one' 'united states' 'elected' 'mr. trump.']|Stung by Mr. Trump’s unorthodoxtelephone call with the president of Taiwan and his subsequent assertion thatthe United States might no longer abide by the “One China” policyMr. Xi has not spoken to Mr. Trump since Nov. 14 the week after he was elected.
58a0c410cd4d74221a000051	Breaking News: Al Jarreau has died at 76. The versatile singer won seven Grammy Awards for his work in pop R&B and his first love jazz.	2017-02-12T15:22:24-05:00		NYTimes.com	92211	['work' 'pop' 'vocalizations' 'clicks' 'growls' 'virtuosic ability' 'particular' 'seven' 'breaking news al jarreau' 'full-time musical career' 'rb' 'love jazz' '30' 'quasi-instrumental sounds' 'grammy awards' 'delicious nonsense' 'versatile singer' '76' 'preacher’s son' 'late 1960s' 'supple voice' 'array' 'critics' 'boy' 'al jarreau' 'improvisational skill and']	Critics praised his supple voice his improvisational skill and inparticular his virtuosic ability to produce an array of vocalizations rangingfrom delicious nonsense to clicks and growls to quasi-instrumental sounds.
58a13e11cd4d74221a000060	Breaking News: Adele tearfully accepted album of the year at the Grammys and sets by Beyonce and A Tribe Called Quest were the talk of the show	2017-02-13T00:03:02-05:00		NYTimes.com	92224	['breaking news adele' 'show' 'award' 'grammys' 'quest' 'race' 'every child' 'lemonade.”.' 'song' 'tribe' 'beyonce' '25' 'motherhood' 'album' 'pride' 'record' 'performance' 'hello' 'beyonce' 'adele' 'urban contemporary album']	Adele tearfully accepted album of the year at the Grammys and sets by Beyoncé and A Tribe Called Quest were the talk of the show Adele won album of the year for “25” and both record of year andsong of the year for “Hello” and Beyoncé gave a showstoppingperformance celebrating motherhood and she championed pride for “everychild of every race” when she accepted the award for best urbancontemporary album for “Lemonade.”.
58a26eeecd4d74221a000086	Breaking News: Michael Flynn the national security adviser is said to have misled senior officials about his conversation with a Russian diplomat	2017-02-13T21:43:34-05:00		NYTimes.com	92359	['russia’s' 'united states' 'administration officials' 'justice department' 'assuage' 'apparent attempt' 'white house' 'breaking news michael flynn' 'american adversary' 'russia' 'protocol' 'remarkable breach' 'vladimir v. putin’s' 'office —' 'conversation' 'regime' 'blackmail' 'policy —' 'topic' 'sanctions' 'senior official' 'mr. pence' 'inauguration' 'mr. flynn' 'weeks' 'senior officials' 'michael flynn' 'american sanctions' 'mere discussion' 'russian diplomat' 'national security adviser' 'call' 'ambassador' 'trump' 'phone']	Michael Flynn the national security adviser is said to have misled senior officials about his conversation with a Russian diplomat The Justice Department warned the White House that Mr. Flynn had misledsenior Trump administration officials about whether he had discussed Americansanctions against Vladimir V. Putin’s regime during a phone call withRussia’s ambassador to the United States weeks before the inaugurationand that he could be open to blackmail by Russia said a former seniorofficial.
58a2843dcd4d74221a00008e	Breaking News: Michael Flynn is said to have resigned as President Trump's national security adviser facing accusations about his dealings with Russia	2017-02-13T23:14:41-05:00		NYTimes.com	92361	\['trump' 'dealings' 'night' 'administration' 'russian ambassador' 'michael flynn' 'conversations' 'mike pence' 'national security adviser' 'top white house officials' 'vice president' 'russia michael t. flynn' 'breaking news michael flynn' 'states' \trump's\ 'accusations' 'russia']|Michael Flynn is said to have resigned as President Trump's national security adviser facing accusations about his dealings with Russia Michael T. Flynn the national security adviser resigned on Monday nightafter it was revealed that he had misled Vice President Mike Pence and other topWhite House officials about his conversations with the Russian ambassador to theUnited States according to a source close to the Trump administration.
58a336accd4d74221a0000a6	Breaking News: President Trump faces a new test: Russia has secretly deployed a cruise missile that violates a crucial arms treaty officials say	2017-02-14T11:55:39-05:00		NYTimes.com	92420	['new test' 'trump' 'violation' 'test phase' 'obama' 'russia' 'crucial arms treaty officials' 'administration' 'system' 'treaty' 'center' '1987' 'missile' 'faces' 'operational unit' '2014' 'one' 'land' 'russian intermediate-range missiles' 'violates' 'cruise missile']	President Trump faces a new test: Russia has secretly deployed a cruise missile that violates a crucial arms treaty officials say The ground-launched cruise missile at the center of American concerns is onethat the Obama administration said in 2014 had been tested in violation of a1987 treaty that bans American and Russian intermediate-range missiles based onland.
58a343e9cd4d74221a0000ac	Breaking News: The nearly 40-year case of Etan Patz the first missing child shown on a milk carton is solved. An ex-deli worker was convicted.	2017-02-14T12:52:36-05:00		NYTimes.com	92421	['murder' 'stock clerk' 'store’s basement' 'manhattan' 'investigators' '6-year-old' 'etan patz' '40-year mystery' 'children' '40-year case' 'solved' 'kidnapping' 'child' 'pedro hernandez' 'milk carton' 'way parents' 'bodega' 'convicted' 'ex-deli worker']	Pedro Hernandez a former stock clerk in a Manhattan bodega who confessed toluring the 6-year-old Etan Patz into the store’s basement and attackinghim was found guilty on Tuesday of murder and kidnapping a long-awaited steptoward solving the nearly 40-year mystery that bedeviled investigators andforever changed the way parents watched over their children.
58a3521bcd4d74221a0000b1	Breaking News: President Trump knew for weeks that Michael Flynn wasn't truthful about his Russian calls his spokesman said leading to his firing	2017-02-14T13:52:56-05:00		NYTimes.com	92423	['truthful' 'national security adviser' 'trusted' 'white house' 'trump' 'russian calls' 'wasn’t truthful' 'resignation' 'spokesman said' 'mr. flynn’s' 'michael flynn' 'weeks']	President Trump knew for weeks that Michael Flynn wasn’t truthful about his Russian calls his spokesman said leading to his firing President Trump asked for Mr. Flynn’s resignation as national securityadviser after concluding he could not be trusted the White House said onTuesday.
58a36483cd4d74221a0000b7	Breaking News: The F.B.I. questioned Michael Flynn early in his tenure about his calls with Russia officials said raising the stakes of the scandal	2017-02-14T15:11:16-05:00		NYTimes.com	92424	['innocuous' 'trump' 'expose' 'felony charge' 'resignation' 'russian sanctions' 'officials said raising' 'tenure' 'interview' 'scandal' 'night' 'mr. flynn' 'conversations' 'f.b.i.' 'mr. flynn’s' 'russia' 'stakes' 'calls' 'ambassador' 'michael flynn' 'false']	questioned Michael Flynn early in his tenure about his calls with Russia officials said raising the stakes of the scandal If Mr. Flynn was not entirely honest with the F.B.I. it could expose him toa felony charge.
58a3bd2bcd4d74221a0000c6	Breaking News: Intercepted calls show members of the Trump campaign had repeated contact with Russian intelligence before the election officials said	2017-02-14T21:29:34-05:00		NYTimes.com	92430	['intelligence agencies' 'calls' 'trump' 'campaign' 'committee' 'officials said' 'presidential election' 'russian' 'contact' 'election' 'three' 'disrupt' 'members' 'intercepted' 'russia' 'intelligence' 'evidence' 'american law enforcement' 'communications' 'election officials' 'breaking news intercepted' 'efforts']	Intercepted calls show members of the Trump campaign had repeated contact with Russian intelligence before the election officials said American law enforcement and intelligence agencies intercepted thecommunications around the same time that they were discovering evidence thatRussia was trying to disrupt the presidential election by hacking into theDemocratic National Committee three of the officials said.
58a4c1bdcd4d74221a0000e6	Breaking News: President Trump's pick for labor secretary Andrew Puzder has withdrawn amid doubts that he'd have enough votes to be confirmed	2017-02-15T16:01:23-05:00		NYTimes.com	92492	\['andrew puzder' 'intense fire' 'ex-wife' 'he’d' 'personal life' 'fast-food chain owner' 'attacks' 'intense scrutiny' 'trump’s' 'votes' 'workers' 'cke restaurants' \trump's\ 'policy' 'carl’s jr' 'hardee’s' 'liberal groups' 'labor secretary' 'doubts' 'allegations' '1980s' 'minimum wage' \he'd\ 'chief executive' 'automation' 'workplace']|President Trump’s pick for labor secretary Andrew Puzder has withdrawn amid doubts that he’d have enough votes to be confirmed The chief executive of the CKE Restaurants fast-food chain owner ofHardee’s and Carl’s Jr. had come under intense fire from Democratsand liberal groups who accused him of mistreating his workers opposing theminimum wage and supporting automation in the workplace.
58a74134cd4d74221a000133	Breaking News: A seasoned legal opponent of the E.P.A. will now run it. Scott Pruitt was confirmed after Senate Democrats' all-night protest.	2017-02-17T13:29:58-05:00		NYTimes.com	92705	['voters' 'democrats joe manchin iii' 'maine' 'oklahoma' 'e.p.a.’s' 'mr. pruitt' 'major environmental rules' 'senators' 'virginia' 'legal opponent' 'heidi heitkamp' 'all-night protest' '52-46' 'career' 'agency’s authority' 'environmental rules' 'e.p.a.' 'attorney general' 'one' 'dissolution' 'democrats' 'republican susan collins' 'coal-rich states' 'scott pruitt' 'party lines' 'senate']	One Republican Susan Collins of Maine crossedparty lines to vote against Mr. Pruitt while two Democrats Joe Manchin III ofWest Virginia and Heidi Heitkamp both from coal-rich states where votersgenerally oppose environmental rules voted for him.
58ab4f40cd4d74221a00016d	Breaking News: Lt. Gen. H.R. McMaster a widely respected military strategist has been named President Trump's national security adviser	2017-02-20T15:18:42-05:00		NYTimes.com	92791	\['tremendous talent' 'trump' 'a man' 'national security adviser president' 'national security adviser' 'new national security adviser' 'mcmaster' \trump's\ 'lt' 'military strategist' 'h.r.' 'tremendous experience.”.']|McMaster a widely respected military strategist has been named President Trump's national security adviser President Trump picked Lt. Gen. H.R.
58ac6c01cd4d74221a00017e	Breaking News: The Trump administration detailed its new immigration policy which greatly expands the categories of people subject to deportation	2017-02-21T11:33:38-05:00		NYTimes.com	92818	['homeland' 'trump' 'administration' 'new immigration policy' 'deportation' 'categories' 'security' 'expands' 'people subject' 'nation’s immigration laws' 'immigration' 'department' 'border security' 'executive orders' 'trump’s' 'documents' 'agency enforces' 'policy']	The Trump administration detailed its new immigration policy which greatly expands the categories of people subject to deportation The Department of Homeland Security on Tuesday released a set of documentstranslating President Trump’s executive orders on immigration and bordersecurity into policy bringing a major shift in the way the agency enforces thenation’s immigration laws.
58add520cd4d74221a000197	Breaking News: Seven newly identified planets orbiting a nearby star offer a realistic chance to seek signs of life beyond the solar system	2017-02-22T13:14:48-05:00		NYTimes.com	92866	['solar system' 'one' 'away offering' 'harbor life' 'nearby star' 'signs' 'tiny star' 'realistic opportunity' 'earth-size' 'biological signs' 'planets' 'seven' 'alien life' 'realistic chance' 'life']	Seven newly identified planets orbiting a nearby star offer a realistic chance to seek signs of life beyond the solar system Not just one but seven Earth-size planets that could potentially harbor lifehave been identified orbiting a tiny star not too far away offering the firstrealistic opportunity to search for biological signs of alien life outside ofthe solar system.
58ae35fbcd4d74221a0001ab	Breaking News: The Trump administration has rescinded protections for transgender students that allowed them to use bathrooms of their choice	2017-02-22T20:08:05-05:00		NYTimes.com	92878	['federal rules' 'transgender students' 'trump’s' 'bathrooms' 'advice' 'choice' 'gender identity' 'trump' 'middle' 'protections' 'culture wars' 'administration' 'behind' 'education secretary' 'new policy']	The Trump administration has rescinded protections for transgender students that allowed them to use bathrooms of their choice The Trump administration on Wednesday rescinded federal rules that allowedtransgender students to use the bathrooms corresponding with their genderidentity.
58af8fbbcd4d74221a0001c5	Breaking News: A banned chemical weapon VX nerve agent was used to kill the half-brother of North Korea's dictator the Malaysian police said	2017-02-23T20:43:20-05:00		NYTimes.com	92983	\['khalid abu bakar' '2005' '1997' \korea's\ 'malaysian' 'poison' 'chemical weapon' 'kim-jong-nam' 'half-brother' 'brother' 'vx' 'korean' 'nerve agent' 'substance' 'national police chief' 'weapons conventions' 'dictator' 'leader' 'kim jong-un' 'brief statement' 'korea’s']|A banned chemical weapon VX nerve agent was used to kill the half-brother of North Korea’s dictator the Malaysian police said The poison used to kill Kim-Jong-nam the brother of the North Korean leaderKim Jong-un was VX nerve agent a substance listed as a chemical weapon theMalaysian police announced on Friday.
58b08c3fcd4d74221a0001d5	Breaking News: Journalists from several organizations including The Times were kept from attending a briefing by President Trump's press secretary	2017-02-24T14:40:19-05:00		NYTimes.com	93032	\['trump’s' 'organizations' 'house’s' \trump's\ 'correspondents’ association' 'actions' 'reporters' 'white house' 'press corps' 'york' 'wing' 'press secretary' 'journalists' 'sean m. spicer' 'breaking news journalists' 'cnn politico' 'quick rebuke' 'briefing']|Journalists from several organizations including The Times were kept from attending a briefing by President Trump’s press secretary Reporters from CNN Politico and The New York Times were not allowed to enterthe West Wing office of the press secretary Sean M. Spicer for a scheduledbriefing.
58b1eebfcd4d74221a0001ea	Breaking News: Democrats elected former Labor Secretary Thomas Perez as party chairman over Keith Ellison a liberal from Minnesota	2017-02-25T15:53:16-05:00		NYTimes.com	93077	['thomas perez' 'culmination' 'race' 'victory' 'fault lines' 'three-month-long campaign' 'donald j. trump’s' 'minnesota' 'party chairman' 'decades' 'presidential race' 'keith ellison' 'labor secretary' 'party' 'minnesota thomas perez’s' 'election' 'suspense' 'measure']	Democrats elected former Labor Secretary Thomas Perez as party chairman over Keith Ellison a liberal from Minnesota Thomas Perez’s victory was the culmination of a more thanthree-month-long campaign that began when Democrats were still shellshocked overhaving lost the presidential race.
