58db9d4ccd4d745b2e00002b	Breaking News: With a hand-delivered letter Britain has officially initiated Brexit. The long divorce is likely to be littered with pitfalls.2017-03-29T07:40:36-04:00		NYTimes.com	95206	['consequential' 'world war' 'sides' 'two-year divorce' 'ii prime' 'long divorce' 'diplomatic events' 'union' 'one' 'pitfalls' 'letter' 'theresa may' 'brexit' 'tortuous' 'formal notice' 'country’s intention' 'britain' 'minister']	In one of the most consequential diplomatic events in Britain since World WarII Prime Minister Theresa May on Wednesday sent formal notice of thecountry’s intention to withdraw from the European Union starting atortuous two-year divorce littered with pitfalls for both sides.
58dd1a62cd4d745b2e000055	Breaking News: President Trump called a conservative faction in the House a threat to the Republican agenda and vowed to fight them in 20182017-03-30T10:46:51-04:00		NYTimes.com	95274	['fast' 'twitter' '2018' 'conservatives' 'mr. trump' 'care' 'the freedom' 'house' 'fight' 'war' 'house freedom' 'act repeal' 'don’t' 'midterm elections' 'caucus' 'trump' 'fight them' 'hurt' 'threat' 'conservative faction' 'agenda']	President Trump called a conservative faction in the House a threat to the Republican agenda and vowed to “fight them” in 2018 President Trump on Thursday declared war on the conservatives of the HouseFreedom Caucus suggesting Republicans should “fight them” in the2018 midterm elections if they do not back his agenda.
58ef8f26cd4d740595000057	Breaking News: An American-led strike mistakenly killed 18 Syrian rebels who were allied with the U.S. The military called the episode tragic.2017-04-13T10:45:53-04:00		NYTimes.com	95992	['tabqah syria' 'u.s.' 'scores' 'episode “tragic' 'rebels' 'mosque' 'american-led' 'episode tragic' 'mosul iraq' 'allies' 'airstrikes' 'syrian' 'pentagon' '18' 'strike' 'syria' 'previous airstrikes' 'civilians']	The military called the episode “tragic.” The strike on Tuesday in Tabqah Syria was the third time in a month thatAmerican-led airstrikes may have killed civilians or allies and comes even asthe Pentagon is investigating two previous airstrikes that killed or woundedscores of civilians in a mosque complex in Syria and in a building in westMosul Iraq.	
58790274cd4d746373000122	Breaking News: The Chicago police have systemically violated civil rights says a scathing Justice Department report following a 13-month inquiry	2017-01-13T11:38:01-05:00		NYTimes.com	90123	['investigation' 'term' 'attorney' 'justice department said' 'the systems' 'loretta e. lynch' 'justice department report' 'lives' 'obama’s' 'affects' 'risk' 'civil rights' 'practice' 'excessive force' 'ordinary citizens' 'chicago' 'vast majority' 'african-americans' 'department officers' '13-month inquiry' 'latinos' 'end' 'department' 'policies']	“The systems and policies that fail ordinary citizens alsofail the vast majority of Chicago Police Department officers who risk theirlives every day to serve and protect the people of Chicago” said AttorneyGeneral Loretta E. Lynch who had raced to complete the investigation before theend of President Obama’s term.
58793c68cd4d74637300012d	Breaking News: The House joined the Senate in taking a major step toward repealing Obamacare adding urgency to the question of what comes next	2017-01-13T15:45:08-05:00		NYTimes.com	90132	['tear' 'budget blueprint' 'repeal' 'prospect' 'care act' 'groundwork' 'senate filibuster' 'major step' 'senate' 'house' 'obamacare' 'speedy action' 'health care law' 'question' 'urgency']	The House joined the Senate in taking a major step toward repealing Obamacare adding urgency to the question of what comes next The House joined the Senate on Friday in laying the groundwork for speedyaction to repeal the Affordable Care Act approving the budget blueprint passedby the Senate on Thursday that would allow Republicans to tear up the healthcare law without the prospect of a Senate filibuster.
587c52b8cd4d746373000146	Breaking News: South Korea is seeking to arrest the head of Samsung for his role in the corruption scandal that led to the president's impeachment	2017-01-15T23:57:16-05:00		NYTimes.com	90245	['head' 'korea' 'geun-hye’s' 'special prosecutor' 'impeachment' 'arrest' 'president park' 'samsung' 'corruption scandal' 'ms. park.' 'conglomerate' 'role' 'korea’s']	South Korea is seeking to arrest the head of Samsung for his role in the corruption scandal that led to the president's impeachment A special prosecutor investigating the corruption scandal that led toPresident Park Geun-hye’s impeachment said on Monday that he was seekingto arrest the de facto head of Samsung South Korea’s largestconglomerate on charges of bribing Ms. Park.
587cfc48cd4d746aac000003	Breaking News: The wife of the Orlando nightclub gunman has been arrested by the F.B.I. and charged with obstruction of justice	2017-01-16T12:00:53-05:00		NYTimes.com	90291	['49' 'attack' 'aftermath' 'custody' 'prosecutors' 'obstruction' 'nightclub gunman' 'f.b.i.' 'san francisco' 'dozens' 'noor salman' 'wife' 'justice' 'orlando' 'agents']	and charged with obstruction of justice Noor Salman was taken into custody by F.B.I.
587d775ecd4d746aac00001c	Breaking News: Gene Cernan the astronaut known for his daring and the last man to walk on the moon has died. He was 82.	2017-01-16T20:45:34-05:00		NYTimes.com	90299	['astronaut' 'eugene a. cernan' 'gene cernan' 'died' 'lunar surface look routine' 'spacewalks' 'tether' 'reckless streak' 'three' 'world' 'drift weightless' 'earth' 'romps' 'man' 'breaking news gene cernan' 'space' 'test pilot’s' 'ferocious competitor' 'aerospace records' 'sir-nun' '82' 'moon']	A ferocious competitor with a test pilot’s reckless streak Eugene A.Cernan (pronounced SIR-nun) rocketed into space three times was the secondAmerican to drift weightless around the world on a tether went to the moontwice and shattered aerospace records on the Earth and the moon.
587e11b9cd4d746aac000038	Breaking News: Britain's leader in a major speech backed a clean break from the E.U. its single market and its court system	2017-01-17T07:44:29-05:00		NYTimes.com	90320	['prime' 'theresa may' 'four' 'european union' 'course' 'leader' 'minister' 'court system' 'major speech' 'e.u.' 'decades' 'integration' 'continent' 'market' 'neighbors' 'relations' 'britain’s' 'speech']	Britain's leader in a major speech backed a clean break from the E.U. its single market and its court system In a speech that holds the potential to define Britain’s relations withits neighbors for decades to come Prime Minister Theresa May on Tuesday charteda course toward a clean break with the European Union after more than fourdecades of integration with the Continent.
587e5d9ecd4d746aac000043	Breaking News: Nigeria mistakenly bombed a refugee camp while hunting militants. Doctors Without Borders counted 50 people dead and 120 injured.	2017-01-17T13:08:15-05:00		NYTimes.com	90351	['nigeria' 'camp' 'fighters' 'nigerian' 'militants' 'boko haram' 'injured' '120' 'others' 'fighter jet' 'humanitarian workers' 'scores' 'breaking news nigeria' 'camp residents' '50' 'refugee camp' 'doctors' 'borders']	A Nigerian fighter jet searching for Boko Haram fighters on Tuesday bombed acamp for displaced people who had fled the militants killing scores of campresidents and wounding many others including humanitarian workers.
5881768ccd4d744297000003	Breaking News: U.S. intelligence agencies are examining intercepted communications and data for links between Donald Trump's associates and Russia	2017-01-19T21:31:11-05:00		NYTimes.com	90570	\['redirect' 'oversee' 'oath' 'associates' 'investigation' 'intelligence agencies' 'data' 'mr. trump' 'president-elect' 'links' 'u.s.' 'agencies' 'communications' 'russia' 'russian government' 'counterintelligence investigation' 'donald j. trump' 'breaking news u.s.' 'efforts' 'authority' \donald trump's\]|U.S. intelligence agencies are examining intercepted communications and data for links between Donald Trump's associates and Russia The continuing counterintelligence investigation means that President-electDonald J. Trump will take the oath of office on Friday with his associates underinvestigation and after the intelligence agencies concluded that the Russiangovernment had worked to help elect him.
58822a7ccd4d744297000018	Breaking News: Donald Trump is now meeting with the Obamas at the White House; he'll be sworn in around 11:45 Eastern. Get live video and analysis.	2017-01-20T10:19:14-05:00	https://www.nytimes.com/interactive/2017/01/20/us/politics/inauguration-day-live.html	NYTimes.com	90601	['he’ll' '1145' 'country' 'york' 'reporters' 'sworn' 'reporting photography' 'breaking news donald trump' 'house' 'inauguration' 'video' 'donald trump' 'dozens' 'obamas' 'comprehensive coverage' 'highlights' 'on-the-ground' 'analysis' 'eastern' 'meeting']	Donald Trump is now meeting with the Obamas at the White House; he’ll be sworn in around 11:45 Eastern.
5882444ecd4d744297000029	Breaking News: Donald John Trump has placed his hand on two Bibles and taken the oath of office. He is now the 45th president of the United States.	2017-01-20T12:09:12-05:00	https://www.nytimes.com/interactive/2017/01/20/us/politics/inauguration-day-live.html	NYTimes.com	90607	['breaking news donald john trump' 'sworn' 'john g. roberts jr.' 'hand' 'oath' 'mr. trump' 'bibles' 'states' '45th president' 'donald john trump' '35-word oath' 'chief justice']	Mr. Trump was sworn in with a 35-word oath that was administered by ChiefJustice John G. Roberts Jr.
58828629cd4d74429700003e	Breaking News: Protesters in Washington smashed windows and lit fires and clashed with police trying to disperse them. At least 95 were arrested.	2017-01-20T16:50:16-05:00		NYTimes.com	90613	['windows' 'disperse them' '95' 'trump' 'breaking news protesters' 'protesters' 'confrontation' 'parade route' 'lit fires' 'blocks' 'arrested']	Protesters in Washington smashed windows and lit fires and clashed with police trying to disperse them.
5883f550cd4d74345b00000b	Breaking News: Amid mass protests nationwide President Trump and his spokesman accused the media of understating the turnout for his inauguration	2017-01-21T18:56:50-05:00		NYTimes.com	90655	['full day' 'inauguration' 'inauguration president' 'pair' 'mass protests nationwide president' 'deliberate efforts' 'white house' 'staff' 'spokesman' 'turnout' 'breaking news amid' 'saturday mr. trump' 'depictions' 'angry public appearances' 'amid' 'mall' 'number' 'bitter war' 'crowd' 'media' 'sean spicer' 'white house press secretary' 'news media' 'understate' 'trump']	Amid mass protests nationwide President Trump and his spokesman accused the media of understating the turnout for his inauguration President Trump and his staff spent their first full day in the White Housewaging a bitter war against the news media over depictions of the crowd at theinauguration on Friday.
588639dccd4d74778700000f	Breaking News: President Trump has declared that the U.S. won't join the Trans-Pacific Partnership a sweeping trade pact negotiated by Barack Obama	2017-01-23T12:13:59-05:00		NYTimes.com	90794	['trump' 'start' 'won’t' 'trans-pacific partnership' 'u.s.' 'american signature' 'administration' 'foreign competitors' 'barack obama' 'decision' 'signal' 'trump’s' 'aggressive stance']	President Trump has declared that the U.S. won’t join the Trans-Pacific Partnership a sweeping trade pact negotiated by Barack Obama Although the deal had not been approved by Congress the decision to withdrawthe American signature at the start of President Trump’s administration isa signal that he plans to follow through on promises to take a more aggressivestance against foreign competitors.
5886c1decd4d747787000026	Breaking News: Speaking to lawmakers President Trump again falsely claimed that illegal immigrants had cost him the popular vote	2017-01-23T21:53:51-05:00		NYTimes.com	90802	['majority' 'illegal immigrants' 'cost' 'official meeting' 'popular vote' 'lawmakers' 'support' 'needs' 'lawmakers president' 'election results' 'institution' 'congressional leaders' 'loss' 'trump' 'ambitious legislative agenda' 'president’s comments' 'millions' 'bipartisan leadership' 'gripe' 'white house reception' 'popular vote president']	Speaking to lawmakers President Trump again falsely claimed that illegal immigrants had cost him the popular vote President Trump used his first official meeting with congressional leaders onMonday to gripe about his loss of the popular vote falsely telling thelawmakers that he would have won a majority if millions of illegal immigrantshad not voted against him.
58876094cd4d741ed8000013	Breaking News: President Trump plans to keep James B. Comey as director of the F.B.I. The agency is investigating Mr. Trump's associates.	2017-01-24T09:11:10-05:00		NYTimes.com	90883	\['f.b.i.' 'federal government’s' 'job' 'james b. comey' 'trump' 'matter' \mr. trump's\ 'agency' 'director' 'associates' 'top agents' 'top law enforcement agency' 'country']|director James B. Comey told his top agents from around thecountry that he had been asked by President Trump to stay on the job running thefederal government’s top law enforcement agency according to peoplefamiliar with the matter.
5887780acd4d741ed800001e	Breaking News: Emboldened by President Trump Israel approved 2500 new settlement homes in the West Bank in a defiant wave of construction	2017-01-24T10:51:06-05:00		NYTimes.com	90889	['obama' 'emboldened' 'settlements' 'israel' 'world leaders' 'defiant wave' 'government' 'bank' 'announcement' 'israeli' 'administration' 'trump israel' 'palestinian-claimed' 'feeling' 'territory' '2500' 'breaking news emboldened' 'construction' 'disregard' 'constraints' 'gathering' 'international condemnation' 'new settlement homes']	Emboldened by President Trump Israel approved 2500 new settlement homes in the West Bank in a defiant wave of construction Just over a week after a gathering of world leaders warned that Israel muststop expanding its settlements in Palestinian-claimed territory theannouncement made clear that the Israeli government is feeling emboldened toshake off the constraints imposed by the Obama administration and more willingto disregard international condemnation.
58878537cd4d741ed8000022	Breaking News: President Trump is reviving the Keystone XL pipeline which President Obama had blocked after opposition by environmental groups	2017-01-24T11:47:19-05:00		NYTimes.com	90890	['efforts' 'balance' 'trump' 'predecessor’s policies' 'nation’s energy' 'debate' 'pipeline' 'environmental groups president' 'dismantle' 'stem climate change' 'opposition' 'obama' 'environmental groups' 'keystone xl']	President Trump is reviving the Keystone XL pipeline which President Obama had blocked after opposition by environmental groups President Trump moved assertively on Tuesday to further dismantle hispredecessor’s policies as he revived the Keystone XL pipeline that stirredyears of debate over the balance between the nation’s energy needs andefforts to stem climate change.
58890408cd4d745609000010	Breaking News: Mary Tyler Moore is dead at 80. She starred in one of the most popular TV shows ever and helped define a new vision of womanhood.	2017-01-25T15:00:44-05:00		NYTimes.com	90945	['spunky' 'ms. moore' 'one' 'breaking news mary tyler moore' 'sitcom “the' 'popular tv shows' '80' 'new vision' 'mary tyler moore' 'womanhood' 'mary tyler moore show.”.' 'mary richards']	Ms. Moore was most indelibly known as the incomparably spunky Mary Richardson the CBS hit sitcom “The Mary Tyler Moore Show.”.
588a2e88cd4d74643500000f	Breaking News: Mexico's president canceled a visit with President Trump as tensions rose over his insistence that Mexico pay for a border wall	2017-01-26T12:14:42-05:00		NYTimes.com	90976	['move' 'mr. pena nieto' 'northern neighbor' 'months' 'threats' 'tensions' 'border wall' 'nations' 'public pressure' 'face' 'head' 'mexico' 'enrique pena nieto' 'mexico’s' 'mr. trump’s' 'trump' 'dialogue' 'insistence']	Mexico’s president canceled a visit with President Trump as tensions rose over his insistence that Mexico pay for a border wall The move by Enrique Peña Nieto brings to a head the simmering tensionsthat have been building for months between the two nations.
588a636fcd4d74643500001a	Breaking News: President Trump has proposed a 20 percent tax on all Mexican imports to pay for the border wall his spokesman said	2017-01-26T16:00:14-05:00		NYTimes.com	90987	['dollars' 'border wall' 'new barrier' 'mexican imports' 'percent tax' 'united states' 'imports' 'mexico' 'billions' 'spokesman' 'cost' '20' 'trump']	President Trump has proposed a 20 percent tax on all Mexican imports to pay for the border wall his spokesman said President Trump plans to make Mexico pay for his border wall by imposing a 20percent tax on all imports into the United States from Mexico raising billionsof dollars that would cover the cost of the new barrier.
588c9b92cd4d74365f000011	Breaking News: Refugees have been stopped and detained at U.S. airports under President Trump's immigration ban prompting legal action	2017-01-28T08:24:10-05:00		NYTimes.com	91083	\['iraqi' 'u.s.' 'refugees' 'executive order' 'legal action president' 'united states' 'clients released' 'kennedy' 'order' 'lawyers' 'immediate effect' 'airports' \trump's\ 'immigration ban' 'writ' 'night' 'nation’s' 'habeas corpus' 'air' 'ports' 'effort' 'class certification' 'entry' 'eastern district' 'legal action' 'york' 'motion' 'airport' 'trump’s' 'breaking news refugees' 'detentions' 'immigrants']|Refugees have been stopped and detained at U.S. airports under President Trump's immigration ban prompting legal action President Trump’s executive order closing the nation’s borders torefugees was put into immediate effect Friday night.
588d5644cd4d746bb5000007	Breaking News: A federal judge stayed part of President Trump's immigration order barring refugees stopped at U.S. airports from being sent back	2017-01-28T21:40:46-05:00		NYTimes.com	91110	\['york' 'presidency' 'executive order' 'white house order' 'united states' 'country' '200' '100' 'arrival' 'order' 'refugees' 'broader ruling' 'government' 'emergency hearing' 'american airports' 'lawyers' 'u.s.' 'immigration' 'wake' 'airports' 'actions' 'city courtroom' 'trump’s' 'decision' 'others' 'mr. trump' 'constitutionality' 'part' 'judge' 'immigration order' 'federal judge' 'mr. trump’s' \trump's\ 'home countries']|Lawyers who sued the government to block the White House ordersaid the decision which came after an emergency hearing in a New York Citycourtroom could affect an estimated 100 to 200 people who were detained uponarrival at American airports in the wake of the order that Mr. Trump signed onFriday afternoon a week into his presidency.
588def59cd4d746bb5000013	Breaking News: One U.S. commando was killed and four were hurt in President Trump's first counterterrorism offensive an attack in Yemen	2017-01-29T08:34:14-05:00		NYTimes.com	91138	\['nearby' 'yemen' 'four' 'trump' 'attack' 'commando injured' 'militants' 'one' 'others' 'commando' \trump's\ 'counterterrorism operation' 'senior american official' 'qaeda' 'operation' 'american commando' 'military aircraft' 'hurt' 'fierce firefight' 'trump’s' 'counterterrorism offensive' 'three' 'statement said' 'raid' 'u.s.']|One U.S. commando was killed and four were hurt in President Trump’s first counterterrorism offensive an attack in Yemen One American commando was killed and three others injured in a fiercefirefight overnight with Qaeda militants in central Yemen a senior Americanofficial said Sunday morning.
588e11b8cd4d746bb5000019	Breaking News: After protests the Trump administration seemed to scale back the president's immigration ban but confusion continued	2017-01-29T11:00:29-05:00		NYTimes.com	91142	['confusion' 'official' 'trump’s' 'trump' 'detain' 'immigration order' 'uncertainty' 'question' 'white house chief' 'immigration ban' 'green cards' 'discretionary authority' 'countries' 'protests' 'top white house' 'administration' 'statement' 'key part' 'reverse' 'reince priebus' 'certain countries' 'days ahead' 'executive order' 'suspicious travelers' 'scale' 'border agents' 'states' 'staff']	After protests the Trump administration seemed to scale back the president's immigration ban but confusion continued A top White House official appeared to reverse a key part of PresidentTrump’s immigration order on Sunday saying that people from the affectedcountries who hold green cards will not be prevented from returning to theUnited States.
588fd046cd4d744f1200000a	Breaking News: The acting attorney general an Obama holdover has ordered the Justice Department not to defend President Trump's immigration order	2017-01-30T18:45:46-05:00		NYTimes.com	91201	\['symbolic — president' 'holdover' 'jeffrey sessions' 'order' \trump's\ 'attorney general' 'mr. trump’s' 'immigration order' 'trump’s' 'nominee' 'government' 'decision' '—' 'justice department' 'highlights' 'obama']|The acting attorney general an Obama holdover has ordered the Justice Department not to defend President Trump's immigration order The decision is largely symbolic — President Trump’s nominee tobe attorney general Jeffrey Sessions is likely to be confirmed soon —but it highlights the deep divide at the Justice Department and elsewhere in thegovernment over Mr. Trump’s order.
588feb73cd4d744f12000016	Breaking News: Paving the way for transgender scouts the Boy Scouts of America will accept members based on the gender listed on their application	2017-01-30T20:41:58-05:00		NYTimes.com	91202	['transgender' 'breaking news paving' 'announcement reverses' 'paving' 'scouts' 'boy' 'transgender scouts' 'gender' 'controversy' 'members' 'america' 'application' 'policy' 'organization' 'jersey' 'joining']	Paving the way for transgender scouts the Boy Scouts of America will accept members based on the gender listed on their application The announcement reverses a policy that drew controversy late last year whena transgender New Jersey boy was kicked out of the organization about a monthafter joining.
588ff9a1cd4d744f12000020	Breaking News: President Trump has fired the acting attorney general after she told Justice Dept. lawyers not to defend his immigration ban	2017-01-30T21:42:13-05:00		NYTimes.com	91203	['lawyers' 'attorney general' 'mr. trump' 'white house' 'statement' 'trump' '10-day-old administration' 'administration' 'dept' 'action' 'betrayed' 'crisis' 'justice' 'immigration ban' 'sally q. yates']	lawyers not to defend his immigration ban Taking action in an escalating crisis for his 10-day-old administration Mr.Trump declared that Sally Q. Yates had “betrayed” theadministration the White House said in a statement.
5891365dcd4d7417ef000006	Breaking News: Neil Gorsuch is President Trump's Supreme Court pick. The federal judge resembles Antonin Scalia in both philosophy and style.	2017-01-31T20:13:39-05:00		NYTimes.com	91244	\['antonin scalia' 'trump’s' 'denver' 'supreme court seat' 'man' 'federal appeals court judge' 'judge' 'federal judge' 'supreme court pick' 'trump' 'style' 'jurist' 'succeed' 'death' 'neil m. gorsuch' 'originalist philosophy' 'breaking news neil gorsuch' 'philosophy' 'neil gorsuch' 'mold' 'justice' \trump's\]|President Trump on Tuesday nominated Judge Neil M. Gorsuch a federal appealscourt judge in Denver to fill the Supreme Court seat left open by the death ofJustice Antonin Scalia elevating a jurist whose conservative bent andoriginalist philosophy fit the mold of the man he would succeed.
58924039cd4d74393d000011	Breaking News: The Senate confirmed Rex Tillerson as secretary of state. The narrow vote was among the most contentious for that role in recent history.	2017-02-01T15:08:20-05:00		NYTimes.com	91341	['recent history' 'secretary' 'important international allies' 'senate' 'role' 'narrow vote' 'rex tillerson' 'exxon mobil' 'rex w. tillerson' 'serious strains' 'chief executive' 'chairman' 'contentious' 'nation’s 69th secretary']	Rex W. Tillerson the former chairman and chief executive of Exxon Mobil wasconfirmed by the Senate on Wednesday to become the nation’s 69th secretaryof state just as serious strains have emerged with important internationalallies.
5893c922cd4d7466ce00001a	Breaking News: President Trump unexpectedly shifted his stance on Israel warning Prime Minister Netanyahu to hold off on settlement construction	2017-02-02T19:04:19-05:00		NYTimes.com	91413	['settlement construction president' 'new settlement construction' 'government' 'statement' 'helpful' 'trump' 'goal' 'support' 'israel' 'expansion' 'foreign policy' 'white house' 'new settlements' 'warning' 'gears' 'don’t' 'stance' 'impediment' 'benjamin netanyahu' 'peace' 'cornerstone' 'existence' 'netanyahu' 'settlement construction' 'settlements' 'minister' 'construction' 'prime']	President Trump unexpectedly shifted his stance on Israel warning Prime Minister Netanyahu to hold off on settlement construction President Trump who has made support for Israel a cornerstone of his foreignpolicy shifted gears on Thursday and for the first time warned the governmentof Prime Minister Benjamin Netanyahu to hold off new settlementconstruction.
