id	subject	timestamp	article_url	sender	instance_id	tags	topsentence
58a35628cd4d74221a0000b2	White House Press Secretary Says Trump Fired Flynn As National Security Adviser	2017-02-14T14:10:08-05:00	http://www.npr.org/2017/02/14/515215088/white-house-press-secretary-says-trump-fired-flynn-as-national-security-adviser	NPR		\['account differs', 'says trump fired flynn', 'vice president', 'questions', 'white house', 'adviser', 'initially', \michael flynn's\, 'white house press secretary', 'russia', 'national security', 'impression', 'decision']|White House Press Secretary Says Trump Fired Flynn As National Security Adviser The account differs from the impression the White House gave initially, framing it as Michael Flynn's decision to leave amid questions about his talks with Russia and misleading the vice president.	
58a4896bcd4d74221a0000d0	WATCH: President Trump, Netanyahu Hold Joint Press Conference At White House	2017-02-15T12:01:01-05:00	http://www.npr.org/2017/02/15/514986341/watch-live-trump-netanyahu-hold-joint-press-conference-at-white-house	NPR		['white house', 'journalists', 'trump netanyahu hold joint', 'noon press conference', 'remarks', 'npr', 'press conference', 'israeli prime', 'president on', 'benjamin netanyahu', 'minister']	WATCH: President Trump, Netanyahu Hold Joint Press Conference At White House Israeli Prime Minister Benjamin Netanyahu is meeting with the president on Wednesday.
58a49c68cd4d74221a0000db	'I'd Like To See You Hold Back On Settlements,' Trump Tells Netanyahu	2017-02-15T13:22:11-05:00	http://www.npr.org/sections/thetwo-way/2017/02/15/515391997/as-trump-and-netanyahu-meet-palestinians-watch-for-talk-of-two-state-plan	NPR		\['two-state solution', \settlements' trump tells netanyahu recent\, \settlements' trump tells netanyahu\, 'integral', 'senior white house officials', 'hold', 'u.s.', 'long-held', 'signal', 'peace negotiations', \i'd\, 'remarks', 'view']|'I'd Like To See You Hold Back On Settlements,' Trump Tells Netanyahu Recent remarks by senior White House officials had seemed to signal a possible shift in the long-held U.S. view that a two-state solution is integral to peace negotiations.	
58a4c89bcd4d74221a0000ed	Trump's Labor Secretary Nominee Withdraws	2017-02-15T16:30:45-05:00	http://www.npr.org/2017/02/15/515425370/trump-labor-pick-andrew-puzders-nomination-appears-in-jeopardy	NPR		\['personal controversies', 'ceo andrew puzder', 'fierce opposition', 'labor secretary', \trump's\, 'food', 'support', 'labor groups', 'republican senators', 'ultimately', 'nominee withdraws fast', 'nominee withdraws']|Trump's Labor Secretary Nominee Withdraws Fast food CEO Andrew Puzder faced fierce opposition from labor groups, plus personal controversies.	
58a5d254cd4d74221a0000f6	Senate Narrowly Confirms Mulvaney To Lead Office Of Management And Budget	2017-02-16T11:24:25-05:00	http://www.npr.org/sections/thetwo-way/2017/02/16/515578360/senate-narrowly-confirms-mulvaney-as-trumps-nominee-for-omb-director	NPR		\['narrowly confirms mulvaney', 'view', 'social security', 'trump', '—', 'undertake', 'budget', 'medicare', 'nomination', 'management', 'lead', 'senate', \mick mulvaney's\]|Senate Narrowly Confirms Mulvaney To Lead Office Of Management And Budget Democrats who opposed his nomination spoke of Rep. Mick Mulvaney's view that Social Security and Medicare must be overhauled — something President Trump has promised not to undertake.	
58a5ebb3cd4d74221a000106	Trump Picks Alexander Acosta As New Choice For Labor Secretary	2017-02-16T13:12:47-05:00	http://www.npr.org/2017/02/16/515585143/watch-trump-to-announce-new-labor-nominee	NPR		\['fiu law acosta', 'nomination', 'labor secretary', 'parties', 'currently', 'board', 'members', 'national labor', 'criticism', 'andrew puzder', \trump's first\, 'relations', 'trump picks alexander acosta', 'choice', 'dean', 'withdrew', 'on the']|Trump Picks Alexander Acosta As New Choice For Labor Secretary Currently dean of FIU Law, Acosta also served on the National Labor Relations Board.	
58a5fe1acd4d74221a00010d	Trump Says He Will Issue 'New Executive Action' Related To Travel Ban	2017-02-16T14:31:10-05:00	http://www.npr.org/sections/thetwo-way/2017/02/16/515607869/trump-says-he-will-issue-new-executive-action-related-to-travel-ban	NPR		\['decision', 'travel ban —', 'travel ban', 'comprehensive order', 'administration', \action' related\, 'trump says', 'new very', 'new executive']|\Trump Says He Will Issue 'New Executive Action' Related To Travel Ban On Thursday the president said his administration will be appealing a decision that imposes a stay on his travel ban — and will also be issuing a new, \very comprehensive order\ next week.
58a5ff75cd4d74221a00010e	Breaking News: Former Palm Springs mayor and 2 developers charged with corruption
58a60c13cd4d74221a000114	Trump's Press Conference: Transcript And Analysis	2017-02-16T15:30:51-05:00	http://www.npr.org/2017/02/16/515608127/transcript-and-analysis-trump-press-conference-on-labor-secretary-russia	NPR		\['media. journalists', 'new executive order', 'full transcript', 'conference transcript', 'length', 'russia', 'u.s.', 'range', 'resignation', 'relations', \michael flynn's\, 'complaints', 'analysis', 'remarks', 'topics', 'npr', 'new labor secretary nominee', \trump's\]|Trump's Press Conference: Transcript And Analysis After announcing the new labor secretary nominee Thursday, the president spoke at length about a range of topics, from Michael Flynn's resignation and U.S. relations with Russia, to a new executive order and complaints about the media. Journalists across NPR are annotating a full transcript of his remarks.	
58a74270cd4d74221a000137	Scott Pruitt Confirmed To Lead Environmental Protection Agency	2017-02-17T13:35:02-05:00	http://www.npr.org/2017/02/17/515802629/scott-pruitt-confirmed-to-lead-environmental-protection-agency	NPR		\[\epa's\, 'oklahoma', 'longtime critic', 'attorney', 'senate', 'scott pruitt', 'lead environmental protection', 'pruitt', 'scott pruitt confirmed', 'agency', 'administrator']|Scott Pruitt Confirmed To Lead Environmental Protection Agency The Senate has confirmed Oklahoma Attorney General Scott Pruitt as the EPA's next administrator.	
58ab528bcd4d74221a00016f	President Trump Names Lt. Gen. H.R. McMaster As New National Security Adviser	2017-02-20T15:33:11-05:00	http://www.npr.org/sections/thetwo-way/2017/02/20/516283266/president-trump-names-lt-gen-h-r-mcmaster-new-national-security-adviser	NPR		['ret', 'h.r.', ' mcmaster', 'gen', 'resign', 'tremendous experience', 'new national security', 'mcmaster', 'russian ambassador', 'mike flynn', 'adviser', 'u.s.', 'mar-a-lago monday', 'tremendous talent', 'announcement', 'lt', 'revelations', 'trump', 'trump names', 'conversations', 'a man', 'top white house officials']	Gen. Mike Flynn, who was forced to resign after revelations that he had misled top White House officials about his conversations with the Russian ambassador to the U.S. President Trump Names Lt. Gen. H.R.
58ac6e94cd4d74221a00017f	Homeland Security Outlines New Rules Tightening Enforcement Of Immigration Law	2017-02-21T11:44:56-05:00	http://www.npr.org/sections/thetwo-way/2017/02/21/516433342/homeland-security-outlines-new-rules-tightening-enforcement-of-immigration-law	NPR		['tightening enforcement', 'memos', 'rules', 'children', 'number', 'dreamers — people', 'immigrants', 'immigration law', 'outlines', 'john kelly', 'removal', 'homeland', 'u.s.', 'security', 'secretary']	Homeland Security Outlines New Rules Tightening Enforcement Of Immigration Law Two memos, signed by Secretary John Kelly, greatly expand the number of immigrants prioritized for removal.
58add6f6cd4d74221a00019a	Astronomers Find 7 Earth-Sized Planets Around A Nearby Star	2017-02-22T13:22:41-05:00	http://www.npr.org/sections/thetwo-way/2017/02/22/516431116/astronomers-find-7-earth-sized-planets-around-a-nearby-star	NPR		['planets', 'star', 'earth-sized', 'habitable planets', 'astronomers find', '7', 'nearby', 'earth-sized planets around', 'record', 'discovery']	Astronomers Find 7 Earth-Sized Planets Around A Nearby Star The discovery sets a record for both the most Earth-sized planets and the most potentially habitable planets ever discovered around a single star.
58af31c1cd4d74221a0001b7	WATCH LIVE: Top Trump Advisers Bannon And Priebus Set To Address CPAC	2017-02-23T14:02:22-05:00	http://www.npr.org/2017/02/23/516847668/top-trump-advisers-bannon-and-priebus-set-to-address-cpac	NPR		\['staff', 'address cpac', 'joint interview', 'chief strategist', 'dissension', 'watch live top trump advisers bannon', \trump's\, 'priebus set', 'white house chief', 'tamp']|WATCH LIVE: Top Trump Advisers Bannon And Priebus Set To Address CPAC The joint interview comes as both the White House chief of staff and Trump's chief strategist have tried to tamp down on reports of dissension between them.	
58af85f6cd4d74221a0001c2	WATCH LIVE: Vice President Pence To Address CPAC	2017-02-23T20:01:13-05:00	http://www.npr.org/2017/02/23/516930452/watch-live-vice-president-pence-addresses-cpac	NPR		\['set to', \trump's\, 'address cpac', 'vice president', 'annual confab', 'address cpac pence', 'pence', 'conservatism']|WATCH LIVE: Vice President Pence To Address CPAC Pence, whose brand of conservatism is more traditionally suited for the annual confab than President Trump's, is set to speak Thursday evening.	
58b05210cd4d74221a0001ce	WATCH LIVE: President Trump Addresses CPAC	2017-02-24T10:32:26-05:00	http://www.npr.org/2017/02/24/517009754/watch-live-president-trump-addresses-cpac	NPR		['six', 'presidential bid', 'populist ideas', '2012', 'trump addresses cpac trump', 'propel', 'trump addresses cpac', 'gathering', 'house']	WATCH LIVE: President Trump Addresses CPAC Trump first addressed the gathering six years ago when he was flirting with a 2012 presidential bid, sounding many of the same populist ideas that would propel him to the White House.
58b1ee22cd4d74221a0001e9	Former Obama Labor Secretary Tom Perez Wins DNC Chairmanship	2017-02-25T15:50:09-05:00	http://www.npr.org/2017/02/25/517203708/live-blog-dnc-chair-race-to-begin-shortly-heres-what-to-expect	NPR		['obama', 'ballot', 'labor secretary', 'tom perez wins dnc chairmanship', 'national committee', 'chairman']	Former Obama Labor Secretary Tom Perez Wins DNC Chairmanship On the second ballot, Democrats elected the former Labor Secretary as chairman of its national committee.
58b62d8ecd4d746e65000022	WATCH LIVE: Trump Addresses Joint Session Of Congress	2017-02-28T21:09:53-05:00	http://www.npr.org/2017/02/28/516717981/watch-live-trump-addresses-joint-session-of-congress	NPR		['vision', 'budget plan', 'replacement', 'night', 'repeal', 'remarks', 'american spirit tonight', 'obamacare', 'attempts', 'speech', 'trump', 'npr', 'journalists', 'renewal', 'watch live trump addresses joint session']	The speech comes a day after Trump gave an outline of his budget plan and also amid Congress' attempts to organize the repeal and replacement of Obamacare.
58b6503ecd4d746e65000035	Calling For 'Renewal Of The American Spirit,' Trump Outlines Optimistic Vision	2017-02-28T23:38:17-05:00	http://www.npr.org/2017/02/28/517826209/watch-live-president-trump-looks-for-reset-with-joint-address-to-congress	NPR		\['heart', 'unity', 'message', 'joint session', \spirit' trump outlines optimistic vision\, 'reset button', 'optimistic vision', 'strength', 'rocky', 'renewal', 'on-message address', 'america', 'trump']|Calling For 'Renewal Of The American Spirit,' Trump Outlines Optimistic Vision President Trump pushed the reset button after a rocky first month in office, delivering an on-message address to a joint session of Congress that outlined an optimistic vision for America.	
58b6d91acd4d746e65000040	Analysis And Fact Check: Trump's Address To Joint Session Of Congress	2017-03-01T09:21:58-05:00	http://www.npr.org/2017/02/28/516717981/watch-live-trump-addresses-joint-session-of-congress	NPR		\['analysis', \fact check trump's address\, 'npr', 'repeal', 'replacement', 'executive actions', 'obamacare', 'joint session', 'immigration', 'address president', 'trump', 'journalists', 'full remarks', 'national security', 'position']|Analysis And Fact Check: Trump's Address To Joint Session Of Congress In his address, President Trump touted his executive actions, called again for the repeal and replacement of Obamacare and reiterated his position on immigration and national security.	
58b83f66cd4d746e65000070	Senate Minority Leader Chuck Schumer Calls On Sessions To Resign As Attorney General	2017-03-02T10:50:44-05:00	http://www.npr.org/2017/03/02/518120957/gop-house-oversight-chief-calls-for-sessions-to-recuse-on-russia-investigation	NPR		['attorney', 'minority', 'attorney general', 'senate', 'general democratic leaders', 'campaign', 'information', 'sessions', 'resign', 'chuck schumer', 'ambassador', 'leader']	Senate Minority Leader Chuck Schumer Calls On Sessions To Resign As Attorney General Democratic leaders are calling on Sessions to resign as attorney general.
58b89465cd4d746e65000094	Attorney General Sessions To Recuse Himself From Any Trump Campaign Investigations	2017-03-02T16:53:21-05:00	http://www.npr.org/2017/03/02/518198749/attorney-general-sessions-to-recuse-himself-from-any-trump-campaign-investigatio	NPR		['afternoon news conference', 'trump campaign investigations jeff sessions', 'contact', 'russian', 'senator', 'operatives', 'attorney', 'russian ambassador', 'trump', 'sessions', 'presidential campaign', 'adviser to the', 'campaign', 'recuse himself', 'pressure', 'trump campaign investigations', 'role in']	Attorney General Sessions To Recuse Himself From Any Trump Campaign Investigations Jeff Sessions, who says he never met with Russian operatives about the presidential campaign, has been under pressure for contact he had with the Russian ambassador last year, when Sessions was a senator and an adviser to the Trump campaign.
58bad013cd4d740bd3000007	President Trump Accuses Obama Of 'Wire Tapping,' Provides No Evidence	2017-03-04T09:32:24-05:00	http://www.npr.org/sections/thetwo-way/2017/03/04/518478158/president-trump-accuses-obama-of-wire-tapping-provides-no-evidence	NPR		\['trump', 'trump accuses obama', 'bad or sick guy', 'series', 'accusation', \tapping' provides\, 'tweets', 'obama', 'wire', 'evidence', 'trump tower', 'election']|\President Trump Accuses Obama Of 'Wire Tapping,' Provides No Evidence In a series of tweets early Saturday morning, Trump alleged that Obama wiretapped Trump Tower before Election Day, calling him a \bad (or sick) guy.
58bae048cd4d740bd3000008	News Alert: Trump, citing no evidence, accuses Obama of ‘Nixon/Watergate’ plot to wiretap Trump Tower before the election
58bc3305cd4d740bd3000018	White House Says It Won't Comment On Trump's 'Wire Tapping' Tweets	2017-03-05T10:47:10-05:00	http://www.npr.org/2017/03/05/518630669/white-house-says-it-wont-comment-on-trumps-wire-tapping-tweets	NPR		\['intelligence', 'evidence', 'accusation', 'wire', 'james clapper', 'congressional investigation', '2016', 'white house', 'campaign', 'executive', \tapping' tweets\, \trump's\, 'director', 'investigative', 'congressional investigation to', 'statement', 'branch investigative powers', 'press secretary', 'then-candidate', 'tweets', \won't comment\, 'donald trump']|\Statement Calls For Congressional Investigation Into 'Executive Branch Investigative Powers' In 2016 The White House says it wants a congressional investigation \to determine whether executive branch investigative powers were abused in 2016.
58bc3325cd4d740bd3000019	WSJ NEWS ALERT: White House to Seek Probe of 'Potentially Politically Motivated Investigations'
58bd875dcd4d740bd3000030	Supreme Court Won't Hear Transgender Teen's Challenge To Bathroom Policy	2017-03-06T10:59:13-05:00	http://www.npr.org/sections/thetwo-way/2017/03/06/518795387/supreme-court-wont-hear-transgender-teens-challenge-to-bathroom-policy	NPR		\['opinion cites', 'trump', 'bathroom policy', 'correspond', 'facilities', 'gender identity', 'federal guidance', \won't hear transgender teen's challenge\, 'supreme court', 'transgender students']|Supreme Court Won't Hear Transgender Teen's Challenge To Bathroom Policy The opinion cites the Trump administration's rescinding of federal guidance that allowed transgender students to use facilities that correspond with their gender identity.	
58bd94b0cd4d740bd300003c	Trump Signs New Order Blocking Arrivals From 6 Majority-Muslim Countries	2017-03-06T11:55:45-05:00	http://www.npr.org/sections/thetwo-way/2017/03/06/516408650/trump-signs-new-order-blocking-arrivals-from-6-majority-muslim-countries	NPR		\['lawsuits', 'new order', 'visas', 'dozens', 'trump signs', 'new version omits', 'effect immediately', 'iraq', 'chaos', 'airports', 'previous executive order', 'majority-muslim countries', '6', \majority-muslim countries trump's\, 'protests', 'blocking arrivals']|Trump Signs New Order Blocking Arrivals From 6 Majority-Muslim Countries Trump's previous executive order caused chaos at airports and inspired protests and dozens of lawsuits.	
58bdfa37cd4d740bd300004b	GOP Health Care Bill Would Repeal Obamacare Taxes And Penalties, Keep Some Subsidies	2017-03-06T19:08:57-05:00	http://www.npr.org/sections/health-shots/2017/03/06/518864390/gop-bill-would-repeal-obamacare-taxes-and-penalties-keep-some-subsidies	NPR		['weeks', 'care bill', 'gop', 'care act', 'health', 'internal debate house', 'reshape', 'subsidies', 'obamacare', 'repeal obamacare taxes', 'interest groups —', 'penalties keep', 'public', 'aka', 'faces']	GOP Health Care Bill Would Repeal Obamacare Taxes And Penalties, Keep Some Subsidies After weeks of internal debate, House Republicans have released their plan to reshape the Affordable Care Act, aka Obamacare.
58beeca1cd4d740bd3000057	WikiLeaks Releases What It Calls CIA Trove Of Cyberespionage Documents	2017-03-07T12:23:38-05:00	http://www.npr.org/sections/thetwo-way/2017/03/07/519010317/wikileaks-releases-what-it-calls-cia-trove-of-cyberespionage-documents	NPR		['user manuals support guides', 'efforts', 'pages', 'cia', 'documents', 'code itself', 'describe', 'wikileaks releases', 'cia trove', 'cyberespionage documents', 'release', 'wikileaks', 'thousands']	WikiLeaks Releases What It Calls CIA Trove Of Cyberespionage Documents The release includes thousands of pages of user manuals, support guides and other documents that appear to describe CIA hacking efforts.
58c219a8cd4d740bd3000098	South Korean President Will Be Forced From Office As Judges Uphold Impeachment	2017-03-09T22:12:12-05:00	http://www.npr.org/sections/thetwo-way/2017/03/09/519547627/south-korean-judges-uphold-park-geun-hyes-impeachment	NPR		['impeached', 'corruption', 'korean', 'leader', 'female president', 'prosecution', 'park', 'criminal charges', 'involvement', 'judges uphold impeachment', 'immunity', 'will be forced', 'downfall', 'geun-hye', 'bribery']	South Korean President Will Be Forced From Office As Judges Uphold Impeachment Park Geun-hye, the country's first female president, makes history again as the first South Korean leader to be impeached.
58c2b6f9cd4d740bd30000a9	U.S. Employers Added A Robust 235,000 Jobs In February	2017-03-10T09:23:43-05:00	http://www.npr.org/sections/thetwo-way/2017/03/10/519614370/u-s-employers-added-a-robust-235-000-jobs-in-february	NPR		['percentage point', '235000', '4.7', 'robust', 'jobs gains', 'tenth', 'jobs', 'u.s.', 'unemployment rate', 'report builds', 'february meanwhile', 'employers added']	Employers Added A Robust 235,000 Jobs In February Meanwhile, the unemployment rate stayed about where it has been, dropping just a tenth of a percentage point to 4.7 percent.
58c45de2cd4d740bd30000c3	U.S. Attorney Preet Bharara Says He Was Fired After Refusing To Step Down	2017-03-11T15:28:15-05:00	http://www.npr.org/sections/thetwo-way/2017/03/11/519836024/u-s-attorney-preet-bharara-says-he-was-fired-by-justice-department	NPR		['one', 'bharara', 'preet bharara says', 'federal prosecutor', 'honor', 'moments', 'step down', 'u.s.', 'attorneys', 'was fired', 'high-profile', 'sdny', 'manhattan', 'us attorney', 'professional life.”.', 'refusing', 'tweet saying “i', 'attorney', 'announcement', 'u.s', '46', 'resign', 'trump administration']	U.S. Attorney Preet Bharara Says He Was Fired After Refusing To Step Down The high-profile Manhattan federal prosecutor who was one of 46 U.S attorneys told to resign by the Trump Administration, was fired on Saturday.
58c70ccfcd4d740bd30000e3	GOP Health Care Bill Could Leave 24M More Without Coverage By 2026, CBO Says	2017-03-13T17:19:09-04:00	http://www.npr.org/2017/03/13/520031463/gop-health-care-bill-could-leave-24m-without-coverage-by-2026-cbo-says	NPR		['2018', 'house', 'cbo says', 'current law', '24m', '24 million', 'health insurance', 'budget office estimates', 'care bill', 'health care bill 14', '2026', 'health']	GOP Health Care Bill Could Leave 24M More Without Coverage By 2026, CBO Says The Congressional Budget Office estimates that under the House Republican health care bill, 14 million fewer people would have health insurance by 2018, with 24 million fewer people with coverage by 2026, compared with the uninsured with the current law that year.
58c8aed5cd4d740bd30000fb	Trump Paid About $38 Million In Federal Taxes In 2005, Leaked Returns Say	2017-03-14T23:02:38-04:00	http://www.npr.org/sections/thetwo-way/2017/03/14/520205373/trump-paid-about-38-million-in-federal-taxes-in-2005-leaked-returns-say	NPR		['published..', 'leaked returns say', 'white house', 'return shows', '38', 'alternative minimum', '2005', 'taxes', 'two-page portion', 'trump paid', '150']	Trump Paid About $38 Million In Federal Taxes In 2005, Leaked Returns Say A two-page portion of his return shows he earned about $150 million that year, and would have paid much less in taxes, but for the alternative minimum.
58c96a6fcd4d740bd3000108	House Intelligence Chair: No Evidence Of Alleged Trump Tower Wiretap	2017-03-15T12:22:41-04:00	http://www.npr.org/2017/03/15/520252977/house-intelligence-chair-no-evidence-of-alleged-trump-tower-wiretap	NPR		\['trump', 'campaign', 'alleged trump tower wiretap', 'evidence', 'justice department', 'intelligence chair', 'claims', 'skeptical', 'alleged trump tower wiretap lawmakers', \trump's\]|House Intelligence Chair: No Evidence Of Alleged Trump Tower Wiretap Lawmakers are increasingly skeptical of President Trump's claims, but want the Justice Department to answer whether it has been investigating the Trump campaign.	
58c9cf5fcd4d740bd300012b	Trump's Revised Travel Ban Temporarily Blocked Nationwide By Federal Judge	2017-03-15T19:33:19-04:00	http://www.npr.org/sections/thetwo-way/2017/03/15/520171478/trump-travel-ban-faces-court-hearings-by-challengers-today	NPR		\['countries', 'six', 'effect', 'executive order', 'refugee program', 'federal judge', 'order', 'travel', 'u.s.', 'midnight', 'muslim-majority', 'travel ban', 'hawaii', \trump's revised travel ban temporarily blocked nationwide\]|Trump's Revised Travel Ban Temporarily Blocked Nationwide By Federal Judge A federal judge in Hawaii has issued a temporary restraining order, preventing the president's executive order from taking effect tonight at midnight.	
58ca129dcd4d740bd3000137	Trump To Unveil 'Hard Power' Budget That Boosts Military Spending	2017-03-16T00:20:33-04:00	http://www.npr.org/2017/03/16/520305293/trump-to-unveil-hard-power-budget-that-boosts-military-spending	NPR		\['budget blueprint', \power' budget\, 'hard', 'foreign aid', 'trump', 'percent increase', 'military spending', \trump's\, '10', 'boosts', 'environmental protection agency', 'morning calls', 'spending', 'deep cuts']|Trump To Unveil 'Hard Power' Budget That Boosts Military Spending President Trump's budget blueprint, expected to be revealed Thursday morning, calls for a 10 percent increase in military spending, along with deep cuts in foreign aid and the Environmental Protection Agency.	
58cc2253cd4d740bd3000167	WATCH LIVE: After First Face-To-Face Meeting, Trump And Merkel Address Media	2017-03-17T13:52:11-04:00	http://www.npr.org/sections/thetwo-way/2017/03/17/520511276/watch-live-after-first-face-to-face-meeting-trump-and-merkel-address-media	NPR		\[\trump's\, \relations haven't\, 'meeting', 'u.s.-german', 'merkel address media', 'warm lately', 'german chancellor', 'past comments', 'hopes', 'angela merkel', 'reset', 'relationship', 'merkel address media ruffled', 'face-to-face meeting trump']|WATCH LIVE: After First Face-To-Face Meeting, Trump And Merkel Address Media Ruffled by President Trump's past comments, U.S.-German relations haven't been warm lately.	
58cdbe71cd4d740bd300018e	Chuck Berry, Legend Of Rock And Roll, Dies At 90	2017-03-18T19:10:15-04:00	http://www.npr.org/sections/thetwo-way/2017/03/18/520679732/chuck-berry-legend-of-rock-and-roll-dies-at-90	NPR		['berry', '90', 'development of the music genre', 'roll dies', 'chuck berry legend', 'charles county mo', 'goode', 'department', 'johnny', 'st', 'rock', 'b', 'roll', 'beethoven', 'indelible hits', 'death', 'roll music']	\Chuck Berry, Legend Of Rock And Roll, Dies At 90 Berry was central to the development of the music genre, with indelible hits like \Roll Over Beethoven,\ \Rock and Roll Music\ and \Johnny B.
58cdc2d8cd4d740bd300018f
