id	subject	timestamp	article_url	sender	instance_id	tags	topsentence
587d49d7cd4d746aac000018	Theresa May to lay out clean break from EU	2017-01-16T17:31:23-05:00	https://liveintent.com/ad-choices/	FT		['subscribe', 'theresa may', 'currency markets', 'test', 'nerves', 'eu theresa may', 'leaves', 'country “half', 'ft. theresa may', 'britain', 'eu']	Theresa May to lay out clean break from EU Theresa May will test the nerves of currency markets on Tuesday when she declares that Britain is making a clean break from the EU and will not seek a deal that leaves the country “half in and half out” Subscribe to the FT.  Theresa May to lay out clean break from EU
587d4efecd4d746aac00001a	Theresa May to lay out clean break from EU	2017-01-16T17:53:19-05:00	https://liveintent.com/powered-by/	FT		['leaves', 'ft. theresa may', 'subscribe', 'currency markets', 'theresa may', 'eu theresa may', 'country “half', 'britain', 'test', 'nerves', 'eu']	Theresa May to lay out clean break from EU Theresa May will test the nerves of currency markets on Tuesday when she declares that Britain is making a clean break from the EU and will not seek a deal that leaves the country “half in and half out” Subscribe to the FT.  Theresa May to lay out clean break from EU
587dc60ecd4d746aac000026	British American Tobacco agrees $49.4bn deal to take over Reynolds	2017-01-17T02:21:27-05:00	https://liveintent.com/powered-by/	FT		['over reynolds', 'terms', '49.5bn', 'american', 'camel', 'reynolds', '26', 'tobacco company', '58.7', 'tobacco', 'share –', 'cent', 'price', 'statement on', 'maker', 'move', '59.64', '20', 'tuesday bat', 'cent premium', 'cigarettes', 'agrees 49.4bn', 'agrees 49.5bn', 'sales', 'world’s']	British American Tobacco agrees $49.5bn deal to take over Reynolds British American Tobacco has agreed a $49.5bn deal to take over Reynolds American, maker of Camel cigarettes, a move that will create the world’s largest listed tobacco company by sales.
587e0402cd4d746aac00002e	Xi Jinping delivers robust defence of globalisation at Davos	2017-01-17T06:45:42-05:00	http://click.newsletters.ft.com/f/a/pUr4c48I3h3w6vVaQ9Dkgg~~/AAAAAQA~/RgRaYIiLP0EIAKwjh0qxEoJXCGZpbnRpbWVzWAQAAAAAQgoAAuUDfli6TitdUh9icmVha2luZy5uZXdzLmNhdGNoZXJAZ21haWwuY29tCVEEAAAAAERyaHR0cDovL2xpLmZ0LmNvbS9jbGljaz9zPTE3ODMwNCZzej0zMDB4MjUwJmxpPWJyZWFraW5nLW5ld3MmZT1icmVha2luZy5uZXdzLmNhdGNoZXIlNDBnbWFpbC5jb20mcD0zNTQ4OTkxNzQwNzY3MTExh1oBeyJsaXN0SWQiOiI1NjQ0OTVmOGU0YjBhZjY2ODFmMGYzOWQiLCJjYXRlZ29yeSI6Im5ld3NsZXR0ZXIiLCJwcm9kdWN0IjoiRW1FIiwic291cmNlIjoic2ltcGxlLWVtYWlsLXNlcnZpY2UiLCJlbWFpbElkIjoiNTg3ZTAyN2FjYjkwNjcwMDA0MDkwZGIwIiwidXNlclV1aWQiOiI0NWEzMjIyNi1iNDRjLTRiMGQtYTQzNy02MTJiMDk0OGUyNWQiLCJ0cmFuc2FjdGlvbklkIjoiZTM5NDNkZTAtZGFkZi00NjRlLWE1OWQtZjJiODFiMjhhNDRmIiwiYmluZGluZyI6ImVkaXRvcmlhbCIsInJlcXVlc3RlZFNlbmRUaW1lIjoiMTQ4NDY1MzQzMSIsInRlbXBsYXRlSWQiOiI1NWNjYjg3NTA5MGJmZjAzMDBlNzhiNjMifQ~~	FT		['delivers robust defence', 'drawing', 'inevitable outcome', 'robust defence', 'xi jinping', 'davos', 'davos china’s', 'forum', 'us president-elect’s inaugural address', 'globalisation.”.', 'world', 'line', 'the problems', 'globalisation', 'donald trump', 'free trade']	Xi Jinping delivers robust defence of globalisation at Davos China’s president launched a robust defence of globalisation and free trade on Tuesday, drawing a line between him and Donald Trump just days before the US president-elect’s inaugural address in Washington.
587e0b57cd4d746aac000033	UK to leave EU single market after Brexit, says Theresa May	2017-01-17T07:17:19-05:00	https://www.execsense.com/cio/cio-role-transition/	FT		['membership', 'eu', 'leave”', 'half-in half-out”', 'bits', 'britain', 'theresa may uk', 'brexit', 'countries', 'theresa may', 'uk', 'speech', 'equal partnership', 'market', '27', 'leaves', 'prime minister', 'objectives mrs', 'seek', '—']	UK to leave EU single market after Brexit, says Theresa May UK prime minister Theresa May has promised a clean break with the EU, saying that Britain would not “seek to hold on to bits of membership as we leave”.
587e0bd3cd4d746aac000035	Morgan Stanley profits surge on bond trading	2017-01-17T07:19:01-05:00	http://click.newsletters.ft.com/f/a/KewddZOC-s2zLvx3UomuKA~~/AAAAAQA~/RgRaYJCbP0EIAGwjh0UxH4FXCGZpbnRpbWVzWAQAAAAAQgoAAbULflh-miM4Uh9icmVha2luZy5uZXdzLmNhdGNoZXJAZ21haWwuY29tCVEEAAAAAERyaHR0cDovL2xpLmZ0LmNvbS9jbGljaz9zPTE3ODMwNCZzej0zMDB4MjUwJmxpPWJyZWFraW5nLW5ld3MmZT1icmVha2luZy5uZXdzLmNhdGNoZXIlNDBnbWFpbC5jb20mcD05MzI0ODAxNDc3NjkwMjg4h1oBeyJ0ZW1wbGF0ZUlkIjoiNTVjY2I4NzUwOTBiZmYwMzAwZTc4YjYzIiwiZW1haWxJZCI6IjU4N2UwYWNmM2JhNjdkMDAwNDFmMGVjZiIsImJpbmRpbmciOiJlZGl0b3JpYWwiLCJzb3VyY2UiOiJzaW1wbGUtZW1haWwtc2VydmljZSIsInRyYW5zYWN0aW9uSWQiOiJkZjE1ZjY0MS1lNjFlLTQyYjMtYjJjMy0xZTAxYjQ3OGIxNWYiLCJsaXN0SWQiOiI1NjQ0OTVmOGU0YjBhZjY2ODFmMGYzOWQiLCJyZXF1ZXN0ZWRTZW5kVGltZSI6IjE0ODQ2NTU0OTciLCJ1c2VyVXVpZCI6IjQ1YTMyMjI2LWI0NGMtNGIwZC1hNDM3LTYxMmIwOTQ4ZTI1ZCIsImNhdGVnb3J5IjoibmV3c2xldHRlciIsInByb2R1Y3QiOiJFbUUifQ~~	FT		['end net income', 'year earlier', '1.7bn', 'net income', 'big us banks', 'ben mclannahan', 'upbeat earnings season', 'near-90', '62', 'profits surge', '16', 'revenues', 'net revenues', 'cent', 'morgan stanley', '9bn reports', 'quarter', 'bond', '8.48bn.', 'cent rise', 'york', '1.22bn', 'analysts', 'bumper', 'investment banking']	Morgan Stanley profits surge on bond trading Morgan Stanley continued an upbeat earnings season for the big US banks on Tuesday morning, posting a near-90 per cent rise in net income after a bumper fourth quarter for bond-trading and a solid showing in investment banking.
587e64f3cd4d746aac000047	Rolls-Royce leadership aware of potential corruption in 2010	2017-01-17T13:39:25-05:00	http://click.newsletters.ft.com/f/a/kA5sGPeIuVQIyWfas5IPXw~~/AAAAAQA~/RgRaYOnJP0EIAKwjh0qxP8ZXCGZpbnRpbWVzWAQAAAAAQgoAAt1kfli6TkQkUh9icmVha2luZy5uZXdzLmNhdGNoZXJAZ21haWwuY29tCVEEAAAAAERzaHR0cDovL2xpLmZ0LmNvbS9jbGljaz9zPTE3ODMwNCZzej0zMDB4MjUwJmxpPWJyZWFraW5nLW5ld3MmZT1icmVha2luZy5uZXdzLmNhdGNoZXIlNDBnbWFpbC5jb20mcD0zNjIxNjM2MTI4MTEwMTQxN4daAXsiZW1haWxJZCI6IjU4N2U2MmExM2JhNjdkMDAwNDFmMTVmMyIsInByb2R1Y3QiOiJFbUUiLCJzb3VyY2UiOiJzaW1wbGUtZW1haWwtc2VydmljZSIsInRyYW5zYWN0aW9uSWQiOiI2Yzc2NmM2Mi1mYmFhLTQwN2MtOWMwMi1jMzM4YzQzYjA5ZWEiLCJiaW5kaW5nIjoiZWRpdG9yaWFsIiwidGVtcGxhdGVJZCI6IjU1Y2NiODc1MDkwYmZmMDMwMGU3OGI2MyIsInVzZXJVdWlkIjoiNDVhMzIyMjYtYjQ0Yy00YjBkLWE0MzctNjEyYjA5NDhlMjVkIiwibGlzdElkIjoiNTY0NDk1ZjhlNGIwYWY2NjgxZjBmMzlkIiwicmVxdWVzdGVkU2VuZFRpbWUiOiIxNDg0Njc4MzI2IiwiY2F0ZWdvcnkiOiJuZXdzbGV0dGVyIn0~	FT		['revelation raises questions', 'sir john rose', 'notify authorities', '1996', 'industrialist', 'conduct', '2011', 'britain’s', 'chief executive', 'leadership', 'court ruling', 'rolls-royce', 'potential corruption', '2010', 'group']	The revelation raises questions over the conduct of Sir John Rose, once hailed as Britain’s leading industrialist, who led the group as chief executive from 1996 to 2011.
587f1b6fcd4d746aac000065	Pearson issues 2018 profit warning, plans to exit Random House business	2017-01-18T02:38:10-05:00	https://liveintent.com/powered-by/	FT		['back', 'owner', 'update', 'american business', 'random house business education group', 'unprecedented” decline', 'arm', 'profit warning plans', '2018', 'random house business', 'pearson', 'financial', 'warning', 'profit goal', 'full-year results', 'north american business', 'sharp slump', 'profits', 'issues', 'random house', 'exit', 'dividend', 'publisher']	Pearson issues 2018 profit warning, plans to exit Random House business Education group Pearson is looking to sell its stake in publisher Random House after it issued a warning on its 2018 profits on the back of an “unprecedented” decline in its North American business.
587f663fcd4d746aac00006a	Goldman Q4 profit triples on trading surge	2017-01-18T07:57:06-05:00	https://www.execsense.com/ceo/create-advisory-board-how-to/	FT		['goldman sachs', 'goldman q4', 'surge', 'analysts’ forecasts', 'bright earnings season', 'big us banks', 'profit triples', 'fourth-quarter profit']	Goldman Q4 profit triples on trading surge Goldman Sachs has capped an unusually bright earnings season for the big US banks, delivering a tripling in fourth-quarter profit that handily beat analysts’ forecasts.
587f6b8bcd4d746aac00006e	Bond trading lifts Citigroup to first profit in 4 quarters	2017-01-18T08:20:03-05:00	http://click.newsletters.ft.com/f/a/DjfNUHjrCADObYXb2NsnNg~~/AAAAAQA~/RgRaYfBuP0EIAGwjh0Uy_1dXCGZpbnRpbWVzWAQAAAAAQgoAAYNrf1h-mo6GUh9icmVha2luZy5uZXdzLmNhdGNoZXJAZ21haWwuY29tCVEEAAAAAERzaHR0cDovL2xpLmZ0LmNvbS9jbGljaz9zPTE3ODMwNCZzej0zMDB4MjUwJmxpPWJyZWFraW5nLW5ld3MmZT1icmVha2luZy5uZXdzLmNhdGNoZXIlNDBnbWFpbC5jb20mcD0xMTE1NTg5NDQ5Mjg4ODg1MYdaAXsicmVxdWVzdGVkU2VuZFRpbWUiOiIxNDg0NzQ1NTY3IiwidXNlclV1aWQiOiI0NWEzMjIyNi1iNDRjLTRiMGQtYTQzNy02MTJiMDk0OGUyNWQiLCJzb3VyY2UiOiJzaW1wbGUtZW1haWwtc2VydmljZSIsImNhdGVnb3J5IjoibmV3c2xldHRlciIsImVtYWlsSWQiOiI1ODdmNjZmMGYwMDUzODAwMDRiYzc5NGIiLCJsaXN0SWQiOiI1NjQ0OTVmOGU0YjBhZjY2ODFmMGYzOWQiLCJ0ZW1wbGF0ZUlkIjoiNTVjY2I4NzUwOTBiZmYwMzAwZTc4YjYzIiwidHJhbnNhY3Rpb25JZCI6IjU2NTM3MzczLWE0MmUtNGFiNC1iMTM3LWI2NzBjMzc3ZTI2MSIsInByb2R1Y3QiOiJFbUUiLCJiaW5kaW5nIjoiZWRpdG9yaWFsIn0~	FT		['2016', 'quarters', 'election', 'citi’s', 'wall street’s', 'flood', 'us bank', 'months', '36', 'decision', 'reserve’s', 'orders', 'expand revenues', 'three', 'interest rates', 'income division', 'cent', 'rivals', 'four', 'profit', 'bank', 'position', '4', 'donald trump', '15', 'surge', 'bond', 'citigroup', 'business', 'clients', 'revenues', 'equities', 'lifts', 'rewards']	Revenues from Citi’s fixed income division rose 36 per cent from a year earlier in the final three months of 2016 as clients made a flood of orders to position for the new presidency as well as the Federal Reserve’s decision on interest rates.
588004c9cd4d7409b4000007	Man Utd takes top spot on football’s rich list	2017-01-18T19:13:38-05:00	https://liveintent.com/powered-by/	FT		['ft', 'manchester utd', 'utd', 'rich list', 'man', 'premier league', 'decade', 'football clubs', 'real madrid', 'football’s', 'subscribe', 'summit', 'manchester united may', 'knocks', 'recent years', 'place', 'english', 'europe’s']	Manchester Utd knocks Real Madrid from top of football’s rich list Manchester United may have lost its place at the summit of the English Premier League in recent years, but it has returned to the top of the annual ranking of Europe’s richest football clubs for the first time in more than a decade.
5880b67dcd4d7409b4000018	ECB keeps rates unchanged in January	2017-01-19T07:52:05-05:00	https://www.execsense.com/cio/cio-role-transition/	FT		['line', '€80bn quantitative', 'bond', 'ecb', 'policy meeting', 'european central bank', 'policymakers', 'forecasts', 'pace', 'rates', 'change decision', 'today’s', 'meeting', 'record lows', '2016', 'measures', 'benchmark interest rates']	ECB keeps rates unchanged in January The European Central Bank has maintained its benchmark interest rates at record lows and left the pace of its bond purchases unchanged at its January policy meeting, in line with forecasts.
588170e8cd4d744297000002	China GDP hits growth target as stimulus outweighs reform	2017-01-19T21:07:09-05:00	https://liveintent.com/powered-by/	FT		['fiscal stimulus', 'headwinds', 'china’s', 'geopolitical risks', 'possible trade war looms', '2016', 'building', 'stimulus outweighs reform', 'china gdp', 'donald trump', 'hits growth target', 'economy', 'us', 'policymakers', 'robust']	Economy stabilised in 2016 but financial and geopolitical risks are building China’s economy avoided a hard landing in 2016 thanks to robust monetary and fiscal stimulus, but policymakers are now bracing for headwinds as a possible trade war looms under the US presidency of Donald Trump.
5882427ccd4d744297000025	Donald Trump sworn is as 45th president of the US	2017-01-20T12:01:29-05:00	http://click.newsletters.ft.com/f/a/6M27NhxBLK84mv77ZVjUkg~~/AAAAAQA~/RgRaZMdSP0EIAOwjh1C2YvZXCGZpbnRpbWVzWAQAAAAAQgoAA2dCglh0O5zuUh9icmVha2luZy5uZXdzLmNhdGNoZXJAZ21haWwuY29tCVEEAAAAAERyaHR0cDovL2xpLmZ0LmNvbS9jbGljaz9zPTE3ODMwNCZzej0zMDB4MjUwJmxpPWJyZWFraW5nLW5ld3MmZT1icmVha2luZy5uZXdzLmNhdGNoZXIlNDBnbWFpbC5jb20mcD03MDI4NjY2MDM1NzQ1NzAxh1oBeyJjYXRlZ29yeSI6Im5ld3NsZXR0ZXIiLCJwcm9kdWN0IjoiRW1FIiwibGlzdElkIjoiNTY0NDk1ZjhlNGIwYWY2NjgxZjBmMzlkIiwidXNlclV1aWQiOiI0NWEzMjIyNi1iNDRjLTRiMGQtYTQzNy02MTJiMDk0OGUyNWQiLCJiaW5kaW5nIjoiZWRpdG9yaWFsIiwidGVtcGxhdGVJZCI6IjU1Y2NiODc1MDkwYmZmMDMwMGU3OGI2MyIsInJlcXVlc3RlZFNlbmRUaW1lIjoiMTQ4NDkzMTY2MCIsInRyYW5zYWN0aW9uSWQiOiI1YzNiMDU5MC00NGNmLTQzYTQtOTJlNS0yYTBhZmUwYWRlNmMiLCJlbWFpbElkIjoiNTg4MjNkMmM2YjAyNTAwMDA0YWViYTAwIiwic291cmNlIjoic2ltcGxlLWVtYWlsLXNlcnZpY2UifQ~~	FT		['bible', 'barack obama', 'end', 'unlikely journey', 'three', 'donald trump has', 'vice-president', 'bush', 'attended', 'eight', 'w', 'own bible', 'jimmy carter bill clinton', 'powerful man', 'donald trump', 'abraham lincoln', 'supreme court chief justice', 'property developer', 'mr trump', 'presidents —', 'states', 'ceremony', 'sworn', 'york', 'george', '45th president', 'world', 'presidency', 'us', 'was sworn', '—', 'mike pence']	Attended by three former presidents — Jimmy Carter, Bill Clinton and George W Bush — the ceremony marked the end of eight years of the presidency of Barack Obama.
5882ac66cd4d74429700004b	Theresa May to emphasise value of EU and Nato to Trump	2017-01-20T19:33:34-05:00	https://www.ft.com/products	FT		['weeks', 'trump', 'urge', 'trump theresa may', 'honesty', 'britain', 'eu', 'financial', 'crucial partner', 'key element', 'nato', 'british prime minister', 'new president', 'donald trump', 'theresa may', 'special relationship”', 'very frank” discussions', 'security issues', 'emphasise value', 'interview', 'european unity']	Theresa May to emphasise value of EU and Nato to Trump Theresa May will urge Donald Trump not to undermine European unity when she meets him in Washington in the next few weeks, insisting that Britain sees a strong EU as a crucial partner on both economic and security issues.
58863303cd4d747787000006	Theresa May plans China visit to bolster trade	2017-01-23T11:44:49-05:00	https://www.ft.com/products	FT		\['wake', 'theresa may', 'beijing', 'shore', 'arrangements', 'uk', 'bolster trade', \june's\, 'attempt', 'links', 'chinese officials', 'britain’s', 'leg', 'eu', 'soon', 'vote', 'world’s second-largest economy', \prime minister's visit\, 'donald trump', 'us president', 'china']|The UK prime minister's visit to Beijing will represent the second leg of an attempt to strengthen Britain’s global trading links in the wake of June's vote to leave the EU; later this week she will hold talks with Donald Trump, the US president, in Washington.	
58863603cd4d747787000007	Theresa May plans China visit to bolster trade	2017-01-23T11:57:07-05:00	https://www.ft.com/products	FT		['arrangements', 'soon', 'shore', 'bolster trade', 'china', 'uk', 'world’s second-largest economy', 'theresa may', 'chinese officials', 'britain’s']	Theresa May plans China visit to bolster trade Theresa May intends to visit China “relatively soon” to shore up Britain’s trading arrangements with the world’s second-largest economy, said UK and Chinese officials.
5887019bcd4d747787000028	BT Italian writedown balloons to £530m	2017-01-24T02:25:57-05:00	http://click.newsletters.ft.com/f/a/roZ9ZizYL8UfRLk78dTNdg~~/AAAAAQA~/RgRaaYYiP0EIAOwjh1C76eVXCGZpbnRpbWVzWAQAAAAAQgoAA4UBh1h0O1uUUh9icmVha2luZy5uZXdzLmNhdGNoZXJAZ21haWwuY29tCVEEAAAAAERyaHR0cDovL2xpLmZ0LmNvbS9jbGljaz9zPTE3ODMwNCZzej0zMDB4MjUwJmxpPWJyZWFraW5nLW5ld3MmZT1icmVha2luZy5uZXdzLmNhdGNoZXIlNDBnbWFpbC5jb20mcD01NTE4OTU0MTU2NDY1Mzc0h1oBeyJiaW5kaW5nIjoiZWRpdG9yaWFsIiwiY2F0ZWdvcnkiOiJuZXdzbGV0dGVyIiwidXNlclV1aWQiOiI0NWEzMjIyNi1iNDRjLTRiMGQtYTQzNy02MTJiMDk0OGUyNWQiLCJwcm9kdWN0IjoiRW1FIiwiZW1haWxJZCI6IjU4ODZmZmE1MDVhYjU2MDAwNDViYWYxYiIsImxpc3RJZCI6IjU2NDQ5NWY4ZTRiMGFmNjY4MWYwZjM5ZCIsInRlbXBsYXRlSWQiOiI1NWNjYjg3NTA5MGJmZjAzMDBlNzhiNjMiLCJyZXF1ZXN0ZWRTZW5kVGltZSI6IjE0ODUyNDI2NDMiLCJ0cmFuc2FjdGlvbklkIjoiMWE2NDE5ZmQtNzdjMC00MTM0LWFiYmEtMjQzMDBiNWExMzdhIiwic291cmNlIjoic2ltcGxlLWVtYWlsLXNlcnZpY2UifQ~~	FT		['country', 'writedowns', 'errors', '£145m', 'estimate', 'cost', 'italy', 'telecoms company', 'independent investigation', 'bt', 'uk', 'kpmg', 'faces', '£530m', 'italian writedown balloons', 'improper behaviour', 'would increase the size']	BT Italian writedown balloons to £530m UK telecoms company BT said on Tuesday it would increase the size of writedowns it faces in Italy over “improper behaviour” in the country to £530m, from an earlier estimate of £145m.
588722a9cd4d741ed8000002	UK Supreme Court rules parliament must hold vote on Article 50	2017-01-24T04:47:12-05:00	https://www.execsense.com/ceo/create-advisory-board-how-to/	FT		['court', 'majority', 'prime minister', 'royal prerogative', 'uk’s', 'one', 'eu', '8 to 3 that', 'theresa may', 'uk', 'important constitutional cases', 'trigger', 'vote', 'two-year exit', 'modern times', 'blow', 'government', 'article', 'parliamentary vote', '50', 'ruling', 'supreme court', 'supreme court rules parliament']	In one of most important constitutional cases of modern times, the Supreme Court ruled by a majority of 8 to 3 that the UK prime minister cannot use royal prerogative to trigger Article 50 and start the UK’s two-year exit from the EU.
58873a68cd4d741ed8000007	We must rebuild the EU as Trump pursues protectionist 'illusion', says Macron	2017-01-24T06:28:11-05:00	https://www.ft.com/products	FT		\['macron emmanuel macron', 'organisation', 'rebuilt', 'power', \pursues protectionist 'illusion\, 'strengthened to', 'trump', 'global role', 'macron', 'writing', 'donald trump', 'presidency', 'new us president', 'backfire', 'eu', 'warns', 'dysfunctional', 'centrist candidate', 'economics minister', 'protectionist policies', 'brexit', 'ft']|\We must rebuild the EU as Trump pursues protectionist 'illusion', says Macron Emmanuel Macron, the former economics minister and centrist candidate for the French presidency, says Brexit has shown the EU is a \dysfunctional and highly uninspiring organisation\ which must be rebuilt and strengthened to take on a greater global role.
5887535fcd4d741ed8000008	Live: Watch the Oscar nominations
58876cf4cd4d741ed800001a	Ex-EU parliament chief Schulz backed to challenge Merkel	2017-01-24T10:04:03-05:00	http://click.newsletters.ft.com/f/a/pwwy_ZFFY_w21r-hYvxIiw~~/AAAAAQA~/RgRaafHRP0EIAKwjh0q8bfVXCGZpbnRpbWVzWAQAAAAAQgoAAuNsh1i6TqxIUh9icmVha2luZy5uZXdzLmNhdGNoZXJAZ21haWwuY29tCVEEAAAAAERyaHR0cDovL2xpLmZ0LmNvbS9jbGljaz9zPTE3ODMwNCZzej0zMDB4MjUwJmxpPWJyZWFraW5nLW5ld3MmZT1icmVha2luZy5uZXdzLmNhdGNoZXIlNDBnbWFpbC5jb20mcD0xODAxNTI2NjM5MjE0OTYxh1oBeyJyZXF1ZXN0ZWRTZW5kVGltZSI6IjE0ODUyNzAyMDQiLCJlbWFpbElkIjoiNTg4NzY5YTU4M2Y2M2IwMDA0M2Q3ZWM5IiwiYmluZGluZyI6ImVkaXRvcmlhbCIsInRlbXBsYXRlSWQiOiI1NWNjYjg3NTA5MGJmZjAzMDBlNzhiNjMiLCJwcm9kdWN0IjoiRW1FIiwic291cmNlIjoic2ltcGxlLWVtYWlsLXNlcnZpY2UiLCJ0cmFuc2FjdGlvbklkIjoiMWM5NDk5ODEtODdhMC00OGIwLWI2NjUtYWI4ODk4Yjk4NTA5IiwibGlzdElkIjoiNTY0NDk1ZjhlNGIwYWY2NjgxZjBmMzlkIiwidXNlclV1aWQiOiI0NWEzMjIyNi1iNDRjLTRiMGQtYTQzNy02MTJiMDk0OGUyNWQiLCJjYXRlZ29yeSI6Im5ld3NsZXR0ZXIifQ~~	FT		['ex-eu', 'martin schulz', 'chancellor', 'lays', 'schulz', 'decision', 'european parliament president', 'parliament chief', 'centre-left party and challenge', 'chance', 'angela merkel', 'merkel sigmar gabriel', 'year’s parliamentary election', 'click', 'merkel', 'german social democrat leader', 'ground']	Ex-EU parliament chief Schulz backed to challenge Merkel Sigmar Gabriel, the German social democrat leader, has turned down the chance to run against Angela Merkel in this year’s parliamentary election, a decision that lays the ground for Martin Schulz, the former European Parliament president, to take over the centre-left party and challenge the chancellor.
5888b7abcd4d742c5f000015	Dow Jones Industrial Average hits 20,000 milestone	2017-01-25T09:35:15-05:00	https://www.execsense.com/cio/cio-role-transition/	FT		['points', 'wall', 'onset', 'dow jones', 'wake', 'us equities', '0.5', 'blue-chip companies', 'presidential election', 'resumes', 'average', 'venerable equity barometer', ' the', 'cent', 'street’s', 'milestone', 'gauge', 'trump', '20000', 'rally', '2017', 'hits']	Dow Jones Industrial Average hits 20,000 milestone The Dow Jones Industrial Average on Wednesday rose above 20,000 points for the first time, marking a milestone for Wall Street’s venerable equity barometer as the Trump trade that stalled at the onset of 2017 resumes.
5888dc33cd4d745609000001	French open inquiry into payments to François Fillon’s wife	2017-01-25T12:10:31-05:00	http://click.newsletters.ft.com/f/a/fy1LbSpk-XFC4153UWsLDQ~~/AAAAAQA~/RgRaa2CoP0EIAOwjh1C97opXCGZpbnRpbWVzWAQAAAAAQgoAAwfciFh0O8RSUh9icmVha2luZy5uZXdzLmNhdGNoZXJAZ21haWwuY29tCVEEAAAAAERyaHR0cDovL2xpLmZ0LmNvbS9jbGljaz9zPTE3ODMwNCZzej0zMDB4MjUwJmxpPWJyZWFraW5nLW5ld3MmZT1icmVha2luZy5uZXdzLmNhdGNoZXIlNDBnbWFpbC5jb20mcD04NzcyMjA4OTU2MjgyODI4h1oBeyJjYXRlZ29yeSI6Im5ld3NsZXR0ZXIiLCJwcm9kdWN0IjoiRW1FIiwidHJhbnNhY3Rpb25JZCI6ImY4NjZkODQ2LWJhMzUtNGNhNi1iYWRlLTI4ZmRlNzhjNzhhOSIsImxpc3RJZCI6IjU2NDQ5NWY4ZTRiMGFmNjY4MWYwZjM5ZCIsInJlcXVlc3RlZFNlbmRUaW1lIjoiMTQ4NTM2NDEyMCIsInVzZXJVdWlkIjoiNDVhMzIyMjYtYjQ0Yy00YjBkLWE0MzctNjEyYjA5NDhlMjVkIiwic291cmNlIjoic2ltcGxlLWVtYWlsLXNlcnZpY2UiLCJiaW5kaW5nIjoiZWRpdG9yaWFsIiwiZW1haWxJZCI6IjU4ODhkYWRiNTJlNGJhMDAwNDE2M2ZjYyIsInRlbXBsYXRlSWQiOiI1NWNjYjg3NTA5MGJmZjAzMDBlNzhiNjMifQ~~	FT		['restore high', 'mr fillon', 'presidential frontrunner', 'penelope fillon', 'aide', 'parliamentary aide', 'open inquiry', 'french authorities', 'work', '€500000', 'allegations', 'total', 'weekly french satirical newspaper', 'wife', 'francois fillon', 'presidential nomination', 'french', 'francois fillon’s', 'payments', 'claims', 'fake job', 'vow', 'centre-right', 'eight', 'moral standards']	Mr Fillon, who won the centre-right presidential nomination in November on a vow to restore high moral standards in French politics, is facing allegations from a weekly French satirical newspaper that his wife Penelope Fillon earned a total of €500,000 over eight years as an aide but did little work.
5889a31ecd4d746435000001	Johnson & Johnson to buy Actelion for $30bn	2017-01-26T02:19:54-05:00	https://www.execsense.com/cio/cio-role-transition/	FT		['healthcare company', 'actelion', 'switzerland', '280', 'unit', 'swiss biotech group', 'latter’s', 'world’s', 'standalone company', 'us-based jj', 'outstanding shares', 'johnson', 'announcement', 'rd', 'all-cash tender', '30bn', 'biotechnology company', 'share']	Actelion said in an announcement that the all-cash tender offer from US-based J&J, the world’s largest healthcare company, would be made in Switzerland for all outstanding shares in the Swiss biotech group at $280 per share.
5889c815cd4d746435000003	UK shrugs off Brexit fears to become fastest growing economy in 2016	2017-01-26T04:57:26-05:00	http://click.newsletters.ft.com/f/a/xI-1GYr_3SXpD9DCkdk9Bw~~/AAAAAQA~/RgRabEz1P0EIAKxEeVwBrExXCGZpbnRpbWVzWAQAAAAAQgoAAgbIiViXQ-O5Uh9icmVha2luZy5uZXdzLmNhdGNoZXJAZ21haWwuY29tCVEEAAAAAERzaHR0cDovL2xpLmZ0LmNvbS9jbGljaz9zPTE3ODMwNCZzej0zMDB4MjUwJmxpPWJyZWFraW5nLW5ld3MmZT1icmVha2luZy5uZXdzLmNhdGNoZXIlNDBnbWFpbC5jb20mcD0wOTE0MjgwMTg2NjQxODkxNYdaAXsiZW1haWxJZCI6IjU4ODljNjk3MDdjOGEyMDAwNDMxM2ZiOSIsImxpc3RJZCI6IjU2NDQ5NWY4ZTRiMGFmNjY4MWYwZjM5ZCIsInByb2R1Y3QiOiJFbUUiLCJ0cmFuc2FjdGlvbklkIjoiYTc5NjNiMzQtNDJiNi00YzlhLWEwYzItY2E4YzlhMTk1MWUzIiwicmVxdWVzdGVkU2VuZFRpbWUiOiIxNDg1NDI0NjA2IiwidXNlclV1aWQiOiI0NWEzMjIyNi1iNDRjLTRiMGQtYTQzNy02MTJiMDk0OGUyNWQiLCJ0ZW1wbGF0ZUlkIjoiNTVjY2I4NzUwOTBiZmYwMzAwZTc4YjYzIiwic291cmNlIjoic2ltcGxlLWVtYWlsLXNlcnZpY2UiLCJjYXRlZ29yeSI6Im5ld3NsZXR0ZXIiLCJiaW5kaW5nIjoiZWRpdG9yaWFsIn0~	FT		['0.6', 'slowdown', 'growth', 'signs', 'eu', 'cent', 'power', 'shrugs', 'quarter', 'fears', 'three', 'cent growth', '2015', '2016', 'economists', '2.2', 'brexit', 'statistics', 'economy', 'country', 'uk', '2.0', 'months']	UK shrugs off Brexit fears to become fastest growing economy in 2016 The UK economy continued to power ahead over the final three months of last year, showing no signs of the slowdown that many economists had predicted since the country voted to leave the EU in June.
5889db7acd4d746435000004	Trump adviser Carl Icahn gains on mooted energy reform	2017-01-26T06:19:57-05:00	https://www.ft.com/products	FT		['trump', 'regulatory reform', 'shares', '200m', 'energy company', 'carl icahn', 'federal biofuel mandate', 'donald trump’s', 'billionaire investor', 'cvr energy', 'energy reform', 'mr icahn', 'adviser', 'expectation', 'costs', 'special adviser', 'new administration', 'election', 'environmental rules', 'gains', 'cvr', 'value']	Trump adviser Carl Icahn gains on mooted energy reform Donald Trump’s election has doubled the value of an energy company owned by billionaire investor Carl Icahn, who was appointed special adviser to the president on regulatory reform.
588a2cf6cd4d74643500000e	Mexican president scraps Trump summit over border wall dispute	2017-01-26T12:07:36-05:00	https://www.ft.com/content/a69893a6-e379-11e6-8405-9e5580d6e5fb	FT		['mexico', 'border wall', 'donald trump', 'border wall dispute', 'mexico’s', 'us president’s insistence', 'trump', 'mexican president scraps', 'summit']	Mexican president scraps Trump summit over border wall dispute Mexico’s president has cancelled a planned summit with Donald Trump over the US president’s insistence that Mexico pay for his proposed border wall.
