id	subject	timestamp	article_url	sender	instance_id	tags	topsentence
59097ac8cd4d74698a000092	ITV chief executive Crozier steps down	2017-05-03T02:37:51-04:00	https://www.execsense.com/cio/cio-role-transition/	FT		['commercial broadcaster', 'seven', 'place', 'had a “well', 'adam crozier', 'steps', 'plc', 'build', 'succession plan', 'portfolio', 'britain’s', 'post at the helm', 'mr crozier', 'private sectors”', 'roles', 'departs', 'crozier', 'chief executive', 'statement', 'itv']	ITV chief executive Crozier steps down Adam Crozier is leaving his post at the helm of ITV after seven years to “build a portfolio of roles across the PLC and private sectors”.
5909c819cd4d74698a000094	€100bn Brexit bill: How the FT calculated the EU's new opening bid	2017-05-03T08:07:46-04:00	https://www.ft.com/products	FT		\['variables', 'britain’s brexit', 'ft', 'contested', 'law', 'calculation', \eu's\, 'exit dues', 'negotiation', '€100bn', 'brexit', 'legion', 'start', 'eu’s', '€100bn demand', 'doubt', 'one', 'bill', 'britain’s', 'bid', 'political dangers', 'process']|€100bn Brexit bill: How the FT calculated the EU's new opening bid The law justifying Britain’s Brexit bill is hotly contested, the variables in the calculation are legion and the negotiation has yet to start.	
5909f4cdcd4d74698a00009e	Theresa May accuses EU of trying to undermine UK election	2017-05-03T11:18:10-04:00	https://www.execsense.com/ceo/create-advisory-board-how-to/	FT		\['accuses', 'queen', 'britain', 'street', 'prosper', \uk's\, 'downing', 'theresa may', 'eu', 'vote', 'european politicians', 'threats', 'uk prime', 'counterparties “do', 'officials who', 'dissolution', 'mark', 'meeting', 'parliament', 'uk', 'election', 'result', 'brexit', 'minister', '10', 'mrs']|Speaking outside 10 Downing Street after a meeting with the Queen to mark the dissolution of parliament ahead of the vote in June, Mrs May said some EU counterparties “do not want Britain to prosper” from the Brexit talks.	
590a1bdacd4d74698a0000ac	Fed sees US slowdown as temporary	2017-05-03T14:04:56-04:00	https://www.execsense.com/ceo/create-advisory-board-how-to/	FT		['1', 'household spending growth', 'modestly” lately', 'federal reserve', 'target range', 'recent slowdown', '0.75', 'janet yellen', 'us growth', 'us', 'two-day meeting', 'increase', 'consumption growth', 'fed', 'cent', 'fundamentals', 'short-term interest rates', 'statement policymakers', 'central bank', 'course', 'us slowdown', 'federal funds', 'solid', 'chair']	Fed sees US slowdown as temporary The Federal Reserve said it believes the recent slowdown in US growth is likely to prove temporary as it stayed on course for a further increase in short-term interest rates as soon as June.
5878f861cd4d74637300011a	Special Report: California's bullet train hurtling toward multibillion-dollar cost overrun, federal report warns	2017-01-13T10:54:44-05:00		Los Angeles Times		\['federal railroad administration analysis', 'easiest part', 'confidential', \california's\, 'san francisco', 'bullet train', 'valley', \report california's\, 'route', 'miles', '—', 'multibillion-dollar cost overrun', 'taxpayers 50', '3.6', 'california’s', 'federal report warns', 'billion', 'project’s', '118']|California's bullet train hurtling toward multibillion-dollar cost overrun, federal report warns California’s bullet train could cost taxpayers 50% more than estimated — as much as $3.6 billion more, according to a confidential Federal Railroad Administration analysis obtained by The Times.	
5879375dcd4d74637300012a	Breaking News: 5 accused of helping gunman evade capture in killing of L.A. County sheriff's sergeant	2017-01-13T15:23:35-05:00		Los Angeles Times		['sheriff’s sergeant', 'man evade police', 'lancaster', 'police dragnet', 'steve owen', 'burglary', 'sheriff’s', 'gunman evade', 'shot', 'trenton', 'sgt', 'county', 'sergeant', 'five', '5', 'department detectives', 'year officials', 'trevon lovell', 'l.a.', 'officer', 'elude']	5 accused of helping gunman evade capture in killing of L.A. County sheriff's sergeant Los Angeles County Sheriff’s Department detectives have arrested five people who they say helped a man evade police after he allegedly shot and killed a sheriff’s sergeant last year, officials announced today.
587940decd4d746373000134	Breaking News: Notorious serial rapist must remain in state hospital, judge rules	2017-01-13T16:04:22-05:00		Los Angeles Times		['santa clara', '44', 'sexual assaults', 'additional mental health treatment', 'decision', '2014', 'serial rapist', 'christopher hubbart', 'california', 'palmdale', 'pillowcase rapist', 'state hospital judge rules', 'sex offender', 'return', 'county judge', 'release', 'notorious', 'breaking news notorious', 'state hospital']	Notorious serial rapist must remain in state hospital, judge rules A sex offender dubbed the Pillowcase Rapist, who admitted to at least 44 sexual assaults across California, must be confined in a state hospital and undergo additional mental health treatment, a Santa Clara County judge ruled today.
58796499cd4d746373000138	Breaking News: Chief executive of Sony Entertainment to step down	2017-01-13T18:36:40-05:00		Los Angeles Times		['sony entertainment', 'parent company', 'new role', 'los angeles-based', 'sony entertainment', 'company', 'focus', 'resign', '13', '2', 'studio for', 'snap inc', 'michael lynton', 'snapchat sony', 'lynton', 'japanese-owned', 'chief executive', 'chairman']	Lynton, who has led the Japanese-owned studio for 13 years, will resign Feb. 2 to focus on his new role as chairman of Snap Inc., the Los Angeles-based parent company of Snapchat, Sony said.
587c0cf4cd4d746373000143	Breaking News: Author of California histories and former state Librarian Kevin Starr dies at 76	2017-01-15T18:59:34-05:00		Los Angeles Times		['breaking news author', 'rich cultural', 'americans', 'author', 'histories', 'california dream', 'its singular hold', 'political histories', '76', 'birth growth and maturation', 'california', 'librarian kevin starr', 'public imagination', 'series', 'starr captured']	Author of California histories and former state Librarian Kevin Starr dies at 76 Former California State Librarian Kevin Starr, who wrote rich cultural, economic and political histories on the birth, growth and maturation of the Golden State, died Saturday.
587c5747cd4d746373000147	Breaking News: Head of Samsung Electronics charged in South Korean political scandal	2017-01-16T00:16:36-05:00		Los Angeles Times		['confidant', 'arrest', 'country’s president', 'lee jae-yong', 'samsung', 'warrant', 'leader', 'political scandal', 'breaking news head', 'prosecutors', 'group’s', 'company funds', 'investigators', 'bribery case', 'samsung electronics co', 'allege', 'head', 'impeachment', 'president park', 'samsung electronics', 'korean', 'geun-hye', 'vice chairman']	Head of Samsung Electronics charged in South Korean political scandal South Korean prosecutors have issued a warrant for the arrest of the Samsung group’s de facto leader in a bribery case related to last month's impeachment of the country’s president.
587d095acd4d746aac00000a	Breaking News: FBI arrests wife of Orlando nightclub shooter	2017-01-16T12:56:38-05:00		Los Angeles Times		['fbi', '49', 'faces charges', 'obstruction', 'mass shooting', 'custody', 'justice', 'killed', 'wife', 'area', 'nightclub', 'law enforcement', 'san francisco', 'pulse', '12', 'connection', 'orlando', 'official said', 'fbi arrests wife', 'noor salman', 'u.s.', 'florida', 'nightclub shooter']	The official said Noor Salman was taken into custody in the San Francisco area and faces charges in Florida including obstruction of justice in connection with the June 12 mass shooting at the Pulse nightclub in which 49 people were killed.
587e9434cd4d746aac000056	Breaking News: Aliso Canyon natural gas facility can reopen even though cause of massive leak still undetermined	2017-01-17T17:01:10-05:00		Los Angeles Times		['natural gas facility', 'blowout', 'thousands', 'gas', 'natural gas storage field', 'aliso canyon', 'california', 'breaking news aliso canyon', '2015', 'original size state regulators', 'move', 'facility', 'determined', 'flee', 'homes', 'massive leak', 'reopen']	Aliso Canyon natural gas facility can reopen even though cause of massive leak still undetermined Southern California Gas can reopen its troubled Aliso Canyon natural gas storage field at a third its original size, state regulators said today.
587e96dacd4d746aac00005a	Breaking News: President Obama commutes sentence of Chelsea Manning	2017-01-17T17:12:26-05:00		Los Angeles Times		['u.s.', 'chelsea manning', 'thousands', '2010', 'obama', 'army', 'sentence', 'commutes sentence', 'anti-secrecy website', 'wikileaks']	President Obama commutes sentence of Chelsea Manning President Obama has sharply reduced the sentence of Chelsea Manning, the U.S. Army private convicted of leaking thousands of classified reports to the anti-secrecy website WikiLeaks in 2010, it was announced today.
58800077cd4d7409b4000005	Breaking News: Trump's EPA pick casts doubt on California's long-time power to set its own clean-air standards	2017-01-18T18:55:15-05:00		Los Angeles Times		\['scott pruitt donald trump’s', 'should continue', 'global warming', \trump's epa\, 'california', 'trucks', \california's\, 'authority', 'own emissions rules for cars', 'casts doubt', 'cornerstone', 'own clean-air standards', 'environmental protection agency', 'atty', 'oklahoma', 'cast doubt', 'its efforts', 'decades that', \breaking news trump's epa\, 'long-time power', 'gen', 'power to impose']|Gen. Scott Pruitt, Donald Trump’s pick to lead the Environmental Protection Agency, today cast doubt on whether California should continue to have power to impose its own emissions rules for cars and trucks, an authority the state has enjoyed for decades that is also the cornerstone of its efforts to fight global warming.	
588057aacd4d7409b4000010	Breaking News: Video shows police cornering mentally ill man and fatally shooting him: 'This was an execution'	2017-01-19T01:07:18-05:00		Los Angeles Times		\[\him 'this\, 'surveillance video', 'fontana', 'man', 'police officers', 'officer', 'shoots him', 'throng', 'graphic', 'shows police', 'convenience store', 'video', 'blind man', 'breaking news video', 'execution', 'shows']|Video shows police cornering mentally ill man and fatally shooting him: 'This was an execution' Graphic surveillance video released Wednesday shows a throng of Fontana police officers surrounding a legally blind man in a convenience store before an officer opens fire and fatally shoots him.	
588122c8cd4d7409b4000029	Breaking News: City devastated by OxyContin use sues Purdue Pharma, claims drugmaker put profits over citizens' welfare	2017-01-19T15:33:51-05:00		Los Angeles Times		\[\painkillers' manufacturer today\, 'pills', 'city', 'black market', 'foot', \citizens' welfare\, 'blind eye', 'community', '100000', 'widespread opioid addiction', 'suit', 'purdue', 'bill', 'investigation', 'purdue pharma', 'criminal', 'claims drugmaker', 'first-of-its-kind lawsuit', 'profits', 'seattle', 'obscene profits', 'everett', 'oxycontin', 'sues', 'reap', 'company']|\City devastated by OxyContin use sues Purdue Pharma, claims drugmaker put profits over citizens' welfare A Washington city devastated by black market OxyContin filed a first-of-its-kind lawsuit against the painkillers' manufacturer today, alleging that the company turned a blind eye to criminal trafficking of its pills to \reap large and obscene profits.
58812bc7cd4d7409b400002a	BREAKING: All three major indexes fall as Donald Trump's Inauguration looms
588151b5cd4d7409b4000036	Breaking News: Cost of downtown L.A. subway connector could rise by nearly $200 million	2017-01-19T18:54:19-05:00		Los Angeles Times		['200', 'subway connector', 'project', 'county', '1.75 billion 28', 'approved', 'budgeted', 'funds', 'metropolitan transportation authority officials', 'project’s total cost', 'cost increases', 'connector', 'l.a.']	Cost of downtown L.A. subway connector could rise by nearly $200 million L.A. County Metropolitan Transportation Authority officials have requested nearly $200 million more to cover cost increases for the Downtown Regional Connector project.
588238a3cd4d744297000020	Watch with us: Donald Trump is minutes away from being sworn in as president. Join us for live coverage	2017-01-20T11:19:19-05:00		Los Angeles Times		['join', 'oath', 'steps', 'new administration', 'donald trump', 'live coverage', 'trump’s', 'celebrations protests', 'inauguration', 'us', 'address', 'californians', 'capitol', 'streets', '45th president', 'sworn']	Join us for live coverage Donald Trump is being sworn in this morning as the 45th president on the steps of the Capitol in Washington.
58825e7dcd4d744297000036	Breaking News: Season's first child death from flu in California is reported as cases rise sharply	2017-01-20T14:00:46-05:00		Los Angeles Times		\['season’s', 'cases rise', 'child death', 'flu', 'fourteen', 'california', '65', \breaking news season's\]|Season’s first child death from flu in California is reported as cases rise sharply Fourteen people younger than 65.	
588375a5cd4d74345b000003	Breaking News: Measles outbreak grows in L.A. County despite California's strict new vaccination law	2017-01-21T09:52:16-05:00		Los Angeles Times		\['measles', 'california’s', 'los angeles county', 'strict', \california's\, 'months', 'effect', 'county', 'l.a.', 'strict vaccine law', 'others', 'new vaccination law', 'measles outbreak', '20', 'breaking news measles', 'contagious virus', 'search', 'outbreak']|Measles outbreak grows in L.A. County despite California's strict new vaccination law Six months after California’s strict vaccine law took effect, a measles outbreak has infected 20 people, most of them in Los Angeles County, prompting a search for others who may have been exposed to the highly contagious virus.	
5883ce09cd4d74345b000009	Breaking News: This weekend's storm could be strongest in 7 years	2017-01-21T16:09:17-05:00		Los Angeles Times		\['inches', 'foothills', 'coast', 'weather service said', 'weather', '2010', 'service', 'california', '7', 'snow amounts', 'sierra nevada', '2', 'storm', \weekend's storm\, '6', 'rain']|Next storm could be strongest in 7 years The National Weather Service warned that the storm arriving in Southern California later tonight and Sunday could be the strongest since 2010, with 2 to 6 inches of rain expected from the coast to the foothills.	
58853addcd4d74345b000016	Breaking News: Biggest storm in years batters California, flooding roads and forcing evacuations	2017-01-22T18:06:03-05:00		Los Angeles Times		['series', 'snow', 'california', 'years batters', 'large swath', 'flash flood warnings', 'service', 'burn areas', 'storm', 'county freeways', 'region', 'trees', 'evacuations', 'breaking news biggest', 'roads', 'mountains', 'sierra nevada to', 'weather', 'storms', 'biggest', 'l.a.', 'san bernardinos. the']	Biggest storm in years batters California The most powerful in a series of storms slammed into California today, flooding roads, felling trees, forcing evacuations near burn areas and adding more snow in mountains from the Sierra Nevada to the San Bernardinos. The National Weather Service issued flash flood warnings for a large swath of the region.
58856cdfcd4d74345b00001a	Breaking News: Record-setting rainfall causes widespread flooding	2017-01-22T21:39:18-05:00		Los Angeles Times		['all-time rain record', 'service', 'freeways', 'inches', 'parts', 'record-setting', 'breaking news record-setting', 'county', 'weather', 'hard hit', 'rainfall', '3.87', 'long beach airport', 'numerous surface streets', 'powerful storm', 'california', 'rainfall causes']	Record-setting rainfall causes widespread flooding A powerful storm dumped record-breaking rainfall in parts of Southern California, flooding freeways and numerous surface streets.
58863b4dcd4d747787000011	Breaking News: Trump signs orders withdrawing from TPP, initiating federal hiring freeze	2017-01-23T12:19:57-05:00		Los Angeles Times		['federal government', 'exception', 'order', 'trans-pacific partnership', 'government', 'contribute', 'withdrawal', 'military', 'formalizing what', 'trump', 'abortion', 'breaking news trump', 'u.s.', 'signs orders', 'tpp', 'policy', 'perform', 'non-governmental groups', 'executive order', 'elected', 'certainty']	\Trump also signed an order reinstating a policy that the U.S. government will not contribute to non-governmental groups that \perform or actively promote abortion.” A third order initiated a hiring freeze across the federal government, with the exception of the military.
58863ec7cd4d747787000012
58869687cd4d74778700001c	Breaking News: State Senate votes to confirm Xavier Becerra as California's attorney general	2017-01-23T18:49:15-05:00		Los Angeles Times		\['sworn', 'attorney general', 'california’s', 'd-los', 'state attorney general', \california's\, 'becerra', 'angeles', 'xavier becerra', 'u.s.', 'state senate votes', 'latino', 'gov', 'jerry brown', 'senate', 'california']|State Senate votes to confirm Xavier Becerra as California’s attorney general The California Senate voted today to confirm U.S. Rep. Xavier Becerra (D-Los Angeles) as state attorney general.	
5886e123cd4d747787000027	Breaking News: Gov. Brown declares state of emergency after storms cause flooding, erosion, highway damage	2017-01-24T00:07:26-05:00		Los Angeles Times		['flooding erosion highway damage', 'mud flows', 'emergency order', 'flooding erosion', 'highway repairs', 'reconstruction', 'gov', 'brown', 'federal emergency assistance funds', 'dollars', 'damage', 'jerry brown', 'california', 'counties', 'emergency', 'storms', 'tens']	Jerry Brown has declared a state of emergency for several counties dealing with an estimated tens of million dollars in damage from flooding, erosion and mud flows.
58875be3cd4d741ed800000e	Breaking News: 'La La Land,' 'Moonlight' and 'Hidden Figures' are among Oscar best picture nominees	2017-01-24T08:51:23-05:00		Los Angeles Times		['top honor', '89th academy', 'nominees', 'figures', 'land', 'moonlight', 'nominations', 'contenders', 'oscar', 'hacksaw', 'water', 'awards', 'movies', 'nine', 'moonlight” “hidden', 'oscars', 'manchester', 'sea', 'picture nominees', 'fences” “arrival” “lion” “hell', 'picture', 'la', 'hidden', 'ridge.”.', 'year’s']	‘La La Land,’ ‘Moonlight’ and ‘Hidden Figures’ are among Oscar best picture nominees Nine movies received nominations for best picture this morning as the contenders for 89th Academy Awards were announced.
588785f0cd4d741ed8000023	Breaking News: Trump opens Keystone XL and Dakota Access pipelines to construction again	2017-01-24T11:50:51-05:00		Los Angeles Times		\['dakota access', 'energy firms', 'victory', 'breaking news trump', 'interests', 'move', 'pipelines', 'environmental agenda', 'obama', 'keystone xl', 'oil pipeline projects', \obama's\, 'construction', 'trump']|Trump opens Keystone XL and Dakota Access pipelines to construction again President Trump moved today to revive the Keystone XL and Dakota Access oil pipeline projects that were blocked by former President Obama.	
58879541cd4d741ed8000028	Watch live: Gov. Jerry Brown delivers State of the State address	2017-01-24T12:55:59-05:00		Los Angeles Times		['xavier becerra', 'own path', 'swear', 'state address', 'urge lawmakers', 'delivers state', 'events', 'progress', 'gov', '10', 'jerry brown', 'state address gov', 'california', 'california’s', 'new attorney general', 'live gov']	He is expected to urge lawmakers to continue to push California on its own path of progress despite events in Washington.
5887ab59cd4d742c5f000001	Breaking News: LAPD officers who shot and killed Ezell Ford will not be charged, D.A. says	2017-01-24T14:30:26-05:00		Los Angeles Times		['debate', 'michael brown', 'prosecution', 'local touchstone', 'ezell ford', 'black men', 'police officers', 'breaking news lapd', '2014', 'police interact', 'fatal police shooting', 'confrontation', 'atty', 'shot', 'l.a.', 'd.a.', 'ferguson mo', 'officers', 'lapd', ' county dist', 'jackie lacey', 'black man']	The killing of Ezell Ford in August 2014, two days after the fatal police shooting of Michael Brown in Ferguson, Mo., became a local touchstone in the ongoing debate over how police interact with black men.
5888fa88cd4d745609000006	Breaking News: Trump orders work on border wall, crackdown on sanctuary cities	2017-01-25T14:20:13-05:00		Los Angeles Times		['ban', 'building a wall', 'trump', 'refugees', 'sanctuary cities', 'flow', 'countries', 'border', 'syrian', 'federal workers', 'white house', 'sanctuary cities president', 'border wall crackdown', 'breaking news trump', 'u.s.', 'u.s.-mexico', 'orders work', 'officials']	Trump orders work on border wall, crackdown on sanctuary cities President Trump has directed federal workers to start building a wall along the U.S.-Mexico border and to begin punishing sanctuary cities, the White House announced today.
588901bdcd4d745609000009	Breaking News: Mary Tyler Moore dies at 80	2017-01-25T14:51:03-05:00		Los Angeles Times		['winner', 'television icon', 'mary tyler moore show', 'successful sitcom', 'stardom', 'moore', 'emmy awards', '1960s', 'headline “the', '80', 'breaking news mary tyler moore', 'mary tyler moore', 'dick van dyke show', '1970s']	Moore rose to stardom on “The Dick Van Dyke Show” in the 1960s and went on to headline “The Mary Tyler Moore Show,” a highly successful sitcom in the 1970s.
588913e7cd4d745609000015	Breaking News: Dow closes above 20,000 for the first time	2017-01-25T16:08:37-05:00		Los Angeles Times		['closes', 'stock market rally', 'presidential election', 'victory', 'dow', 'momentum', 'dow jones', 'milestone', 'breaking news dow', 'industrial average', '20000', 'donald trump’s']	The milestone extends a stock market rally that gained momentum following Donald Trump’s victory in the presidential election.
5889de22cd4d746435000005	Breaking News: Fatal crash closes northbound 5 Freeway in Arleta	2017-01-26T06:31:14-05:00		Los Angeles Times		['lanes', 'one', 'arleta', '5', 'breaking news fatal', 'fatal', 'man', 'freeway', 'wrong-way driver', 'crash closes northbound', 'northbound', 'multivehicle crash']	Fatal crash closes northbound 5 Freeway in Arleta A multivehicle crash apparently caused by a wrong-way driver left one man dead and closed all lanes of the northbound 5 Freeway in Arleta early Thursday, the.
588a1fdbcd4d746435000008	Breaking News: In a major improvement, nearly half of California is no longer in drought	2017-01-26T11:12:06-05:00		Los Angeles Times		['continued', 'extreme” drought', 'rain', 'year ago', 'california', '95', 'form', 'snow', 'analysis', 'moderate', '51', 'major improvement', 'comparison', 'u.s. drought monitor', 'drought']	In a major improvement, nearly half of California is no longer in drought Continued rain and snow across California has lifted nearly half of the state out of drought, according to an analysis released today.
588a2fbbcd4d746435000012	Breaking News: Mexican president calls off meeting with Trump	2017-01-26T12:19:45-05:00		Los Angeles Times		\['mexican president', 'message', 'mexican president calls', \pena nieto's\, 'trump', 'enrique pena nieto', 'border wall', 'meeting', 'trip', 'mexico', 'twitter']|Peña Nieto's message on Twitter came hours after Trump tweeted the meeting should be canceled if Mexico won't pay for a border wall.	
588a64c2cd4d74643500001d	Breaking News: UC regents vote to increase tuition 2.5% after a six-year freeze	2017-01-26T16:05:56-05:00		Los Angeles Times		['six-year', 'increasing', '2010-2011', 'regents vote', 'university', '11502', 'california', 'uc', '2.5', 'tuition', 'regents', 'tuition 2.5', 'student service fees', '2017-18', 'breaking news uc', 'school year']	UC regents vote to increase tuition 2.5% after a six-year freeze University of California regents voted today to increase tuition by 2.5%, beginning this fall, the first such hike since 2010-2011.
588a69adcd4d746435000020	Breaking News: Trump to seek 20% tax on Mexican imports to pay for border wall	2017-01-26T16:27:04-05:00		Los Angeles Times		['sean spicer', 'nation', 'generate', 'white house', 'breaking news trump', 'trade deficit with', 'shape', 'u.s.', 'impose', 'press secretary', 'mexico', '20 tax', 'broader tax reform plan', 'trump', 'revenue', 'move', 'part', 'mexican imports', 'border wall', 'imports', 'administration', 'fund construction']	Trump to seek 20% tax on Mexican imports to pay for border wall The Trump administration said today that it would seek to impose a 20% tax on imports from Mexico and any other nation the U.S. has a trade deficit with, a plan the White House said would generate the revenue needed to fund construction of an extended border wall.
588c18b1cd4d74365f00000a	Breaking News: Suspect arrested in double murder at Chinatown social club	2017-01-27T23:05:45-05:00		Los Angeles Times		['men', 'hop sing tong', 'vehicle impound fees police said', 'neck police said', 'chinatown', 'man refused', '37-year-old man', 'double murder', 'one', 'suspect', '400', '6-inch knife', 'breaking news suspect', 'dao', 'social club', 'vinh quok dao', 'man']	Suspect arrested in double murder at Chinatown social club Los Angeles police have arrested a 37-year-old man suspected of killing two men at Hop Sing Tong, a Chinatown social club.
