5878fe04cd4d74637300011e	News Alert: Justice Dept. says Chicago police officers have a pattern of using unconstitutional force	2017-01-13T11:18:45-05:00	https://www.washingtonpost.com/news/post-nation/wp/2017/01/13/justice-dept-to-announce-results-of-investigation-into-chicago-police/	The Washington Post		['considerable work' 'federal investigation' 'justice department' 'excessive force attorney' 'independent oversight' 'negotiations' 'justice' 'practice' 'done' 'use' 'investigation' 'dept' 'city officials' 'unconstitutional force' 'result' 'engages' 'department' 'police force' 'lynch' 'reform' 'court-enforceable consent decree' 'news alert' 'police officers' 'loretta e. lynch' 'chicago' 'pattern']	\A sprawling federal investigation into the Chicago Police Department found that it \engages in a pattern or practice of use of excessive force\ Attorney General Loretta E. Lynch announced.
5878ffd1cd4d746373000121
5879068dcd4d746373000126	Technology News Alert: The head of the FTC announces she is stepping down	2017-01-13T11:55:24-05:00	https://www.washingtonpost.com/news/the-switch/wp/2017/01/13/the-head-of-the-ftc-announces-she-is-stepping-down/	The Washington Post		['major technology regulator' 'head' 'news alert' 'chairwoman edith ramirez' 'ftc' 'announces' 'technology news']	Technology News Alert: The head of the FTC announces she is stepping down
58793d20cd4d74637300012e	News Alert: House votes along party lines to take the first step toward repealing the Affordable Care Act	2017-01-13T15:48:25-05:00	https://www.washingtonpost.com/powerpost/congress-readies-to-begin-obamacare-repeal-process/2017/01/13/6bcd6eba-d9b3-11e6-9a36-1d296534b31e_story.html	The Washington Post		['cooperation' 'handful' 'party lines' 'news alert' 'act' 'repeal major parts' 'democrats' 'measure' 'care' 'use' 'special budget procedures' 'senate' 'house votes']	The measure which had already been passed by the Senate will allow Republicans to use special budget procedures to repeal major parts of the Affordable Care Act without cooperation from Democrats.
58797082cd4d746373000139	News Alert: Eric Garner case won't be resolved before Attorney General Loretta Lynch leaves office	2017-01-13T19:27:35-05:00	https://www.washingtonpost.com/world/national-security/loretta-lynch-will-leave-office-without-eric-garner-case-being-resolved/2017/01/13/ee362f4a-d9db-11e6-b8b2-cb5164beba6b_story.html	The Washington Post		['department' 'justice department' 'investigators' 'city officers' 'decision' 'leaves office' 'panel' 'takedown' 'death' 'lawyers' 'order' 'matter said' 'tenure' 'news alert' 'criminal charges' 'police officers' 'procure' 'attorney' 'evidence' 'grand jury' 'loretta lynch' 'alert eric garner' 'indictment' 'national outrage people' 'lynch' 'eric garner' 'necessary steps' 'york']	Attorney General Loretta Lynch will step down without the Justice Department having charged or cleared police officers in the death of Eric Garner whose videotaped takedown by New York City officers sparked national outrage people familiar with the matter said.
587d0300cd4d746aac000009	News Alert: Law enforcement official: Wife of Orlando nightclub shooter arrested by FBI	2017-01-16T12:29:09-05:00	https://www.washingtonpost.com/world/national-security/wife-of-orlando-nightclub-shooter-arrested/2017/01/16/41af61c8-dc0c-11e6-918c-99ede3c8cafa_story.html	The Washington Post		['law enforcement' 'precise charges' 'law enforcement official' 'fbi' 'wife' 'news alert' 'clear' 'orlando' 'nightclub shooter' 'omar mateen' 'official said' 'noor salman']	The FBI has arrested Noor Salman the wife of Orlando nightclub shooter Omar Mateen a law enforcement official said.
587d0f97cd4d746aac00000c	Politics News Alert: Monica Crowley declines Trump administration appointment amid plagiarism charges	2017-01-16T13:23:10-05:00	https://www.washingtonpost.com/news/post-politics/wp/2017/01/16/trump-national-security-spokeswoman-monica-crowley-to-forgo-post-amid-plagiarism-charges/	The Washington Post		['copies' 'book' 'strategic communications' 'administration appointment' 'york' 'conservative pundit' 'passages' 'alert monica crowley' 'position' 'publisher' 'plagiarism' 'phd' 'trump' 'administration' 'senior director' 'national security' 'reflection' '2012' 'council' 'statement' 'columbia university' 'plagiarism charges' 'addresses allegations' 'crowley' 'news alert' 'dissertation']	Crowley who had been named senior director of strategic communications at the National Security Council said in a statement that “after much reflection” she had decided to remain in New York and “will not be taking a position in the incoming administration.” The publisher of her 2012 book said last week that it will stop selling copies until she addresses allegations of plagiarism.
587dbfd0cd4d746aac000024	News Alert: Underwater search for missing Malaysia Airlines flight MH370 ends after three years with mystery unsolved	2017-01-17T01:54:47-05:00	https://www.washingtonpost.com/world/after-3-years-mh370-search-ends-with-no-plane-few-answers/2017/01/17/e30e588e-dc7b-11e6-8902-610fe486791c_story.html	The Washington Post		['crews' 'flight' 'mh370' 'remote waters' 'agency' 'indian' 'malaysia' 'coordination' 'lead' 'airlines' '777' 'australia' 'ends' 'three' 'alert underwater' 'search' 'joint' 'boeing' 'fruitless sweep' '46000-square mile search zone' '160' 'mystery' 'center' 'hunt' 'news alert' 'press reported']	The Joint Agency Coordination Center in Australia which has helped lead the $160 million hunt for the Boeing 777 in remote waters west of Australia said the search had officially been suspended after crews finished their fruitless sweep of 46000-square mile) search zone of the Indian the Associated Press reported.
587e094dcd4d746aac000031	News Alert: Trump will take the oath of office as the least-popular president in at least four decades according to a Post-ABC poll	2017-01-17T07:08:30-05:00	https://www.washingtonpost.com/politics/poll-trump-draws-low-marks-for-transition-response-to-russian-hacking/2017/01/17/0926302a-dc25-11e6-ad42-f3375f271c9c_story.html	The Washington Post		['post-abc' 'donald trump' 'news alert' 'president-elect' 'threats' 'four' 'washington post-abc' 'russian hacking' 'alert trump' 'oath' 'economy' 'news poll' 'majority' 'least-popular president' 'terrorism' 'poll' 'decades' 'response']	News Alert: Trump will take the oath of office as the least-popular president in at least four decades according to a Post-ABC poll
587e5e95cd4d746aac000044	News Alert: Nigerian military acccidentally bombs camp for victims of Boko Haram killing at least 50	2017-01-17T13:12:11-05:00	https://www.washingtonpost.com/news/world/wp/2017/01/17/nigerian-military-acccidentally-bombs-camp-for-victims-of-boko-haram-killing-at-least-50/	The Washington Post		['50' 'bombing' 'unclear' 'bombs camp' 'terrorist enclave' 'victims' '100' 'border' 'camp' 'attack' 'operation' 'boko haram' 'target' 'area' 'aid workers humanitarian organizations said' 'news alert' 'alert nigerian' 'cameroonian' 'aid workers' '25000' 'militants']	More than 100 were wounded in the attack near the Cameroonian border according to aid workers who witnessed the bombing which happened during an operation to target Boko Haram militants in the area.
587e8e89cd4d746aac000052	News Alert: Obama commutes nearly all of sentence of Chelsea Manning the U.S. soldier convicted for leaking classified information to WikiLeaks	2017-01-17T16:36:49-05:00	https://www.washingtonpost.com/news/checkpoint/wp/2017/01/17/obama-commutes-nearly-all-of-sentence-of-chelsea-manning-the-u-s-soldier-convicted-for-leaking-classified-information-to-wikileaks/	The Washington Post		['alert obama' 'prison' '17' 'news alert' 'commutes' 'wikileaks' 'obama' 'soldier' 'u.s.' 'sentence' 'commute' 'manning' 'chelsea manning' '2010' 'information' '35']	News Alert: Obama commutes nearly all of sentence of Chelsea Manning the U.S. soldier convicted for leaking classified information to WikiLeaks
587ee71dcd4d746aac000062	News Alert: Black Secret Service agents agree to $24 million settlement in a decades-old race bias case	2017-01-17T22:54:54-05:00	https://www.washingtonpost.com/politics/secret-service-agrees-to-pay-24-million-to-settle-decades-old-race-bias-case-brought-by-black-agents/2017/01/17/b386006e-dd23-11e6-ad42-f3375f271c9c_story.html	The Washington Post		['discrimination' 'alert black' 'wrongdoing' 'news alert' 'lost' 'secret service agents' 'settlement' 'job opportunities' 'administration' 'part' 'agents' 'obama' 'decades-old race bias case' 'secret service admits' 'institutional bias' 'payments' '100' '24']	The Secret Service admits to no wrongdoing or institutional bias in a deal that comes as part of a push in the waning days of the Obama administration.
587f8b32cd4d746aac000074	News Alert: NASA and NOAA declare 2016 the hottest year on record — for the third consecutive year	2017-01-18T10:34:51-05:00	https://www.washingtonpost.com/news/energy-environment/wp/2017/01/18/u-s-scientists-officially-declare-2016-the-hottest-year-on-record-that-makes-three-in-a-row/	The Washington Post		['record —' 'faces confirmation hearings' 'nasa' 'scientists' 'environmental protection agency scott pruitt' 'conclusion' 'hoax assumes office' 'news alert' 'noaa' 'announcement' 'nominee' '2016' '95' 'greater' 'capitol hill today' 'alert nasa' 'donald trump' 'consecutive year' 'president-elect' 'percent certainty']	\NASA scientists expressed \greater than 95 percent certainty\ in that conclusion.
587f8b53cd4d746aac000075
587fc1aecd4d740290000010	News Alert: Watch: Obama to hold final news conference of his presidency in moments	2017-01-18T14:27:25-05:00	https://www.washingtonpost.com/politics/obama-to-hold-final-news-conference/2017/01/18/033bc4c6-dd98-11e6-918c-99ede3c8cafa_story.html	The Washington Post		['news alert' 'alert watch obama' 'president-elect' 'power' 'number' 'boycott' 'donald trump' 'transition' 'reporters' 'obama' 'inaugural ceremonies' 'differences' 'final news conference' 'questions' 'address' 'moments']	President Obama is expected to address the transition of power and he is likely to face questions from reporters over the growing number of Democrats who have announced that they plan to boycott the inaugural ceremonies over differences with President-elect Donald Trump.
5880254ccd4d7409b400000b	Politics News Alert: Trump picks former Georgia governor Sonny Perdue who once led a prayer for rain for agriculture secretary	2017-01-18T21:32:31-05:00	https://www.washingtonpost.com/politics/trump-picks-sonny-perdue-for-agriculture-secretary/2017/01/18/a26abbc0-ddec-11e6-ad42-f3375f271c9c_story.html	The Washington Post		['national headlines' 'implications' 'amidst' 'party' '2011' 'rural voters' 'public vigil' '2007' 'army' 'sonny perdue' 'governor' '2003' 'perdue' 'pick' 'president-elect plans' 'election' 'prayer' 'veterinary medicine' 'farm' 'agriculture department nomination' 'terms' 'rain' 'drought' 'agriculture secretary' 'strong agricultural background' 'alert trump' 'georgia' 'transition' 'doctorate']	Perdue a former Democrat who switched to the Republican Party before governing Georgia for two terms from 2003 to 2011 has a strong agricultural background having grown up on a farm and having earned a doctorate in veterinary medicine.
588089e2cd4d7409b4000016	News Alert: Italian officials says up to 30 missing and ‘many dead’ as avalanche buries hotel in earthquake hit central region	2017-01-19T04:41:44-05:00	https://www.washingtonpost.com/world/avalanche-buries-italian-hotel-rescuers-say-many-dead/2017/01/19/21606d7e-de26-11e6-918c-99ede3c8cafa_story.html	The Washington Post		['emergency' 'rescuers' 'quakes' 'central region' 'series' 'past days' 'news alert' 'heavy snowfall' 'earthquake' '30' '4-star hotel' 'snow' 'italian officials' 'ansa' 'news agency' 'three-story hotel' 'many dead' 'abruzzo' 'avalanche buries hotel' 'avalanche' 'region']	Rescuers have told ANSA news agency that there are “many dead” and the three-story hotel is half buried in snow.
5880ace5cd4d7409b4000017	News Alert: CIA documents expose internal agency feud over psychologists leading interrogation program	2017-01-19T07:11:15-05:00	https://www.washingtonpost.com/world/national-security/cia-documents-expose-internal-agency-feud-over-psychologists-leading-interrogation-program/2017/01/18/a73bd722-dd85-11e6-918c-99ede3c8cafa_story.html	The Washington Post		['newly' 'detainees' 'cia' 'internal agency feud' 'psychological personnel' 'news alert' 'internal emails' 'ethics' 'brutal measures' 'arrangement' 'charge' 'interrogation program' 'harm' 'contractors' 'waterboarding' 'torture' 'bitter feud' 'documents expose' 'psychologists' 'interrogation methods' 'methods' 'concern' 'series' 'agency' 'alert cia' 'cia’s' 'military psychologists' 'qualifications']	A series of internal emails reveal that the CIA’s own medical and psychological personnel expressed deep concern about an arrangement that put two outside contractors in charge of subjecting detainees to brutal measures including waterboarding then also evaluating whether those methods were working or causing lasting harm.
5880b9facd4d7409b400001b	News Alert: Donald Trump’s inauguration is tomorrow. The Post is offering free unlimited access to our coverage through Saturday.	2017-01-19T08:06:55-05:00	https://www.washingtonpost.com/	The Washington Post		['long weekend' 'news alert' 'noon' 'inauguration' 'ceremony celebration' 'alert donald trump’s' 'main event' 'president-elect' 'washingtonpost.com.' 'access' 'protest' 'offering free' 'sworn' 'tomorrow' 'find']	The president-elect is set to be sworn in at noon on Friday the main event in a long weekend of ceremony celebration and protest.
588114d6cd4d7409b4000024	News Alert: Senegalese troops enter Gambia as strongman Yahya Jammeh refuses to leave office reports say	2017-01-19T14:34:14-05:00	https://www.washingtonpost.com/world/despite-expired-term-gambias-president-refuses-to-leave-office-even-as-troops-close-in/2017/01/19/eccaf29c-ddde-11e6-8902-610fe486791c_story.html	The Washington Post		['hand' 'troops' 'yahya jammeh’s' 'news alert' 'office reports' 'reuters' 'news agency' 'spite' 'power' 'strongman' 'yahya jammeh' 'gambia” senegalese' 'gambia' 'refuses' 'alert senegalese' 'term' 'international efforts' 'army col' 'abdou ndiaye' 'text message' 'ended']	Yahya Jammeh’s term has officially ended but he appeared unwilling to hand over power in spite of international efforts.
58811d24cd4d7409b4000027	News Alert: Obama grants his final commutations and pardons bringing his total number of clemencies to more than 12 presidents combined	2017-01-19T15:09:43-05:00	https://www.washingtonpost.com/world/national-security/obama-grants-final-330-commutations-to-nonviolent-drug-offenders/2017/01/19/41506468-de5d-11e6-918c-99ede3c8cafa_story.html	The Washington Post		['obama' 'office president' '12' 'news alert' 'grants' 'presidents combined' '1715' 'wikileaks' 'prison sentence' 'total number' 'final batch' 'alert obama' '330' 'military documents' 'clemencies' 'presidents' 'chelsea manning' 'army' 'full day' 'final commutations' 'pardons' 'commutations']	On his last full day in office President Obama announced 330 more commutations bringing his total number of clemencies to 1715.
58822d9acd4d744297000019	News Alert: Donald Trump's inauguration is starting. Watch live and follow our coverage as he is sworn in as the 45th president.	2017-01-20T10:32:19-05:00	https://www.washingtonpost.com/local/2017/live-updates/politics/live-coverage-of-trumps-inauguration/	The Washington Post		\['presidential oath' 'john roberts jr' 'supreme court chief justice' 'donald trump' 'families' 'house' 'inauguration' 'trump' 'capitol' 'obama' '45th president' 'inaugural address' 'administer' 'starting' \alert donald trump's\ 'sworn' 'news alert']|At the Capitol Supreme Court Chief Justice John Roberts Jr. will administer the presidential oath of office and then Donald Trump will deliver his inaugural address.
5882461dcd4d74429700002c	News Alert: Donald Trump is sworn in as the 45th U.S. president giving the GOP control of the White House and Congress for the first time since 2006	2017-01-20T12:17:13-05:00	https://www.washingtonpost.com/politics/trump-to-be-sworn-in-marking-a-transformative-shift-in-the-countrys-leadership/2017/01/20/954b9cac-de7d-11e6-ad42-f3375f271c9c_story.html	The Washington Post		\['oath' 'legacy' '—' '45th' 'undo' '2006' 'mother' 'john roberts jr' 'white house' 'sworn' 'inauguration' 'chief justice' 'signature pieces' 'trump’s' 'abraham lincoln’s' 'bibles' '1955' 'new president' 'gop control' 'news alert' 'one' 'alert donald trump' \barack obama's\ 'u.s.']|The oath was given using two Bibles — one from President Abraham Lincoln’s inauguration and another that Trump’s mother gave him in 1955.
58824b67cd4d744297000030	News Alert: President Trump pledged in his inaugural address that 'from this day forward it will be America first.' Read the transcript.	2017-01-20T12:39:49-05:00	https://www.washingtonpost.com/news/post-politics/wp/2017/01/20/donald-trumps-inaugural-address-full-text-as-prepared-for-delivery/	The Washington Post		['nation again' 'inaugural address' 'this day' 'small group' 'power' 'new president' 'rulers' 'costs' 'government' 'transcript' 'trump' 'news alert' 'america' 'nation’s capital' 'rewards']	“For too long a small group in our nation’s capital has reaped the rewards of government while the people have borne the costs” he said adding that “this day will be remembered as the day the people became rulers of this nation again.” News Alert.
58826fa3cd4d74429700003c	News Alert: Nearly 100 arrested in D.C. as protesters clash with police on Inauguration Day	2017-01-20T15:14:18-05:00	https://www.washingtonpost.com/local/protesters-bring-shouts-skirmishes-and-shutdowns-to-inauguration-celebration/2017/01/20/00ea4c72-df11-11e6-acdf-14da832ae861_story.html	The Washington Post		\['disrupt' '100' 'd.c.' 'trail' 'inauguration day' 'demonstrators' 'protesters back' 'news alert' 'flash-bang grenades' 'donald trump’s' 'city blocks' 'damage' 'swearing-in ceremony' 'security checkpoints' \post's\ 'chemical spray' 'video' 'protesters clash' 'protests']|Demonstrators left a trail of damage along some city blocks attempted to block security checkpoints and disrupt Donald Trump’s swearing-in ceremony.
58828d3ccd4d74429700003f	News Alert: Retired Gen. James Mattis is confirmed as defense secretary breaking with decades of precedent	2017-01-20T17:20:41-05:00	https://www.washingtonpost.com/news/checkpoint/wp/2017/01/20/senate-confirms-retired-gen-james-mattis-as-defense-secretary-breaking-with-decades-of-precedent/	The Washington Post		['military' 'news alert' 'alert retired' 'army' 'senior military officer' '1.9 million' 'defense secretary' 'billion' 'decades' '580' 'job' 'mattis' 'trump' 'reservists' 'active-duty service members' 'gen' 'oversee' 'budget' 'james mattis' 'defense' 'harry truman' '1950' 'george marshall' 'precedent']	The retired general will lead the Defense Department's 1.9 million active-duty service members and reservists and will oversee a budget of more than $580 billion as President Trump prepares to expand the military.
58829ae3cd4d744297000046	News Alert: Retired Gen. John F. Kelly confirmed as secretary of homeland security	2017-01-20T18:18:37-05:00	https://www.washingtonpost.com/world/national-security/john-f-kelly-confirmed-as-homeland-security-secretary/2017/01/20/439bdde6-de90-11e6-918c-99ede3c8cafa_story.html	The Washington Post		['nation' 'gen' 'kelly' 'alert retired' 'border' 'build' 'electrical grid' 'marine' 'employees' 'trump' 'wall' 'news alert' '240000' 'entity' 'oversee' 'secretary' 'homeland security' 'nation’s' 'mexico' 'charge' 'construction' 'john f. kelly']	The former Marine general will be in charge of securing the nation including overseeing the construction of a wall along the border with Mexico that President Trump has said he will build.
5883b0ebcd4d74345b000005	News Alert: Turnout for the Women’s March on Washington too large to conduct a formal march to the White House organizers say	2017-01-21T14:04:46-05:00	https://www.washingtonpost.com/local/womens-march-on-washington-a-sea-of-pink-hatted-protesters-vow-to-resist-donald-trump/2017/01/21/ae4def62-dfdf-11e6-acdf-14da832ae861_story.html	The Washington Post		['organizers' 'such marches' 'demonstration' 'conduct' 'alert turnout' 'one' 'thousands' 'world' 'city officials' 'formal march' 'news alert' 'rejoinder' 'decision' 'inaugural gathering' 'd.c.' 'women’s march' 'day earlier' 'mount' 'trump' 'crowd' 'house' 'rally' 'hundreds' 'recent years']	Hundreds of thousands of people poured into Washington for the march a larger-than-expected crowd determined to mount a roaring rejoinder to the inaugural gathering for President Trump one day earlier.
588560c8cd4d74345b000019	Technology News Alert: Samsung cites two separate battery issues for its Note 7 recall woes	2017-01-22T20:47:34-05:00	https://www.washingtonpost.com/news/the-switch/wp/2017/01/22/samsung-cites-two-separate-battery-issues-for-its-note-7-recall-woes/	The Washington Post		['personal injury' 'tech' 'technology news' '7' 'property damage' 'certain cases' 'separate battery issues' 'alert samsung' 'original faulty phones' 'recall woes' 'new phones' 'initial round' 'owners' 'battery manufacturer' 'devices' 'irregular battery sizes' 'korean' 'round' 'issues' 'news alert' 'company']	The South Korean tech giant disclosed in a report that irregular battery sizes caused the initial round of fires which were sometimes explosive and in certain cases led to property damage and personal injury for its owners.
5886240bcd4d747787000002	Politics News Alert: Sen. Marco Rubio will support Tillerson's nomination as secretary of state	2017-01-23T10:40:30-05:00	https://www.washingtonpost.com/powerpost/rubio-announces-support-for-trump-secretary-of-state-nominee-tillerson/2017/01/23/e232baf4-e16c-11e6-ba11-63c4b4fb5a63_story.html	The Washington Post		\['however' 'marco rubio' 'secretary' \tillerson's\ 'news alert' 'statement' 'committee vote' 'despite' 'critical posts' 'approval' 'senate' 'rex tillerson’s' 'deference' 'warned' 'exxonmobil' 'support' 'rubio' 'appointments' 'holdout' 'department' 'facebook rubio' 'chief’s nomination' 'trump’s' 'reservations' 'tillerson' 'nomination' 'approved' 'r-fla' 'panel' 'relations']|In a statement posted to Facebook Rubio said that “despite my reservations” he will back the former ExxonMobil chief’s nomination both in the Senate Foreign Relations Committee vote on Monday and before the full Senate.
5886386acd4d74778700000a	News Alert: Trump cancels agreement for sweeping trade deal with Asia recasting U.S. role in global economy	2017-01-23T12:07:26-05:00	https://www.washingtonpost.com/news/wonk/wp/2017/01/23/president-trump-signs-order-to-withdraw-from-transpacific-partnership/	The Washington Post		['tough talk' 'executive order' 'move' 'business executives' 'role' 'participation' 'alert trump' 'news alert' '—' 'partners' 'signal' 'industry' 'cancels agreement' 'symbolic —' 'administration' 'transpacific partnership' 'asia' 'u.s.' 'new scrutiny' 'global economy' 'white house' 'campaign' 'action subjects' 'donald trump’s']	The move was largely symbolic — the deal was unlikely to make it through Congress — but served to signal that Donald Trump’s tough talk on trade during the campaign will carry over to his administration.
58863a94cd4d747787000010	News Alert: Donald Trump halts hiring of federal workers and freezes pay raises	2017-01-23T12:16:59-05:00	https://www.washingtonpost.com/news/powerpost/wp/2017/01/23/trump-freezes-federal-hiring/	The Washington Post		\['excludes' 'news alert' 'u.s.' \trump's\ 'trump' 'raises' 'presidential campaign' 'federal workers' 'military' 'halts' 'alert donald trump' 'part']|Trump said the freeze excludes the U.S. military.
58864d2dcd4d747787000016	Politics News Alert: Watch live as White House press secretary holds first formal news briefing since making false claims about inauguration	2017-01-23T13:36:00-05:00	https://www.washingtonpost.com/news/post-politics/wp/2017/01/23/sean-spicer-expected-to-soon-give-news-briefing/	The Washington Post		['false claims' 'trump' 'news alert' 'inauguration' 'comments' 'white house press secretary' 'alternative facts' 'size' 'sean spicer' 'inauguration crowd' 'weekend' 'white house' 'eastern' 'news conference' 'alert watch' 'questions' 'senior counselor' 'kellyanne conway' '130' 'claims' 'formal news']	He came under fire over the weekend for a news conference at which he didn't take questions and made easily disproved claims about the size of the inauguration crowd.
588689afcd4d74778700001a	Politics News Alert: Tillerson's nomination as secretary of state approved by Senate panel	2017-01-23T17:54:12-05:00	https://www.washingtonpost.com/powerpost/rubio-announces-support-for-trump-secretary-of-state-nominee-tillerson/2017/01/23/e232baf4-e16c-11e6-ba11-63c4b4fb5a63_story.html	The Washington Post		\['relations' \alert tillerson's\ 'secretary' 'party lines' 'assured' 'senate' '11-to-10' 'senate panel' 'rex tillerson’s' 'committee' 'confirmation' 'full senate' 'news alert' 'vote' 'nomination']|The Senate Foreign Relations Committee voted 11-to-10 on Monday to send Rex Tillerson’s nomination to be secretary of state to the full Senate for confirmation that is all but assured.
58869a42cd4d74778700001e	News Alert: Trump halts hiring of federal workers but does not freeze their salaries (Corrected)	2017-01-23T19:04:54-05:00	https://www.washingtonpost.com/powerpost/trump-freezes-hiring-of-federal-workers/2017/01/23/f14d8180-e190-11e6-ba11-63c4b4fb5a63_story.html	The Washington Post		['alert trump' 'salaries corrected' 'trump' 'news alert' 'salaries' 'halts' 'federal workers']	News Alert: Trump halts hiring of federal workers but does not freeze their salaries (Corrected)
