58e7880ccd4d745b2e000178	News Alert: U.S. added 98000 jobs in March; unemployment rate dipped to 4.5 percent	2017-04-07T08:37:04-04:00	https://www.washingtonpost.com/news/wonk/wp/2017/04/07/u-s-added-98000-jobs-in-march-unemployment-rate-dipped-to-4-5-percent/	The Washington Post		['labor market' 'accelerator' 'fed' 'federal reserve' '98000' 'alert u.s.' 'momentum' '4.5' 'democracy dies' 'economy' 'jobs' 'government' 'u.s.' '15' 'main interest rate' 'new government data' 'ultra-low levels' 'strength' 'darkness' 'interest rates' 'recession' 'private sector' 'recent months' 'eight' 'foot' 'unemployment rate']	The strength of the U.S. economy in recent months has helped persuade the Federal Reserve to continue taking its foot off the accelerator by gradually raising interest rates from the ultra-low levels of the recession.
58e796b5cd4d745b2e000184	News Alert: Hiring slowed in March as U.S. employers added only 98000 jobs while unemployment dipped to 4.5 percent [Corrected]	2017-04-07T09:39:53-04:00	https://www.washingtonpost.com/news/wonk/wp/2017/04/07/u-s-added-98000-jobs-in-march-unemployment-rate-dipped-to-4-5-percent/	The Washington Post		['estimates' 'employers' 'month before' 'winter storms' 'unemployment' 'democracy dies' '98000' 'economic activity' 'labor department' 'percent corrected' 'darkness' 'u.s.' 'job creation' 'total' '4.5' '38000' 'labor market' 'momentum' 'jobs']	News Alert: Hiring slowed in March as U.S. employers added only 98000 jobs while unemployment dipped to 4.5 percent [Corrected]
58e79e4bcd4d745b2e00018b	News Alert: At least 2 dead after truck crashes into Stockholm department store in incident Swedish prime minister calls likely terror attack	2017-04-07T10:12:02-04:00	https://www.washingtonpost.com/world/truck-crashes-into-department-store-in-stockholm-casualties-reported/2017/04/07/7942822c-1b96-11e7-bcc2-7d1a0973e7b2_story.html	The Washington Post		['street' 'department store —' '2' 'stockholm' 'prime minister calls' 'truck crashes' 'darkness' 'hundreds' 'incident' 'department store' 'democracy dies' 'images' 'swedish' 'main station —' 'center' 'trains' 'likely terror attack' 'city' 'crash' 'social media' 'halted' 'civilians']	News Alert: At least 2 dead after truck crashes into Stockholm department store in incident Swedish prime minister calls likely terror attack
58e7b581cd4d745b2e000195	News Alert: Neil Gorsuch confirmed as Supreme Court justice capping year-long fight by Republicans to restore conservative tilt of the court	2017-04-07T11:51:19-04:00	https://www.washingtonpost.com/powerpost/senate-set-to-confirm-neil-gorsuch-to-supreme-court/2017/04/07/da3cd738-1b89-11e7-9887-1a5314b56a08_story.html	The Washington Post		['year-long fight' 'senate' 'darkness' 'justice' 'majority' 'leader' 'antonin scalia' 'judge' 'conservative tilt' 'restore' 'neil gorsuch' 'major victory' 'confirmation' 'significant accomplishment' 'democracy dies' 'sworn' 'nominate' 'trump' 'nominee' '49' '2016' 'mitch mcconnell' 'conservative jurist' '113th' 'barack obama’s' 'alert neil gorsuch' 'supreme court justice' 'seat' 'court']	It is also a significant accomplishment for Senate Majority Leader Mitch McConnell who refused to consider President Barack Obama’s nominee after Justice Antonin Scalia died in February 2016 leaving the seat open for Trump to nominate a conservative jurist.
58ea35c8cd4d745b2e0001b9	News Alert: ISIS claims responsibility for blasts at 2 Egyptian churches killing at least 36 in the latest attacks against Coptic Christians	2017-04-09T09:23:07-04:00	https://www.washingtonpost.com/world/blasts-rocks-egypt-church-killing-at-least-13-and-injuring-scores/2017/04/09/089122a2-1d00-11e7-be2a-3a1fb24d4671_story.html	The Washington Post		['unknown' 'egyptian' 'blast' 'attacks' '36' 'pope francis' 'church' 'three' 'fate' 'coptic christians' 'palm' 'state television' 'alert isis' 'cairo' 'egypt’s coptic church pope tawadros ii' 'blasts' '21' 'service' 'hours later' 'weeks' 'bomb police said' 'northern city' '9.30' 'pews' 'george’s church' 'mass' 'churches' '2' 'miles' 'saint mark’s' 'tanta' 'claims responsibility' 'head' 'darkness' 'a.m.' 'alexandria' 'less' 'egypt' 'democracy dies' '80' 'st']	The first blast in Tanta 80 miles north of Cairo unfolded around 9.30 a.m. during a Palm Sunday service at St. George’s Church.
58eb8856cd4d745b2e0001cc	News Alert: Neil Gorsuch takes oath to be 113th Supreme Court justice	2017-04-10T09:26:55-04:00	https://www.washingtonpost.com/politics/courts_law/gorsuch-to-be-sworn-in-to-supreme-court-today-in-two-ceremonies/2017/04/10/9ac361fe-1ddb-11e7-ad74-3a742a6e93a7_story.html	The Washington Post		['private ceremony' 'john g. roberts jr.' '49-year-old justice' 'white house ceremony' 'thrust' 'grand room' '11' '17' 'round' 'supreme court justice' 'oath' '113th' 'constitutional oath' 'court' 'oral arguments' 'alert neil gorsuch' 'term ends' 'court’s term' 'final weeks' 'chief justice' 'term' 'gorsuch']	Chief Justice John G. Roberts Jr. administered the constitutional oath at a private ceremony in a grand room inside the Supreme Court.
58ebd877cd4d745b2e0001e4	News Alert: Post reporter David Fahrenthold wins Pulitzer Prize for stories about Donald Trump’s charitable giving	2017-04-10T15:09:19-04:00	https://www.washingtonpost.com/graphics/2017/pulitzer-prize-winner-and-finalists-2017/	The Washington Post		\['1 million' 'donald trump' 'democracy dies' '–' \illusions he'd created\ 'effort' 'hampshire' 'fahrenthold’s' '2005' 'start' 'veterans' 'post reporter' 'primary' 'crude comments' \he'd\ 'philanthropy' 'fahrenthold' '6' 'reporting' 'article' 'david fahrenthold' 'money' 'lifetime' 'donald trump’s' 'access' 'darkness' 'interview' 'candidate' 'pulitzer' 'work' 'portion' 'trump' 'one' 'stories' 'hollywood' \trump's\ 'women' 'prize']|Fahrenthold’s work including an article disclosing that Trump had made crude comments and bragged about groping women during an unaired portion of an interview on “Access Hollywood” in 2005 was honored with the Pulitzer Prize for National Reporting.
58ec05c4cd4d740595000002	News Alert: Alabama governor resigns pleads guilty to charges tied to allegations he tried to cover up affair with a top aide	2017-04-10T18:22:42-04:00	https://www.washingtonpost.com/news/post-politics/wp/2017/04/10/alabama-governor-resigns-pleads-guilty-to-charges-tied-to-allegations-he-tried-to-cover-up-affair-with-a-top-aide/	The Washington Post		['gov' 'public resources' 'impeachment hearings' 'democracy dies' 'one' 'bentley' 'ethics violations' 'robert bentley' 'personal use' 'allegations' 'attorney general office' 'governor resigns' 'alert alabama' 'r' 'major contribution report' 'misdemeanor charges' 'state lawmakers' 'darkness' 'conceal' 'top aide' 'campaign' 'campaign contributions']	According to the state's attorney general office Bentley pleaded guilty to two misdemeanor charges related to covering up the alleged affair one for failing to file a major contribution report and another for knowingly converting campaign contributions to personal use.
58ec1629cd4d74059500000f	News Alert: An 8-year-old student has died after being wounded in a suspected murder-suicide in a San Bernardino Calif. elementary school	2017-04-10T19:32:34-04:00	https://www.washingtonpost.com/news/post-nation/wp/2017/04/10/at-least-two-students-hospitalized-after-shooting-at-san-bernardino-elementary-school-police-say/	The Washington Post		['classroom' 'san bernardino calif' 'husband' '8-year-old student' 'democracy dies' 'elementary school' 'school' 'local hospital' 'nine-year-old child' 'died police said' 'darkness' 'north park' '8-year-old boy' 'stable condition' 'murder-suicide' 'gunshot wound police said' 'teacher']	A teacher was killed inside a classroom at North Park Elementary School and her estranged husband died of a self-inflicted gunshot wound police said.
58ed6516cd4d740595000028	News Alert: The FBI obtained a secret court order last summer to monitor Trump adviser Carter Page in a probe of the campaign’s Russia ties	2017-04-11T19:21:46-04:00	https://www.washingtonpost.com/world/national-security/fbi-obtained-fisa-warrant-to-monitor-former-trump-adviser-carter-page/2017/04/11/620192ea-1e0e-11e7-ad74-3a742a6e93a7_story.html	The Washington Post		['trump' 'ties' 'carter page' 'intelligence surveillance court' 'sensitive national security cases —' 'foreign policy adviser' 'adviser' 'russian' 'oversees' 'campaign' 'evidence' 'government’s application' 'campaign adviser' 'secret court order' 'summer' 'russian government' 'presidential campaign' 'campaign spokeswomen' 'page' 'campaign’s' 'moscow' 'touch' 'fbi' 'investigators’ basis' '2016' 'court order —' 'clandestine intelligence activities' 'russia' 'agents' 'page’s' 'nation’s' 'reason' 'behalf' 'role' 'communications officials said' 'order' 'agent' 'monitor']	This is the first evidence that the FBI had reason to believe during the 2016 presidential campaign that a Trump campaign adviser was in touch with Russian agents.
58ed9717cd4d74059500002d	Politics News Alert: Republican wins the special election in Kansas to replace CIA Director Mike Pompeo	2017-04-11T22:55:06-04:00	https://www.washingtonpost.com/powerpost/republican-in-kansas-pulls-ahead-in-race-for-us-house-seat/2017/04/11/cde8126e-1ecb-11e7-ad74-3a742a6e93a7_story.html	The Washington Post		['district' 'lawmakers' 'final weekend' 'cia' 'race' 'democracy dies' 'darkness' 'open seats' 'administration' 'estes' 'state treasurer' 'alert republican' 'national gop campaign arm spending 100000' 'trump' 'republican ron estes' 'dampen' 'director' 'special election' 'gop’s' 'wichita kan' 'mike pompeo' 'democrat james thompson' 'calls' 'three' 'kansas']	The GOP’s win is likely to dampen Democratic hopes of capturing the three other open seats created when Trump plucked Republican lawmakers from Congress to fill his administration.
58ee4a57cd4d740595000038	News Alert: Russian President Vladimir Putin meets with Secretary of State Rex Tillerson amid Syria tensions	2017-04-12T11:39:48-04:00	https://www.washingtonpost.com/world/europe/tillerson-faces-tough-line-from-russia-over-support-for-syrian-leader-assad/2017/04/12/918985f2-1f19-11e7-a0a7-8b2a45e3dc84_story.html	The Washington Post		['syria' 'democracy dies' 'officials' 'assertion' 'signals' 'al-assad' 'bend' 'tillerson' 'rex tillerson' 'tensions' 'russian president' 'bashar' 'secretary' 'knowledge' 'russia' 'syrian' 'chemical attack —' 'u.s.' 'putin' 'vladimir putin' 'move' 'support' 'demands' 'ultimatums' 'denies' 'moscow' 'darkness' 'face-to-face dialogue']	The move comes after U.S. officials suggested Russia could have had advance knowledge of the Syrian chemical attack — an assertion Moscow denies.
58ee7530cd4d740595000043	Politics News Alert: Trump administration moving quickly to build up nationwide deportation force identifies where border wall construction could begin	2017-04-12T14:42:24-04:00	https://www.washingtonpost.com/politics/trump-administration-moving-quickly-to-build-up-nationwide-deportation-force/2017/04/12/7a7f59c2-1f87-11e7-be2a-3a1fb24d4671_story.html	The Washington Post		['homeland' 'customs' 'alert trump' 'house' 'shows' 'polygraph' 'hundreds' 'detention centers' 'physical fitness tests' 'discussions' 'beds' 'administration' 'border patrol officers' 'enforcement authority' 'cases' 'immigrants' 'ways' 'dozens' 'darkness politics' 'internal department' '33000' 'agency' 'documents' 'security assessment' 'local police forces' 'trump’s' 'nationwide deportation force identifies' 'democracy dies' 'border wall construction' 'construction' 'border wall']	An internal Department of Homeland Security assessment obtained by The Washington Post shows the agency has already found 33000 more beds to house undocumented immigrants in detention centers opened discussions with dozens of local police forces that could be empowered with enforcement authority and identified where construction of Trump’s border wall could begin.
58f10729cd4d74059500007e	News Alert: Trump to discontinue Obama policy of voluntarily releasing White House visitor logs	2017-04-14T13:30:10-04:00	https://www.washingtonpost.com/news/post-politics/wp/2017/04/14/trump-to-discontinue-obama-policy-of-voluntarily-releasing-white-house-visitor-logs/	The Washington Post		\['white house' 'white house visitor logs' 'privacy concerns' 'alert trump' 'instead' 'management' 'circumstances' 'separate agencies' 'white house complex' 'national security risks' 'darkness' 'policy' 'release names' 'trump' 'budget' 'democracy dies' 'names' 'grave' 'president vice president' \barack obama's\ 'discontinue' 'law' 'release information' 'components' 'new policy' 'administration' 'obama' 'visitors' 'senior staff']|The Trump administration announced Friday that it would discontinue former president Barack Obama's policy of voluntarily disclosing the names of most visitors to the White House complex citing “grave national security risks and privacy concerns.” Instead the Trump administration said it would only release information under far more limited circumstances: for those visiting components of the White House classified under the law as separate agencies such as the Office of Management and Budget.
58f2b182cd4d74059500008d	News Alert: North Korea launched a missile but it blew up almost immediately the U.S. military said. It comes amid escalating tensions with the U.S.	2017-04-15T19:48:49-04:00	https://www.washingtonpost.com/news/world/wp/2017/04/15/north-korea-launched-a-missile-but-it-blew-up-almost-immediately-the-u-s-military-said-it-comes-amid-escalating-tensions-with-the-u-s/	The Washington Post		['military said' 'missile' 'democracy dies' 'missile technology' 'u.s.' 'medium-range' 'launch' 'coast port' 'regime' 'area' 'sinpo' 'korean' 'birth' 'version' 'fly far' 'tensions' 'advances' 'pacific command said home' 'massive military parade' 'darkness' 'anniversary' 'ballistic missile' 'korea' 'blew' 'state’s founder' 'submarine base' 'immediately']	This latest launch came just a day after North Korea held a massive military parade to celebrate the anniversary of the birth of the state’s founder where the regime showed off advances in its missile technology.
58f374cdcd4d740595000091	Trending Now: A bloodstained jacket a flip phone a cadet's drum: What people saved after the Virginia Tech attack 10 years ago	2017-04-16T09:42:05-04:00	https://www.washingtonpost.com/graphics/local/virginia-tech-ten-years-later/	The Washington Post		\['sorrow generosity' 'campus' '10' 'shot' 'emotional keepsakes' 'virginia tech' 'attack' 'bloodshed' 'trending now' 'darkness trending now' '32' \cadet's drum\ 'reminders' 'democracy dies' 'jacket' 'heroism' 'flip phone' 'decade']|Trending Now: A bloodstained jacket a flip phone a cadet's drum: What people saved after the Virginia Tech attack 10 years ago
58f3afe7cd4d740595000096	News Alert: Turkey's Erdogan declares victory in close referendum to expand his powers but opposition parties contest results	2017-04-16T13:54:42-04:00	https://www.washingtonpost.com/world/turks-to-decide-whether-to-give-erdogan-vastly-increased-powers/2017/04/15/e79812b6-1bda-11e7-bcc2-7d1a0973e7b2_story.html	The Washington Post		\[\erdogan's\ 'opposition parties contest results' 'party leaders' 'victory' 'vote stands' 'referendum' 'founder' 'system' 'critics say' 'mustafa kemal ataturk' 'recep tayyip erdogan' \alert turkey's erdogan\ 'turkish republic' 'turkish president' 'democracy dies' 'transform' 'dominant leader' \turkey's\ 'government' 'powers' 'country’s' 'congratulatory calls' 'prime minister' 'darkness' 'entrench one-man rule']|If the vote stands it would transform Turkey's system of government abolish the post of prime minister and entrench one-man rule Erdogan's critics say.
58f3c56ccd4d74059500009a	Special Report: In response to a request from Trump businesses target more than 150 regulations for elimination mostly in EPA and Labor Dept.	2017-04-16T15:26:33-04:00	https://www.washingtonpost.com/politics/epa-emerges-as-major-target-after-trump-solicits-policy-advice-from-industry/2017/04/16/87a8a55a-205d-11e7-ad74-3a742a6e93a7_story.html	The Washington Post		['150' 'environmental protection' 'businesses target' 'ways' 'epa' 'request' 'darkness' 'elimination' 'projects approved' 'scores' 'trump' 'overhauling' 'dramatic series' 'steps' 'federal policies' 'democracy dies' 'safeguard worker rights' 'government' 'clearest picture' 'labor' 'industry leaders' 'response' 'companies' 'dept' 'suggestions' 'officials' 'american manufacturers' 'paint' 'regulations']	Industry leaders responded with scores of suggestions that paint the clearest picture yet of the dramatic series of steps that Trump officials are likely to take in overhauling federal policies especially those designed to advance environmental protection and safeguard worker rights.
58f5ece2cd4d7405950000bc	News Alert: Britain's prime minister calls surprise elections for June 8 to seek support for Brexit moves	2017-04-18T06:38:59-04:00	https://www.washingtonpost.com/world/british-prime-minister-calls-for-elections-in-june-amid-brexit-fallout/2017/04/18/e8cfe446-241e-11e7-b503-9d616bd5a305_story.html	The Washington Post		['bloc' 'brexit' 'exit' 'minister' 'decisions' 'prime minister calls surprise elections' 'surprise announcement' 'make' 'scotland' 'prime' 'certainty' 'darkness' 'support' 'own independent path' 'political strains' 'stability' 'democracy dies' 'election' 'moves' 'carve' '8' 'european union' 'theresa may']	“I have concluded the only way to guarantee certainty and stability for the years ahead is to hold this election and seek your support for the decisions I have  to make” Prime Minister Theresa May said.
58f63d44cd4d7405950000ce	News Alert: Facebook murder suspect Steve Stephens is dead police say	2017-04-18T12:22:14-04:00	https://www.washingtonpost.com/news/post-nation/wp/2017/04/17/multistate-manhunt-underway-for-suspect-in-facebook-homicide-video/	The Washington Post		['dead police' 'ohio' 'stephens' 'democracy dies' 'manhunt' 'slaying' 'five' 'video' 'darkness' 'cleveland' 'alert facebook' 'erie county pa' 'brief pursuit' 'murder' 'national search' 'shot' 'states' 'facebook' 'steve stephens' 'pennsylvania' '74-year-old man' 'subject' 'turning']	He had been the subject of a manhunt that began in Ohio and expanded to five states before turning into a national search.
58f6fa75cd4d7405950000e8	News Alert: Democrat Jon Ossoff faces runoff after falling short of winning outright a Ga. House seat held by GOP since 1979	2017-04-19T01:49:09-04:00	https://www.washingtonpost.com/news/post-politics/wp/2017/04/19/democrat-jon-ossoff-faces-runoff-after-falling-short-of-winning-outright-a-ga-house-seat-held-by-gop-since-1979/	The Washington Post		['winner' 'opponent' 'tom price' '50' 'hhs' 'seat' 'darkness' 'candidate' '1979' 'runoff' 'gop' 'vote —' 'house seat' 'chances' 'alert democrat jon ossoff' 'ossoff' 'ga' 'faces runoff' 'special election' 'secretary' 'democracy dies' 'slimmer' 'karen handel']	Ossoff was the projected winner in the special election to replace HHS Secretary Tom Price but he failed to secure more than 50 percent of the vote — leaving him to face a June runoff against the top Republican candidate Karen Handel.
58f741facd4d7405950000eb	News Alert: Aaron Hernandez former New England Patriots player convicted of murder hangs himself in prison	2017-04-19T06:54:41-04:00	https://www.washingtonpost.com/news/sports/wp/2017/04/19/aaron-hernandez-former-new-england-patriots-player-convicted-of-murder-hangs-himself-in-prison/	The Washington Post		['murder conviction' 'darkness' 'england patriots' 'alert aaron hernandez' 'prison' 'murder hangs' '2013' 'life sentence' 'hernandez' 'first-degree murder' 'player' 'democracy dies']	On Friday Hernandez was acquitted of two counts of first-degree murder but he was serving a life sentence for a 2013 murder conviction.
58f7822acd4d7405950000fb	News Alert: House Oversight chairman Jason Chaffetz says he will not seek reelection in 2018	2017-04-19T11:28:28-04:00	https://www.washingtonpost.com/news/post-politics/wp/2017/04/19/house-oversight-chairman-jason-chaffetz-says-he-will-not-seek-reelection-in-2018/	The Washington Post		\['interest' 'private email server' 'reelection' 'reform committee' 'speculate otherwise' 'chairman' 'candidacy' 'ulterior motives' '2012' 'statement' 'undertook probes' \hillary clinton's\ 'congressman' 'potential conflicts' 'full support' 'tenure' 'lack' 'attack' 'oversight' 'government' 'town-hall meeting' 'private sector' \trump's\ 'action' 'utah' 'healthy' 'trump' '2018' 'large margins' 'reform' 'jason chaffetz' 'ryan' 'committee' '2015' 'angry crowd' 'obama' 'house' 'chaffetz' 'position' 'facebook' 'personal decision' 'administration' 'speaker' '2016' 'benghazi']|The Republican congressman from Utah who became chairman of the House Oversight and Government Reform Committee in 2015 has been criticized for a lack of action in investigating the Trump administration and President Trump's potential conflicts of interest.
58f7b096cd4d740595000109	News Alert: Bill O’Reilly is out at Fox News following sexual harassment allegations parent company says	2017-04-19T14:46:25-04:00	https://www.washingtonpost.com/lifestyle/style/bill-oreilly-is-officially-out-at-fox-news/2017/04/19/74ebdc94-2476-11e7-a1b3-faff0034e2de_story.html	The Washington Post		['women he’d' 'darkness' 'allegations' 'bill o’reilly' 'statement' 'sexual harassment complaints' 'company' 'settlements' 'alert bill o’reilly' 'careful review' 'o’reilly' 'sexual harassment allegations parent company' 'democracy dies' 'century' 'thorough' 'channel']	“After a thorough and careful review of the allegations the Company and Bill O’Reilly have agreed that Bill O’Reilly will not be returning to the Fox News Channel” 21st Century Fox said in a statement.
58f7d386cd4d740595000114	News Alert: Berkeley cancels a speech by conservative pundit Ann Coulter citing fears of more violent protests	2017-04-19T17:15:19-04:00	https://www.washingtonpost.com/news/post-nation/wp/2017/04/19/berkeley-cancels-ann-coulter-speech-over-fears-of-more-violent-protests/	The Washington Post		\['breitbart' \coulter's\ 'conservative pundit' 'school' 'darkness' 'california' 'decision' 'past' 'conservative firebrand' 'fears' 'riots' 'speech' 'university' 'appearance' 'campus' 'group' 'three' 'editor' 'violence' 'democracy dies' 'college' 'university officials' 'alert berkeley' 'milo yiannopoulos' 'months officials' 'provocateur' 'violent protests' 'ann coulter' 'safety concerns' 'cancels' 'berkeley']|After riots and violent protests in and around their campus during the past three months officials at the University of California at Berkeley said Wednesday that the school is canceling a planned speech by conservative firebrand Ann Coulter because of safety concerns.
58f7d923cd4d740595000117	News Alert: After Fox News cancels his show Bill O’Reilly continues to deny sexual harassment allegations calling them ‘unfounded’	2017-04-19T17:39:21-04:00	https://www.washingtonpost.com/lifestyle/style/bill-oreilly-is-officially-out-at-fox-news/2017/04/19/74ebdc94-2476-11e7-a1b3-faff0034e2de_story.html	The Washington Post		['host' 'network’s announcement' 'great pride' 'unfounded' 'news cancels' 'show’s cancellation' 'claims” “the' 'viewers' 'statement' 'part ways' 'bill o’reilly' 'unfortunate reality' 'unprecedented success' 'darkness' 'deepest gratitude' 'o’reilly factor' 'public eye' 'show' 'channel.” democracy dies' 'sexual harassment allegations']	“It is tremendously disheartening that we part ways due to completely unfounded claims”  “The O’Reilly Factor” host said in a statement following the network’s announcement on the show’s cancellation.
58f91197cd4d74059500012e	News Alert: Two police officers shot one fatally on Champs Elysees in Paris; authorities tell residents to avoid the area	2017-04-20T15:52:45-04:00	https://www.washingtonpost.com/world/europe/french-police-come-under-fire-in-paris-two-reported-shot/2017/04/20/fc1f254c-25ff-11e7-bb9d-8cd6118e1409_story.html	The Washington Post		['democracy dies' 'authorities' 'fatally' 'officer' 'darkness' 'area' 'local media' 'champs elysees' 'paris' 'attacker' 'shots' 'killed' 'police officers shot' 'one' 'reuters' 'residents']	News Alert: Two police officers shot one fatally on Champs Elysees in Paris; authorities tell residents to avoid the area
58f928dccd4d740595000139	News Alert: Justice Dept. debating charges against WikiLeaks members in leaks of diplomatic and military files revelation of CIA cyber-tools	2017-04-20T17:32:10-04:00	https://www.washingtonpost.com/world/national-security/justice-dept-debating-charges-against-wikileaks-members-in-revelations-of-diplomatic-cia-materials/2017/04/20/32b15336-2548-11e7-a1b3-faff0034e2de_story.html	The Washington Post		['democratic national committee' 'u.s.' 'officials' 'diplomatic cables' 'justice' 'charge' 'darkness' 'news organization' 'emails' 'leak' 'role' '2010' 'members' 'sensitive secrets —' 'akin' 'surveillance tools' 'clinton' 'government’s' 'leaks' 'military documents' 'dept' 'wikileaks' 'john podesta’s' 'account' 'justice department' 'cyber-tools' 'barack obama' 'military files revelation' 'campaign chairman' 'cia' 'prosecutors' 'russian government' 'democracy dies' 'information' 'recent revelation']	It is not clear whether prosecutors are also looking at WikiLeaks’ role last year in publishing emails from the Democratic National Committee and Clinton campaign chairman John Podesta’s account which U.S. officials have said were hacked by the Russian government.
