58c424d6cd4d740bd30000b4	News Alert: Secret Service: Suspect arrested after scaling White House fence late Friday	2017-03-11T11:24:26-05:00	https://www.washingtonpost.com/local/public-safety/person-arrested-on-white-house-grounds-after-scaling-fence/2017/03/11/c04035f8-0673-11e7-ad5b-d22680e18d10_story.html	The Washington Post		['white house' 'white house fence' 'homeland' 'security operations' 'hazardous materials' 'briefed' 'concern' 'grounds' 'john kelly' 'individual' 'service suspect' 'security secretary' 'democracy dies' 'department' 'precautionary measure' 'uniformed secret service officers' 'darkness' 'service' 'backpack']	The south and north grounds of the White House complex were searched by the Secret Service and nothing of concern to security operations was found.
58c4381ccd4d740bd30000b9	Trending Now: White House strategist Stephen Bannon led a mysterious lifestyle as he built a conservative movement	2017-03-11T12:46:47-05:00	https://www.washingtonpost.com/investigations/during-his-political-rise-stephen-k-bannon-was-a-man-with-no-fixed-address/2017/03/11/89866f4c-0285-11e7-ad5b-d22680e18d10_story.html	The Washington Post		['darkness trending now' 'negligible footprint' 'property' 'mysterious lifestyle' 'stephen bannon' 'california' 'address' 'ex-wife' 'bannon' 'democracy dies' 'residence' 'florida' 'peripatetic path' 'breitbart' 'white house strategist' 'trending now' 'recent memory' 'businesses' 'radio program' 'expansion' 'presidential adviser' 'house' 'washington d.c.' 'conservative movement' 'york' 'authorities']	He had property and businesses in Southern California and routinely stayed in Washington D.C. and New York as he engineered the expansion of Breitbart News and hosted a live Breitbart radio program.
58c453fccd4d740bd30000bc	News Alert: Top N.Y. federal prosecutor says he was fired after refusing to resign at Justice Dept. request	2017-03-11T14:45:56-05:00	https://www.washingtonpost.com/world/national-security/new-york-federal-prosecutor-preet-bharara-has-not-submitted-resignation/2017/03/11/39163292-067a-11e7-ad5b-d22680e18d10_story.html	The Washington Post		['attorneys' 'darkness' 'confusion' 'administration' 'resign' 'preet bharara' 'obama' 'alert top n.y.' 'federal prosecutor' 'u.s.' 'democracy dies' 'dept' '46' 'justice' 'request' 'bharara' 'president-elect']	Preet Bharara was among 46 U.S. attorneys remaining from the Obama administration when the housecleaning was ordered Friday.
58c574a6cd4d740bd30000c7	Trending Now: Many in a W.Va. county are poor and sick and they voted for Trump. What will happen to them without Obamacare?	2017-03-12T12:17:17-04:00	https://www.washingtonpost.com/graphics/national/west-virginia-tug-river-obamacare/	The Washington Post		['repeal' 'darkness trending now' 'trump' 'health coverage' 'chronic diseases' 'mcdowell' 'high rates' 'it’s' 'sick' 'nation' 'democracy dies' 'place' 'donald trump' 'trending now' 'w.va.' 'county' 'shortest life expectancy' 'act' 'residents' 'obamacare' 'care']	It’s also a place that voted overwhelmingly for Donald Trump who promised to repeal the Affordable Care Act that helped many residents get health coverage.
58c5d7b7cd4d740bd30000ca	News Alert: The 2017 NCAA tournament bracket is set: Who's in and who's out? Read our full coverage here.	2017-03-12T19:20:18-04:00	https://www.washingtonpost.com/news/sports/wp/2017/03/12/2017-ncaa-tournament-cheat-sheet-upset-picks-vulnerable-favorites-best-bets-to-win-it-all/	The Washington Post		\['find' 'tournament bracket' 'teams' 'unveiled' 'march madness' 'underway' \who's out\ 'democracy dies' 'full coverage here' '68' '2017' 'nets' \who's\ 'cinderella' 'field' 'bets' 'darkness' 'ncaa']|Find out the best bets to cut down the nets and the Cinderella teams to watch as March Madness gets underway.
58c6860ecd4d740bd30000cb	News Alert: Trump budget expected to seek historic contraction of federal workforce	2017-03-13T07:43:44-04:00	https://www.washingtonpost.com/business/economy/through-his-budget-a-bottom-line-look-at-trumps-new-washington/2017/03/12/29739206-05be-11e7-b9fa-ed727b644a0b_story.html	The Washington Post		['economists' 'size' 'area' 'world war' 'drawdown' 'housing' 'research' 'federal workforce' 'vision' 'cuts' 'ii' 'role' 'trump' 'budget' 'aides' 'proposal' 'budget process' 'budget analysts said' 'magnitude —' 'clearest snapshot' 'release' 'one' 'prioritizes' 'darkness' 'federal workers changes' 'areas' 'democracy dies' '—' 'layoffs' 'alert trump' 'historic contraction' 'government' 'foreign assistance environmental programs' 'homeland security']	Aides say that the president sees a new Washington emerging from the budget process one that prioritizes the military and homeland security while slashing many other areas including housing foreign assistance environmental programs public broadcasting and research.
58c69eb6cd4d740bd30000d2	Trending Now: After a KKK banner came down in a Georgia town the real story began	2017-03-13T09:29:23-04:00	https://www.washingtonpost.com/national/in-northern-georgia-a-kkk-banner-seemed-to-some-a-sign-of-the-times/2017/03/12/de5a3518-05bd-11e7-b9fa-ed727b644a0b_story.html	The Washington Post		['town' 'life' 'real story' 'point wasn’t' 'banner' 'social media' 'dahlonega' 'kkk banner' 'photos' 'happened' 'screw' 'georgia' 'darkness trending now' 'east main street' 'democracy dies' 'trending now']	Even before the last screw came out of the banner that had been hanging on East Main Street in the small Georgia town of Dahlonega photos of it were appearing all over social media and people began speculating about who did it.
58c70055cd4d740bd30000db	News Alert: 24 million fewer would be covered under the GOP health-care plan and the deficit would drop by $337 billion over 10 years CBO says	2017-03-13T16:25:53-04:00	https://www.washingtonpost.com/powerpost/obamacare-revision-would-reduce-insured-numbers-by-24-million/2017/03/13/ea4c860a-0829-11e7-93dc-00f9bdd74ed1_story.html	The Washington Post		['sector' 'fuel' 'budget office' 'darkness' 'gop health-care plan' 'health-care industry' '10' '24 million' 'billion' 'cbo' 'democracy dies' 'reduction' 'deficit' 'proposal' 'care act' 'house' '337' 'republicans' 'drop' 'federal spending' 'revise']	The report from the Congressional Budget Office analyzing the House Republicans' proposal to revise the Affordable Care Act is likely to fuel concerns from Republicans Democrats and nearly every sector of the health-care industry about how many fewer Americans have coverage.
58c84a24cd4d740bd30000f0	News Alert: Eight current and former Navy officials — including an admiral — are charged in escalating ‘Fat Leonard’ bribery scandal	2017-03-14T15:52:53-04:00	https://www.washingtonpost.com/investigations/admiral-seven-others-charged-with-corruption-in-new-fat-leonard-indictment/2017/03/14/faf01600-08da-11e7-b77c-0047d15a24e0_story.html	The Washington Post		['leonard glenn francis' 'navy officials —' 'admiral —' 'documents' 'ridge' 'tens' 'luxury hotel stays courtesy' 'navy’s' 'five' 'bribery scandal' 'fleet' 'navy' 'prostitutes' 'uss' 'eight' 'defense contractor' 'form' 'example' 'leonard' 'democracy dies' 'defendants' 'port' 'bribes' 'officers' 'carousel' 'sex parties' 'multi-day party' '7th' 'blue ridge' 'manila' 'shangri-la hotel' 'warships' 'indictment' 'singapore-based' 'fat' 'flagship' 'millions' 'navy officers' 'darkness' 'francis' 'dollars' 'lavish gifts prostitutes']	The defendants are accused of taking bribes in the form of lavish gifts prostitutes and luxury hotel stays courtesy of Leonard Glenn Francis a Singapore-based defense contractor who has already pleaded guilty to defrauding the Navy of tens of millions of dollars.
58c89b4dcd4d740bd30000f6	News Alert: Trump paid $38 million in income tax in 2005 and reported a $105 million write-down tax return revealed on MSNBC says	2017-03-14T21:39:16-04:00	https://www.washingtonpost.com/news/post-politics/wp/2017/03/14/report-trump-paid-38-million-in-income-taxes-in-2005/	The Washington Post		\['return' 'required' 'write-down tax return' 'statement' 'tax' 'decades' '2005' 'investigative journalist' \donald trump's\ 'revelation' 'york' '1995' 'white house' 'income tax' 'david cay johnston' 'alert trump' 'income taxes' '916' 'income' 'recent glimpse' \trump's\ 'pulitzer prize-winning' 'authentic' '105' 'loss' \msnbc's\ '150' 'tax document' 'tax return' 'trump' 'msnbc' '38' 'rachel maddow show']|\The Washington Post could not independently verify the 2005 return but a statement from the White House indicated that it is authentic saying Trump paid \no more tax than legally required\ on his $150 million in income and accusing MSNBC of unlawfully releasing Trump's tax return.
58c89ca4cd4d740bd30000f7	Breaking News: President Trump made a rare disclosure about his finances. He paid $38 million in federal taxes on income of $150 million in 2005.
58c94f2acd4d740bd3000101	News Alert: DOJ indicts Russian spies in breach of 500 million Yahoo accounts marking the first such U.S. charges against Russian officials	2017-03-15T10:26:39-04:00	https://www.washingtonpost.com/world/national-security/justice-department-charging-russian-spies-and-criminal-hackers-for-yahoo-intrusion/2017/03/15/64b98e32-0911-11e7-93dc-00f9bdd74ed1_story.html	The Washington Post		['hackers' 'states' 'officials' 'members' 'fsb' '500 million' 'russian spies' 'russian intelligence agency' 'darkness' 'indictments target' 'breach' 'russian' 'condition' 'indicts' 'democracy dies' 'yahoo' 'indictments' 'heist' 'hacking wire fraud trade' 'economic espionage' '2014' 'u.s.' 'part' 'alert doj' 'secret theft' 'anonymity' 'accounts' 'russians' 'criminal hackers' 'justice department']	News Alert: DOJ indicts Russian spies in breach of 500 million Yahoo accounts marking the first such U.S. charges against Russian officials
58c982fccd4d740bd300010c	News Alert: U.S. to likely send as many as 1000 more ground troops into Syria ahead of Raqqa offensive officials say	2017-03-15T14:07:42-04:00	https://www.washingtonpost.com/news/checkpoint/wp/2017/03/15/u-s-military-probably-sending-as-many-as-1000-more-ground-troops-into-syria-ahead-of-raqqa-offensive-officials-say/	The Washington Post		['trump' 'administration' 'arab' 'democracy dies' 'darkness' '250' 'u.s.' '1000' 'operations' 'fighters' 'defense' 'mark' '500' 'kurdish' 'secretary' 'dangerous battlefield' 'troops' 'forces' 'alert u.s.' 'marines' 'addition' 'rangers' 'raqqa' 'offensive officials' 'departure' 'role' 'ground' 'ground troops' 'obama' 'syria' 'jim mattis' '200' 'new contingent']	There are already in Syria roughly 500 U.S. Special Operations forces operating alongside the Kurdish and Arab fighters in addition to roughly 250 Rangers and 200 Marines.
58c98591cd4d740bd3000112	News Alert: Fed raises benchmark interest rate for third time since 2008 launching what’s expected to be a rapid series of rate increases	2017-03-15T14:18:44-04:00	https://www.washingtonpost.com/news/wonk/wp/2017/03/15/fed-hikes-interest-rate-hits-brakes-on-growing-economy/	The Washington Post		\['growth' 'administration’s' 'threat' 'series' 'credit card purchases' 'target range' 'ward' '2008' '0.25' 'rapid series' '0.75' 'fed’s' 'value' 'dollar' 'federal reserve' 'rate increases' 'alert fed' 'costs' 'raises benchmark interest rate' 'investors' 'move' 'complicate' 'increase' 'inflation' 'borrow' '1.0' 'darkness' 'benchmark interest rate' 'percentage points' 'end' \central bank's two-day policy meeting\ 'federal funds' 'exports' 'what’s' 'trump' 'democracy dies' 'ambitious goals' 'mortgages auto loans' 'strengthening economy']|The move is likely to help ward off the threat of inflation amid a strengthening economy but it will also raise costs for Americans who borrow to finance mortgages auto loans and credit card purchases.
58c9c751cd4d740bd3000121	News Alert: Federal judge freezes Trump’s new travel ban hours before it was to take effect	2017-03-15T18:58:58-04:00	https://www.washingtonpost.com/local/social-issues/lawyers-face-off-on-trump-travel-ban-in-md-court-wednesday-morning/2017/03/14/b2d24636-090c-11e7-93dc-00f9bdd74ed1_story.html	The Washington Post		\['constitution' 'district judge' 'new ban' 'derrick k. watson' 'opponents' \trump's\ 'affected' 'irreparable harm' 'new executive order' 'hawaii' 'federal judge' 'trump’s' 'effect' 'ruling' 'democracy dies' 'officials' 'measure' 'darkness' 'executive order' 'means' 'new travel ban hours' 'power' 'u.s.' 'justice department' 'replaced']|The ruling from U.S. District Judge Derrick K. Watson in Hawaii means that U.S. officials will not be able to enforce President Trump's new executive order as planned starting Thursday.
58c9ce08cd4d740bd3000129	News Alert: Paul Ryan concedes health-care proposal must change to pass House a retreat from position that bill would fail if altered	2017-03-15T19:27:47-04:00	https://www.washingtonpost.com/powerpost/speaker-paul-ryan-doubles-down-on-gop-health-care-plan-amid-opposition/2017/03/15/872c4f3c-0974-11e7-93dc-00f9bdd74ed1_story.html	The Washington Post		['one' 'reporters' 'budget office' 'house speaker' 'concedes health-care proposal' 'republicans' 'revise' 'rank-and-file' 'act' '14 million' 'strategy' 'retreat' 'change' 'ryan' 'projection' 'house' 'private meeting' 'proposal' 'bill' 'analysis' 'care' 'incorporate feedback' 'position' 'criticism' 'democracy dies' 'details' 'darkness' 'alert paul ryan']	After a private meeting of congressional Republicans the House speaker told reporters that his proposal to revise the Affordable Care Act would “incorporate feedback” from the rank-and-file.
58c9eef9cd4d740bd3000130	News Alert: Dutch anti-Islam leader Geert Wilders fizzles in elections suggesting limits to anti-establishment appeal in Europe	2017-03-15T21:48:14-04:00	https://www.washingtonpost.com/world/dutch-vote-in-an-immigration-focused-election-with-consequences-for-all-europe/2017/03/15/f748a84e-08e1-11e7-bd19-fd3afa0f7e2a_story.html	The Washington Post		['anti-establishment' 'europe' 'germany' 'leaders' 'fizzles' 'started' 'bellwether' 'alert dutch' 'patriotic spring' 'vote' 'democracy dies' 'darkness' 'dutch' 'fierce anti-immigrant sentiment' 'limits' 'anti-islam leader' 'polls' 'voters' 'firebrand campaigner' 'head' 'months' 'elections' 'geert wilders' 'france']	The vote was seen as a bellwether for France and Germany which head to the polls in the coming months and have also been shaken by fierce anti-immigrant sentiment.
58ca0f32cd4d740bd3000133	News Alert: Trump’s budget set for release Thursday proposes the broadest cuts to federal programs since just after World War II	2017-03-16T00:05:37-04:00	https://www.washingtonpost.com/business/economy/trump-federal-budget-2018-massive-cuts-to-the-arts-science-and-the-poor/2017/03/15/0a0a0094-09a1-11e7-a15f-a58d4a988474_story.html	The Washington Post		['3200' 'rest' '2018' 'darkness' 'broadest cuts' 'bill' 'endowment' 'reductions' '20' 'trump’s' 'labor' 'budget cuts' 'arts' 'management' 'cutbacks' 'white house officials' 'government' 'swamp' 'programs' 'release' 'environmental protection' 'budget' 'fiscal year' 'reporters' 'one' 'positions' 'likely lead' 'mick mulvaney' 'alert trump’s' 'humanities' 'sharp increases' 'federal programs' 'eliminated' 'ii' 'federal support' 'goals' 'democracy dies' 'future' 'agency alone' 'you can’t drain' 'president’s budget' 'state departments' 'agriculture' 'world war' 'federal non-military workforce' 'hard' 'white house office' 'agencies' 'director' 'broadcasting' 'corporation' 'sheer size' '50' 'dramatic reductions']	If the spending bill for fiscal year 2018 is approved by Congress some agencies would be hit hard with reductions of more than 20 percent at the Agriculture Labor and State departments.
58ca7f37cd4d740bd300013e	News Alert: What Trump's proposed budget would mean for each federal agency	2017-03-16T08:03:40-04:00	https://www.washingtonpost.com/graphics/politics/trump-presidential-budget-2018-proposal/	The Washington Post		\['19' 'things' 'federal agency' 'agriculture department' 'defense spending' 'school voucher programs' 'billion' 'endowment' 'increase' 'payment' 'radio' 'darkness' 'agencies' 'budget' 'state department' 'departments' 'broadcasting' 'democracy dies' 'supports' 'public television' 'pbs' 'environmental protection agency' 'arts' 'corporation' 'hardest hits' 'border wall' 'proposal' \trump's\ 'npr' '54']|The proposal also eliminates funding for 19 other agencies including the National Endowment for the Arts and the Corporation for Public Broadcasting which supports public television and radio including PBS and NPR.
58caa7a7cd4d740bd3000144	Politics News Alert: Three Republicans vote no as House Budget Committee advances GOP health-care bill	2017-03-16T10:56:20-04:00	https://www.washingtonpost.com/powerpost/obamacare-revision-moves-to-next-step-thursday-house-budget-committee/2017/03/15/31fa1ec8-09f5-11e7-93dc-00f9bdd74ed1_story.html	The Washington Post		['house floor' 'committee' 'vote' 'committee advances gop health-care bill' 'house' 'bill' 'quick action' 'stage' 'three' 'budget' 'debate' 'rules' 'democracy dies' 'place' 'darkness politics' 'head' 'such changes']	Before that stage the bill will head to the Rules Committee where such changes could take place.
58cacbd1cd4d740bd3000147	Politics News Alert: New details released on Russia-related payments to Flynn before he joined Trump campaign	2017-03-16T13:30:44-04:00	https://www.washingtonpost.com/politics/new-details-released-on-russia-related-payments-to-flynn-before-he-joined-trump-campaign/2017/03/16/52a4205a-0a55-11e7-a15f-a58d4a988474_story.html	The Washington Post		['ambassador' 'expenses' 'democracy dies' '68000' 'flynn' 'payments' 'russia’s' 'national security adviser' 'documents' 'entities' 'new details' 'controversy' 'amount' 'michael flynn' 'trump' 'campaign' 'darkness politics' '2015' 'known' 'fees' 'contacts' 'russia-related' 'resign']	Michael Flynn who was forced to resign as national security adviser amid controversy over his contacts with Russia’s ambassador collected nearly $68000 in fees and expenses from Russia-related entities in 2015 a higher amount than was previously known according to newly released documents.
58cad622cd4d740bd300014a	Politics News Alert: Key senators say they have no evidence that Trump Tower was wiretapped	2017-03-16T14:14:50-04:00	https://www.washingtonpost.com/news/powerpost/wp/2017/03/16/key-senators-say-they-have-no-evidence-that-trump-tower-was-wiretapped/	The Washington Post		['campaign headquarters' 'evidence' 'mark warner' 'va' 'subject' 'lawmakers' 'data' 'democratic leaders' 'trump’s' 'claim' 'darkness politics' 'surveillance' 'richard burr' 'election day 2016' 'trump tower' 'element' 'committee chairman' 'intelligence' 'joint statement' 'information' 'presidential election' 'united states' 'alert key' 'current evidence' 'chorus' 'committee' 'r-n.c.' 'government' 'senators' 'us' 'indications' 'senate' 'democracy dies']	The Republican and Democratic leaders of the Senate Intelligence Committee joined the chorus of lawmakers stating they are not aware of any current evidence supporting President Trump’s claim that his campaign headquarters were wiretapped during the presidential election.
58caf57fcd4d740bd3000153	News Alert: Press secretary says Trump ‘stands by’ unproven allegation that Obama ordered wiretapping of Trump tower	2017-03-16T16:28:36-04:00	https://www.washingtonpost.com/news/post-politics/wp/2017/03/16/spicer-says-trump-stands-by-unproven-allegation-that-obama-ordered-wiretapping-of-trump-tower/	The Washington Post		\['evidence' 'house intelligence chairmen' 'remarks' 'stands by’ unproven allegation' \trump's\ 'similar remarks' 'committee' 'tower' 'press secretary' 'leaders' 'senate' 'obama' 'darkness' 'trump' 'intelligence' 'sean spicer’s' 'democracy dies' 'trump tower' 'campaign']|Sean Spicer’s remarks came as leaders of the Senate Intelligence Committee declared that there is no evidence supporting Trump's claim that Trump Tower was wiretapped during the campaign.
58cc3f00cd4d740bd3000170	News Alert: Justice Dept. files legal papers in federal court in Md. setting up a new appeals court showdown in Richmond	2017-03-17T15:54:23-04:00	https://www.washingtonpost.com/world/national-security/trump-administration-files-notice-it-will-appeal-ruling-against-second-version-of-travel-ban/2017/03/17/6fe4b33a-0b1f-11e7-b77c-0047d15a24e0_story.html	The Washington Post		['dept' 'setting' 'travel ban executive order' 'justice' 'new appeals court showdown' 'richmond' 'files' 'darkness' 'hawaii' 'legal papers' 'democracy dies' 'orders' 'amendment' 'particular religion' 'md' 'federal court' 'maryland' 'federal judges']	Earlier this week federal judges in Hawaii and Maryland issued temporary restraining orders against the travel ban executive order finding it violated the First Amendment by disfavoring a particular religion.
58cc676ecd4d740bd3000175	News Alert: Intruder was within secure perimeter around White House for more than 16 minutes in incident last week Secret Service confirms	2017-03-17T18:47:06-04:00	https://www.washingtonpost.com/local/public-safety/secret-service-laptop-with-sensitive-information-stolen-in-new-york-law-enforcement-officials-say/2017/03/17/b3861be0-0b35-11e7-b77c-0047d15a24e0_story.html	The Washington Post		['outer-perimeter fence' 'secret service confirms' 'treasury complex' 'white house grounds' 'portico' 'white house' 'individual' 'entrance' 'mace' 'alert intruder' 'wing' 'democracy dies' '8-foot vehicle gate' 'corner' '3.5-foot fence' '16' 'agency' 'darkness' 'perimeter' 'incident' '10' 'custody']	The agency said that on March 10 an individual carrying Mace breached an outer-perimeter fence near the Treasury complex scaled an 8-foot vehicle gate and climbed over a 3.5-foot fence near the southeast corner of the East Wing of the White House grounds before being located and taken into custody near the South Portico entrance.
58cd136ccd4d740bd300017d	News Alert: French official: Man killed by security at Paris airport had shot an officer at earlier traffic stop	2017-03-18T07:00:46-04:00	https://www.washingtonpost.com/world/officials-paris-airport-evacuated-after-security-forces-kill-man-who-stole-guards-weapon/2017/03/18/26a71d1e-752c-4150-85e3-3c5c52f0f805_story.html	The Washington Post		['airport' 'rifle' 'officer' 'paris' 'person' 'traffic' 'democracy dies' 'interior' 'security' 'darkness' 'roux' 'french official man' 'intelligence officials' 'minister' 'shot' 'car' 'orly' 'guard' 'bruno' 'man' 'suburb']	French Interior Minister Bruno Le Roux said the man who had taken a rifle from a guard at Orly airport was the same person linked to a car hijacking in a Paris suburb.
58cd689ccd4d740bd3000181	News Alert: Trump administration rejects G-20 language stressing need for free trade threatening potential new rifts with U.S. allies	2017-03-18T13:04:05-04:00	https://www.washingtonpost.com/business/economy/new-rifts-emerge-as-trump-rejects-free-trade-statement-at-g20-meeting/2017/03/18/aa69b1a2-0bf3-11e7-a15f-a58d4a988474_story.html	The Washington Post		\['white house' 'darkness' 'steven mnuchin' 'treasury secretary' 'new rifts' 'joint statement' 'antagonistic approach' 'german officials' 'allies' 'pursue' 'alert trump' 'g-20' 'potential' 'multiple attempts' \g-20's\ 'language' 'free trade' 'clear signal' 'world' 'united states' 'democracy dies' 'need' 'partners' 'administration rejects' 'importance' 'u.s.']|Treasury Secretary Steven Mnuchin rebuffed multiple attempts from German officials to emphasize the importance of free trade in the G-20's joint statement sending a clear signal from the White House that the United States would pursue a more antagonistic approach with trading partners around the world.
58cdb90ecd4d740bd300018b	News Alert: Chuck Berry wild man behind rock-and-roll’s rebel spirit dies	2017-03-18T18:47:26-04:00	https://www.washingtonpost.com/entertainment/music/chuck-berry-wild-man-of-rock-who-helped-define-its-rebellious-spirit-dies-at-90/2017/03/18/1f2038f6-0c29-11e7-93dc-00f9bdd74ed1_story.html	The Washington Post		['spirit' 'songs' 'rock-and-roll’s' 'democracy dies' 'sly poet laureate' 'old way' 'it” vitality' 'rock music’s rebellious spirit' 'press reported' 'darkness' 'music itself' 'girls cars school' 'alert chuck berry' 'chuck berry' '1950s' 'died' 'wild man' '90']	Chuck Berry who helped define rock music’s rebellious spirit in the 1950s and was the sly poet laureate of songs about girls cars school and even the “any old way you choose it” vitality of the music itself has died the Associated Press reported.
58cec561cd4d740bd300019a	Trending Now: Inside Trump's White House a class war brews as populist aides clash with New York executives	2017-03-19T13:52:12-04:00	https://www.washingtonpost.com/politics/inside-trumps-white-house-new-york-moderates-spark-infighting-and-suspicion/2017/03/18/51e3c4d2-0b1c-11e7-a15f-a58d4a988474_story.html	The Washington Post		\['president’s' 'targets' 'york' 'trending now' 'executives' 'house' 'democracy dies' 'jealousy' 'dismissed' 'suspicion' 'class war brews' 'daughter' 'darkness trending now' 'white house' 'democrats' 'rivals' 'manhattan' 'populist aides clash' 'colleagues' 'husband —' 'wing' \trump's\ 'business figures-turned-presidential advisers —']|Dismissed by their rivals inside the White House as “the Democrats” the Manhattan business figures-turned-presidential advisers — often aligned with the president’s older daughter and her husband — are the targets of suspicion loathing and jealousy from their more ideological West Wing colleagues.
