5890b93ccd4d744f1200002c	News Alert: Democrats boycott confirmation hearings for treasury health and human services secretaries blocking votes	2017-01-31T11:19:56-05:00	https://www.washingtonpost.com/powerpost/senate-democrats-face-a-key-test-tuesday-amid-promises-to-stand-up-to-trump/2017/01/31/1685487a-e7bd-11e6-b82f-687d6e6a3e7c_story.html	The Washington Post		\['finance' 'human services secretaries' 'confirmation process' 'health' 'quorum' 'confirmation' 'committee vote' 'human services' 'nominees' 'treasury health' \trump's\ 'tom price' 'news alert' 'votes' 'treasury steve mnuchin' 'committee' 'secretary' 'boycott confirmation hearings' 'nominee']|Democrats are boycotting the Finance Committee denying Republicans a quorum to approve confirmation of Rep. Tom Price President Trump's nominee for secretary of health and human services.
589133c6cd4d7415b5000004	News Alert: Watch live as Trump announces his nominee for Supreme Court	2017-01-31T20:02:31-05:00	https://www.washingtonpost.com/politics/courts_law/trump-brings-finalists-for-supreme-court-nomination-to-washington/2017/01/31/21dd9280-e7e6-11e6-bf6f-301b6b443624_story.html	The Washington Post		\['event' 'likely choices' 'trump' \trump's\ 'supreme court' 'pro-gun-rights record' '8' 'jurist' 'federal appeals court judge' 'front-runners' 'conservative legal establishment' 'alert watch' 'news alert' 'thomas m. hardiman' 'announces' 'eastern time' 'white house' 'announcement' 'blue-collar roots' 'neil gorsuch' 'nominee']|The most likely choices are Neil Gorsuch a highly credentialed jurist and a favorite of the conservative legal establishment and Thomas M. Hardiman a federal appeals court judge with blue-collar roots and a pro-gun-rights record.
589136b9cd4d7417ef000007	News Alert: Trump nominates Neil Gorsuch a proponent of strictly interpreting the Constitution to fill Supreme Court vacancy	2017-01-31T20:15:30-05:00	https://www.washingtonpost.com/politics/trump-picks-colo-appeals-court-judge-neil-gorsuch-for-supreme-court/2017/01/31/2b08a226-e55e-11e6-a547-5fb9411d332c_story.html	The Washington Post		['49-year-old nominee' 'conservative vote' 'nominates' 'trump' 'neil gorsuch' 'supreme court vacancy' 'news alert' 'proponent' 'alert trump' 'conservative legal establishment' 'federal appeals court judge' 'colorado' 'gorsuch' 'originalist” interpretation' 'court' 'constitution']	News Alert: Trump nominates Neil Gorsuch a proponent of strictly interpreting the Constitution to fill Supreme Court vacancy
5891fd89cd4d741946000008	News Alert: Senate committee approves Trump Treasury Health nominees without Democrats present after GOP suspends rules	2017-02-01T10:23:29-05:00	https://www.washingtonpost.com/powerpost/republicans-ram-through-committee-approval-of-trump-cabinet-nominees/2017/02/01/aa2b5458-e87f-11e6-b82f-687d6e6a3e7c_story.html	The Washington Post		['move' 'senate floor' 'gop suspends rules' 'chair orrin hatch' 'services' 'nominations' 'secretary' 'trump treasury' 'senate parliamentarian' 'steve mnuchin' 'treasury secretary' 'health' 'tom price' 'nominees' 'news alert' 'consideration' 'senate committee approves' 'health nominees' 'finance committee' 'rules' 'committee']	The Finance Committee approved Steve Mnuchin as Treasury secretary and Rep. Tom Price as Health and Human Services secretary with all Republicans on the committee present and voting to advance the nominees to the Senate floor.
58920f0bcd4d741946000010	Politics News Alert: Jeff Sessions's attorney general nomination clears key committee vote amid immigration controversy	2017-02-01T11:38:04-05:00	https://www.washingtonpost.com/world/national-security/jeff-sessions-approved-by-judiciary-committee-after-another-bitter-hearing/2017/02/01/32c31e5c-e87d-11e6-80c2-30e57e57e05d_story.html	The Washington Post		\['attorney general' 'committee' 'attorney general nomination' 'trump' 'r.ala.' 'head' 'key committee vote' 'department' 'nomination' 'controversial immigration order' 'full senate' \alert jeff sessions's\ 'judiciary' 'immigration controversy' 'news alert' 'justice' 'tumultuous time' 'senate' 'jeff sessions' 'party-line committee vote' 'end']|The party-line committee vote comes at a tumultuous time for the Department of Justice whose acting head was replaced Monday after she refused to defend a controversial immigration order from President Trump.
58923f9fcd4d74393d000010	News Alert: Senate confirms former Exxon CEO Rex Tillerson as secretary of state	2017-02-01T15:05:39-05:00	https://www.washingtonpost.com/news/post-politics/wp/2017/02/01/senate-confirms-rex-tillerson-to-become-secretary-of-state/	The Washington Post		['senate confirms' 'refugees' 'confirmation' 'immigration' 'lifelong oil company executive' 'central role' 'refugee resettlement' 'national security' 'citizens' 'place' 'secretary' 'big swings' 'muslim-majority' 'state department' ' br' 'white house order' 'america first' 'nations' 'heads' 'issue' 'administration' 'rex tillerson' 'obama' 'exxon ceo rex tillerson' 'entry' 'trump' 'tillerson' 'admission' 'foreign policy policies' 'helm' 'weeks' 'foreign policy' 'policies']	< /br>The State Department he now heads has a central role in refugee resettlement and other immigration and travel-related policies now at issue in a White House order suspending the admission of refugees and restricting entry for citizens from several Muslim-majority nations.
58933774cd4d745c70000006	News Alert: Corrections officer dead after day-long hostage standoff at Delaware prison	2017-02-02T08:43:09-05:00	https://www.washingtonpost.com/news/morning-mix/wp/2017/02/02/inmates-demanding-education-protesting-trump-take-hostages-at-delaware-prison/	The Washington Post		\['officials' '40' 'state police' 'corrections' 'four' 'corrections department workers hostage' 'hostage' 'corrections officer' 'day-long hostage standoff' 'james t. vaughn correctional' 'inmates' 'news alert' 'smyrna' 'prisons' 'prison' 'alert corrections' 'building' 'miles' 'standoff' 'lockdown' 'state prison' 'center' 'wilmington' 'men' 'death' 'delaware' \delaware's\ 'officer']|The standoff began Wednesday morning when inmates at the James T. Vaughn Correctional Center in Smyrna about 40 miles south of Wilmington took four corrections department workers hostage prompting a lockdown of prisons across the state.
5893d0f0cd4d7466ce00001b	News Alert: In a potential shift Trump warns Israel that new settlements 'may not help' achieve Middle East peace	2017-02-02T19:38:07-05:00	https://www.washingtonpost.com/news/post-politics/wp/2017/02/02/in-a-potential-shift-trump-warns-israel-that-new-settlements-may-not-help-achieve-middle-east-peace/	The Washington Post		\['united nations' 'israel' 'statement marks' 'obama' 'position' 'warns' 'help' 'peace' 'u.s.' 'potential shift' 'strong supporter' 'news alert' \new settlements 'may\ 'trump' 'administration' 'daniel friedman' \trump's\ 'veto' 'west bank settlements' 'pro-israel stance' 'resolution' 'ambassador' 'settlements' 'israeli']|In December he pressured the Obama administration to veto a United Nations resolution critical of Israeli settlements.
5894885ccd4d742506000011	News Alert: U.S. economy adds 227000 jobs in January; unemployment rate at 4.8 percent	2017-02-03T08:40:28-05:00	https://www.washingtonpost.com/news/wonk/wp/2017/02/03/u-s-economy-adds-227000-jobs-in-january-unemployment-ticks-up-to-4-8/	The Washington Post		['4.8' 'unemployment rate' 'employment report' 'economy' 'healthy pace' 'alert u.s.' '227000' 'donald trump' 'jobs' 'presidency' 'news alert']	News Alert: U.S. economy adds 227000 jobs in January; unemployment rate at 4.8 percent
5894a71acd4d742506000019	News Alert: Trump administration issues sanctions against Iranian entities and individuals connected to country’s ballistic missile program	2017-02-03T10:51:25-05:00	https://www.washingtonpost.com/world/national-security/trump-administration-sanctions-iran-on-missile-test/2017/02/03/dfb101ce-4107-409e-ab45-f49449e92c1f_story.html	The Washington Post		['entities' 'country’s ballistic missile program' 'vow' 'individuals' 'white house' 'sanctions' 'on notice' 'news alert' 'iranian' 'administration issues sanctions' 'alert trump' 'iran']	The sanctions represent the first move by the White House to make good on a vow earlier this week putting Iran “on notice.” News Alert.
5894c219cd4d742506000024	News Alert: More than 100000 visas have been revoked due to President Trump’s travel ban Justice Department attorney says	2017-02-03T12:46:52-05:00	https://www.washingtonpost.com/local/public-safety/government-reveals-over-100000-visas-revoked-due-to-travel-ban/2017/02/03/7d529eec-ea2c-11e6-b82f-687d6e6a3e7c_story.html	The Washington Post		['justice' 'news alert' '100000' 'trump’s' 'international airport' 'travel ban justice department attorney' 'figure' 'immigration' 'virginia' 'yemeni' 'dulles' 'brothers' 'visas' 'ethiopia' 'attorney' 'court hearing' 'department’s' 'return flight' 'litigation']	An attorney from the Justice Department’s Office of Immigration Litigation provided the figure during a court hearing on the case of two Yemeni brothers who arrived at Dulles International Airport in Virginia on Saturday and were quickly put on a return flight to Ethiopia.
58952c1ecd4d744b50000016	News Alert: U.S. judge temporarily blocks Trump's travel ban; ruling is effective nationwide	2017-02-03T20:19:01-05:00	https://www.washingtonpost.com/national/religion/us-judge-temporarily-blocks-trumps-travel-ban-nationwide/2017/02/03/e4888a4a-ea6d-11e6-903d-9b11ed7d8d2a_story.html	The Washington Post		\['executive order' 'trump’s' 'countries' 'seattle' 'judge' 'alert u.s.' 'minnesota' 'news alert' 'federal judge' \trump's\ 'muslim' 'blocks' 'country' 'legal battles' 'travel ban ruling' 'ban' 'seven']|A federal judge in Seattle has temporarily blocked President Trump’s ban on people from seven predominantly Muslim countries after Washington state and Minnesota urged a nationwide hold on the executive order that has launched legal battles across the country.
589552bccd4d744b5000001e	News Alert: Trump’s pick for Army secretary withdraws from consideration	2017-02-03T23:03:48-05:00	https://www.washingtonpost.com/news/post-politics/wp/2017/02/03/trumps-pick-for-army-secretary-withdraws-from-consideration/	The Washington Post		['nomination' 'business ties' 'vincent viola' 'bloomberg' 'virtu financial' 'consideration' 'secretary' 'army' 'white house' 'army secretary withdraws' 'difficult' 'alert trump’s' 'billionaire founder' 'viola' 'news alert' 'firm']	Vincent Viola the billionaire founder of trading firm Virtu Financial has withdrawn his nomination to be secretary of the Army a White House official told The Washington Post.
58955375cd4d744b5000001f	News Alert: Government authorities have begun taking steps to allow those previously banned to travel based on new federal ruling	2017-02-03T23:07:08-05:00	https://www.washingtonpost.com/world/national-security/federal-judge-temporarily-blocks-trumps-immigration-order-nationwide/2017/02/03/9b734e1c-ea54-11e6-bf6f-301b6b443624_story.html	The Washington Post		['judge' 'steps' 'broader' 'outrageous” ruling' 'time though' 'file “at' 'later' 'ruling' 'similar statement' 'government authorities' 'emergency stay' 'statement' 'similar ones' 'airlines' 'communicate' 'justice department' 'white house' 'news alert' 'officials' 'new federal ruling' 'word “outrageous' 'travel' 'james l. robart' 'possible time']	At the same time though the White House said in a statement the Justice Department would file “at the earliest possible time” for an emergency stay of the “outrageous” ruling from the judge.
5895f758cd4d744b50000025	News Alert: State Dept. reverses visa revocations allowing previously banned travelers to enter U.S.	2017-02-04T10:46:05-05:00	https://www.washingtonpost.com/news/post-politics/wp/2017/02/04/state-dept-reverses-visa-revocations-allowing-previously-banned-travelers-to-enter-u-s/	The Washington Post		\['dept' 'reverses visa revocations' 'news alert' 'part' 'state department undid' 'tens' 'federal judge' \trump's\ 'travelers' 'ban' 'thousands' 'travel ban' 'implementation' 'u.s.' 'action' 'visas']|Tens of thousands of people had their visas provisionally revoked as part of the implementation of President Trump's travel ban.
58967752cd4d744b50000031	News Alert: Justice Dept. files notice of appeal to restore Trump immigration ban	2017-02-04T19:52:19-05:00	https://www.washingtonpost.com/politics/state-dept-reverses-visa-revocations-allows-banned-travelers-to-enter-us/2017/02/04/0ab5880a-eaee-11e6-bf6f-301b6b443624_story.html	The Washington Post		['appeals court' 'restore' 'states' 'district judge' 'james l. robart' 'dept' 'federal appeals court' 'news alert' 'u.s.' 'trump' 'government lawyers' 'ongoing” harms' 'unclear' 'directive' 'justice' 'significant' 'files notice' 'immigration ban' 'rule' 'ban' 'meantime']	Government lawyers said they would ask a federal appeals court to end a stay on the ban imposed by U.S. District Judge James L. Robart who had ruled the directive imposed “significant and ongoing” harms.
5896f1ebcd4d744155000003	News Alert: Federal appeals court rejects request for immediate reinstatement of Trump’s travel ban	2017-02-05T04:35:30-05:00	https://www.washingtonpost.com/politics/trump-administration-appeals-to-restore-travel-ban-says-earlier-ruling-was-second-guessing-the-president/2017/02/05/6fcdbb5a-eb4c-11e6-80c2-30e57e57e05d_story.html	The Washington Post		['travelers' 'department’s' 'administration' 'news alert' 'restore president' 'travel ban' 'refugees' 'seven' 'trump’s' 'arguments' 'muslim' 'request' 'federal judge’s ruling' 'trump' 'states' 'countries' 'circuit' 'appeals' 'donald trump’s' 'court' 'justice' 'federal appeals court rejects request' 'u.s.' 'executive order' 'immediate reinstatement']	The U.S. Court of Appeals for the 9th Circuit has denied the Justice Department’s request to immediately restore President Donald Trump’s executive order banning refugees and travelers from seven predominantly Muslim countries from entering the United States.
5897cc3ecd4d74415500000f	News Alert: Follow our coverage of halftime and game action during Super Bowl LI	2017-02-05T20:07:01-05:00	https://www.washingtonpost.com/news/sports/wp/2017/02/03/2017-super-bowl-51-patriots-vs-falcons-latest-news-commercials-halftime-show-info-betting-guide-and-more/	The Washington Post		['highlights' 'bowl' 'gaga’s' 'atlanta' 'lady' 'spotlight' 'li' 'news alert' 'half' 'halftime' 'halftime show' 'falcons' 'commercials' 'game action']	Atlanta dominated the first half but watch to see whether Lady Gaga’s halftime show takes the spotlight from the Falcons.
5897cc7bcd4d744155000010	Sports News Alert: Falcons shock Patriots with 21-3 lead at halftime of Super Bowl LI	2017-02-05T20:07:52-05:00	https://www.washingtonpost.com/news/sports/wp/2017/02/03/2017-super-bowl-51-patriots-vs-falcons-latest-news-commercials-halftime-show-info-betting-guide-and-more/	The Washington Post		\['news alert' 'points' 'patriots' 'li' 'lead' 'half' 'halftime' 'shock' 'alert falcons' 'seconds' 'field goal' \england's\ 'sports' '21-3' 'bowl']|Sports News Alert: Falcons shock Patriots with 21-3 lead at halftime of Super Bowl LI
5897edeacd4d744155000015	News Alert: Patriots claw back from record deficit to win in first overtime of Super Bowl history	2017-02-05T22:30:18-05:00	https://www.washingtonpost.com/news/sports/wp/2017/02/03/2017-super-bowl-51-patriots-vs-falcons-latest-news-commercials-halftime-show-info-betting-guide-and-more/	The Washington Post		['bowl history' 'atlanta falcons' 'bowl ever' 'force' 'overtime' 'england' 'news alert' 'title' 'claw' '25-point hole' '34-28' 'alert patriots' 'record deficit']	New England recovered from a 25-point hole to force the first overtime Super Bowl ever defeating the Atlanta Falcons 34-28 for the team's fifth title.
589801f3cd4d744155000020	Technology News Alert: Uber Twitter Netflix and other tech giants to call immigration order ‘unlawful’ in rare coordinated legal action	2017-02-05T23:56:14-05:00	https://www.washingtonpost.com/news/the-switch/wp/2017/02/05/uber-twitter-netflix-and-other-tech-giants-to-call-travel-ban-unlawful-in-rare-coordinated-legal-action/	The Washington Post		\['principles' 'alert uber twitter netflix' 'decades' 'executive order' 'states' 'news alert' 'joint' 'trump' 'number' 'immigration law' 'countries' 'entry' 'tech giants' '20' 'seven' 'administration’s travel ban' 'prominent tech companies' 'group' 'draft' 'u.s.' 'legal brief' \trump's\ 'travelers' 'tech firms' 'enforcement' 'federal judge' 'technology news' 'departs' 'refugees' 'immigration order ‘unlawful' 'legal action' 'muslim']|In a joint legal brief the group of prominent tech companies calls the Trump administration’s travel ban discriminatory and states that it “departs dramatically from the principles that have governed our immigration law for decades” according to a draft of the filing obtained by The Post.
5898e312cd4d744155000025	Politics News Alert: Democrats expected to be nearly united against remaining Trump cabinet picks	2017-02-06T15:56:32-05:00	https://www.washingtonpost.com/powerpost/virtually-all-democrats-poised-to-vote-against-remaining-trump-cabinet-picks/2017/02/06/4493bee0-eca9-11e6-9662-6eedf1627882_story.html	The Washington Post		['trump' 'department' 'education justice' 'top cabinet nominees' 'historic rebuke' 'health' 'treasury' 'departments' 'senators' 'end' 'cabinet nominees' 'betsy devos' 'first-term president’s' 'labor' 'senate' 'jeff sessions' 'democratic senators' 'top budget nominee —' 'education' 'virtually' 'news alert' 'cabinet' 'trump’s' 'vote' 'r-ala' 'services' 'attorney general']	Virtually all Democratic senators are expected to vote against President Trump’s picks to lead the departments of Education Justice Health and Human Services Labor and Treasury and his top budget nominee — a historic rebuke of a first-term president’s top Cabinet nominees.
58990676cd4d744155000029	News Alert: Federal appeals court schedules hearing for Tuesday on Trump travel order	2017-02-06T18:27:23-05:00	https://www.washingtonpost.com/world/national-security/opposition-to-trump-travel-ban-grows-as-key-court-decision-looms/2017/02/06/d766ec7c-ec74-11e6-9662-6eedf1627882_story.html	The Washington Post		['minnesota' 'travel order' 'ban' 'court' 'lawyers' 'u.s.' 'justice department' 'suspended' '6' 'hold' 'present arguments' 'appeals' 'immigration ban' 'news alert' 'states' 'circuit' 'federal appeals court schedules hearing' 'trump']	The U.S. Court of Appeals for the 9th Circuit asked the Justice Department and lawyers for the states of Washington and Minnesota which had successfully sued to put the immigration ban on hold to call in at 6 p.m. (EST) Tuesday to present arguments on whether the ban should remain suspended.
589a0e4dcd4d74415500003a	News Alert: Vice President Pence casts historic tie-breaking vote as Senate confirms DeVos as education secretary	2017-02-07T13:13:20-05:00	https://www.washingtonpost.com/local/education/senate-to-vote-today-on-confirmation-of-betsy-devos/2017/02/06/fd4b7e9c-ec85-11e6-9662-6eedf1627882_story.html	The Washington Post		['vote' 'cabinet nominee' 'casts' 'nation’s history' 'news alert' 'education secretary' 'donor' 'narrowest approval' 'senate confirms' 'senate' 'vice president' '50-50' 'democratic caucus' 'billionaire' 'michigan' 'devos' 'senators' '48' 'setting' 'tie' 'republicans' 'betsy devos' 'pence']	The Democratic caucus of 48 senators voted against DeVos as did two Republicans setting up a 50-50 tie that was broken with a vote from Vice President Pence.
589a3fe5cd4d74415500003d	News Alert: Trump administration will approve final permit for Dakota Access pipeline allowing the disputed project to be completed	2017-02-07T16:44:40-05:00	https://www.washingtonpost.com/news/energy-environment/wp/2017/02/07/trump-administration-to-approve-final-permit-for-dakota-access-pipeline/	The Washington Post		['dakota' 'need' 'withheld' 'dakota access' 'administration' 'cross' '1200-mile 3.8' 'billion' 'missouri' 'trump' 'extensive environmental review —' 'officials —' 'project' 'army' 'justice department documents' 'oil pipeline' 'expedite' 'pipeline' 'alert trump' 'engineers' 'pipeline project' 'review' 'army corps' 'river reservoir']	The Army as early as Wednesday will allow the 1200-mile $3.8 billion Dakota Access oil pipeline to cross under a Missouri River reservoir in North Dakota according to Justice Department documents.
589a516bcd4d744155000041	News Alert: Follow live as a federal appeals court hears arguments on Trump’s travel ban	2017-02-07T17:59:36-05:00	https://www.washingtonpost.com/politics/2017/live-updates/trump-white-house/hearing-on-trump-travel-ban-updates-from-the-federal-appeals-court/	The Washington Post		['enforcement' 'lawyers' 'justice department' 'immigration order' '6' 'updates' 'trump’s' 'travel ban' 'federal appeals court hears arguments' 'arguments' 'telephone' 'listen' 'minnesota' 'order halted' 'live stream' 'eastern time' 'federal court judge' 'blog' 'hearing' 'states' 'presenting']	The hearing which is set to begin at 6 p.m. Eastern time and will be conducted by telephone comes a few days after a lower federal court judge in Washington temporarily blocked enforcement of President Trump’s immigration order.
589bb8efcd4d744155000068	News Alert: Jeff Sessions who has helped shape many of Trump’s early policies is confirmed as attorney general after a bitter Senate debate	2017-02-08T19:33:38-05:00	https://www.washingtonpost.com/world/national-security/senate-confirms-jeff-sessions-as-attorney-general/2017/02/08/051d58f6-ed72-11e6-9973-c5efb7ccfb0d_story.html	The Washington Post		['accusations' 'insensitive charges' 'ban' 'bitter senate debate' 'aides' 'rebuke sen' 'attorney general' 'alert jeff sessions' 'jeff sessions' 'federal judge' 'trump’s' 'seven' 'debate' 'citizens' 'senator' 'trump' 'manner' 'controversial moves' 'alabama' 'career' 'elizabeth warren' 'allies' 'refugees' 'sessions' 'bid' 'early policies' 'influential' 'senate' 'shape' 'muslim-majority' 'house' 'countries' 'chamber']	Sessions is already deeply influential in the Trump White House with his aides and allies pushing for some of Trump’s most controversial moves including the ban on refugees and citizens from seven Muslim-majority countries.
589cf9e7cd4d74221a00000d	News Alert: Federal appeals court rules that previously barred refugees immigrants can continue entering the U.S.	2017-02-09T18:23:11-05:00	https://www.washingtonpost.com/world/national-security/federal-appeals-court-maintains-suspension-of-trumps-immigration-order/2017/02/09/e8526e70-ed47-11e6-9662-6eedf1627882_story.html	The Washington Post		['immigration ban' 'justice department' 'trump’s' 'ones' 'five' 'four' 'countries' 'intervene' 'supreme court' 'appeals court decision' 'votes' 'death' 'justice' 'justices' 'enforcement' 'appeals' 'court' 'antonin scalia' 'muslim-majority' 'others' 'panel' 'seven' 'refugees immigrants' 'overturn' 'federal appeals court rules' 'circuit' 'liberal justices' 'u.s.' 'refugees' 'states']	A panel with the U.S. Court of Appeals for the 9th Circuit decided to continue halting enforcement of President Trump’s immigration ban.
589d2802cd4d74221a000018	News Alert: National security adviser Flynn discussed sanctions with Russian envoy before Trump took office despite denials officials say	2017-02-09T21:39:51-05:00	https://www.washingtonpost.com/world/national-security/national-security-adviser-flynn-discussed-sanctions-with-russian-ambassador-despite-denials-officials-say/2017/02/09/f85b29d6-ee11-11e6-b4ff-ac2cf509efe5_story.html	The Washington Post		['obama' 'trump' '2016' 'u.s.' 'details contradict' 'public statements' 'flynn' 'election' 'sanctions' 'administration officials' 'michael flynn’s' 'mike pence' 'russian ambassador' 'kremlin' 'russian' 'envoy' 'illegal signal' 'reprieve' 'administration' 'interference' 'russia' 'denials officials' 'vice president-elect' 'contact' 'officials' 'national security adviser' 'punish']	Michael Flynn’s contact with the Russian ambassador was interpreted by some senior U.S. officials as an inappropriate and potentially illegal signal to the Kremlin that it could expect a reprieve from sanctions that were imposed by the Obama administration in late December to punish Russia for its alleged interference in the 2016 election.
589d4619cd4d74221a00001d	News Alert: Trump agrees to follow one-China policy in a call with President Xi Jinping. Earlier Trump questioned that bedrock policy.	2017-02-09T23:48:18-05:00	https://www.washingtonpost.com/news/world/wp/2017/02/09/trump-agrees-to-follow-one-china-policy-in-a-call-with-president-xi-jinping-earlier-trump-questioned-that-bedrock-policy/	The Washington Post		\['beijing' 'diplomatic ties' 'policy forms' 'one-china policy' 'alert trump' 'trump' 'call' 'u.s.-china' 'earlier trump' 'agreed' 'bedrock policy' 'agrees' 'bedrock' 'donald trump' \xi's\ 'white house' 'statement' 'tension' 'china’s xi jinping' 'request' 'xi jinping' 'cordial” conversation']|President Donald Trump held an “extremely cordial” conversation with China’s Xi Jinping late Thursday evening and agreed at Xi's request to honor the one-China policy the White House said in a statement.
